IPO_Ticker,IPO_Name,Typo_Ticker,Typo_Name,Distance,Keyboard_Proximate,IPO_Date,Date,Data_Source,Typo_Open,Typo_High,Typo_Close,Typo_Volume,Avg_Volume_5d,Volume_Spike_Ratio,Gap_Up_Pct,Intraday_High_Pct,Reversion_From_High_Pct,Day_Return
AMIX,"AUTONOMIX MEDICAL, INC.",ANIX,"Anixa Biosciences, Inc. - Common Stock",1,True,1/29/2024,4.369999885559082,4.670000076293945,4.440000057220459,94200,137540.0,0.6848916678784354,-0.0022831572193035,0.06864993102774014,-0.049250538611556406,0.013698616715036242,2024-01-29,yfinance
HAO,HAOXI HEALTH TECHNOLOGY LTD,HAL,Halliburton Company Common Stock,1,True,1/26/2024,35.06344369662073,36.00493729895607,35.691104888916016,8835500,12212500.0,0.7234800409416582,-0.0035134794573610877,0.02685114475581528,-0.008716371519668108,0.014324355382867452,2024-01-26,yfinance
HAO,HAOXI HEALTH TECHNOLOGY LTD,HZO,"MarineMax, Inc.  (FL) Common Stock",1,True,1/26/2024,28.8700008392334,29.290000915527344,28.010000228881836,1169900,610840.0,1.9152314845131295,0.01762425044797816,0.014547975894866576,-0.043700943893345806,-0.012689481836521873,2024-01-26,yfinance
YIBO,PLANET IMAGE INTERNATIONAL LTD,GIBO,GIBO Holdings Limited - Class A Ordinary Shares,1,True,1/25/2024,2088.0,2088.60009765625,2088.0,751,21.2,35.424528301886795,0.0009587727708533077,0.0002874030920737548,-0.0002873205152692502,0.0009587727708533077,2024-01-25,yfinance
CGON,"CG ONCOLOGY, INC.",CBON,VanEck China Bond ETF,1,True,1/25/2024,21.189436157815457,21.208682225667424,21.146133422851562,5300,5740.0,0.9233449477351916,0.00022752684910834047,0.0009082859831014388,-0.0029492074118665813,-0.0018165382773137994,2024-01-25,yfinance
JL,J-LONG GROUP LTD,HL,Hecla Mining Company Common Stock,1,True,1/24/2024,4.120274252269218,4.14008324493268,3.8924708366394043,4860600,5261020.0,0.9238892838270906,0.029702890370426407,0.004807687899064541,-0.05980855785843072,-0.02722774607472937,2024-01-24,yfinance
JL,J-LONG GROUP LTD,NL,"NL Industries, Inc. Common Stock",1,True,1/24/2024,4.24203750021183,4.364639816699043,4.233863830566406,12300,22820.0,0.5390008764241893,-0.0038384928773412957,0.02890175216062817,-0.02996260668114924,-0.0057579231210158205,2024-01-24,yfinance
JL,J-LONG GROUP LTD,UL,Unilever PLC American Depositary Shares (each representing One Ordinary Share),1,True,1/24/2024,50.12289504914903,50.154484337954024,49.60692596435547,2223641,2407297.0,0.9237086242370592,0.0027385900612684616,0.0006302367166545135,-0.010917436014474076,-0.0075836810703924,2024-01-24,yfinance
SYNX,SILYNXCOM LTD.,SYBX,"Synlogic, Inc. - Common Stock",1,True,1/12/2024,3.7899999618530273,3.9600000381469727,3.7799999713897705,11100,23420.0,0.4739538855678907,-0.001580622222244554,0.0448549018482913,-0.04545456187455763,-0.004214971656703877,2024-01-12,yfinance
SDHC,SMITH DOUGLAS HOMES CORP.,SCHC,Schwab International Small-Cap Equity ETF,1,True,1/11/2024,31.855882734259964,31.902386962949112,31.80007553100586,279800,582280.0,0.48052483341347807,-0.0008750720043545496,0.0014598317389941412,-0.003207014950388375,-0.002625403910019481,2024-01-11,yfinance
BRRR,COINSHARES BITCOIN ETF,GRRR,Gorilla Technology Group Inc. - Ordinary shares,1,True,1/11/2024,5.289999961853027,5.409999847412109,5.380000114440918,37530,85318.0,0.439883729107574,0.017307722286360898,0.0226842885490395,-0.00554523730449676,0.034615444572721796,2024-01-11,yfinance
WETH,WETOUCH TECHNOLOGY INC.,AETH,Bitwise Trendwise Ether and Treasuries Rotation Strategy ETF,1,True,2/21/2024,33.61564748623737,33.887976522614956,33.73649215698242,3800,6600.0,0.5757575757575758,-0.03157802193704506,0.00810125809681575,-0.004470150807955197,-0.028096648117629526,2024-02-21,yfinance
WETH,WETOUCH TECHNOLOGY INC.,EETH,ProShares Ether ETF,1,True,2/21/2024,41.60777963055805,42.319343398599436,41.94795608520508,68200,62980.0,1.0828834550651,-0.03384288549955044,0.01710170007530977,-0.008775828818900084,-0.02594378814898224,2024-02-21,yfinance
WETH,WETOUCH TECHNOLOGY INC.,SETH,ProShares Short Ether ETF,1,True,2/21/2024,91.42405063986924,91.42405063986924,90.9190673828125,450,2540.0,0.17716535433070865,0.03251620148110451,0.0,-0.0055235274910967165,0.026813069857220873,2024-02-21,yfinance
CHRO,PELTHOS THERAPEUTICS INC.,CGRO,CoreValues Alpha Greater China Growth ETF,1,True,2/16/2024,18.31920051574707,18.31920051574707,18.31920051574707,100,280.0,0.35714285714285715,0.00828523932575482,0.0,0.0,0.00828523932575482,2024-02-16,yfinance
TELO,"TELOMIR PHARMACEUTICALS, INC.",TWLO,Twilio Inc. Class A Common Stock,1,True,2/09/2024,71.69000244140625,72.58999633789062,71.5999984741211,3310900,2363860.0,1.4006328631983282,0.018902811533788047,0.012553966603920247,-0.013638213441440426,0.017623619286710173,2024-02-09,yfinance
MGX,"METAGENOMI, INC.",MTX,Minerals Technologies Inc. Common Stock,1,True,2/09/2024,68.83692781482593,70.14020839596891,70.13033294677734,135600,292900.0,0.4629566404916354,0.00014363814884109743,0.01893286964590956,-0.00014079583476310321,0.01893574516660463,2024-02-09,yfinance
PMNT,PERFECT MOMENT LTD.,PNNT,PennantPark Investment Corporation Common Stock,1,True,2/08/2024,5.3067521057823,5.314454389774369,5.206624984741211,478300,481140.0,0.9940973521220435,0.007309972594484549,0.00145141205741956,-0.020289835442116922,-0.011695823331420219,2024-02-08,yfinance
AHR,"AMERICAN HEALTHCARE REIT, INC.",AUR,"Aurora Innovation, Inc.  - Class A Common Stock",1,True,2/07/2024,3.1700000762939453,3.180000066757202,3.0799999237060547,3293200,3909000.0,0.8424661038628806,0.0031645538581142403,0.003154571048133175,-0.031446585204987866,-0.025316506313829312,2024-02-07,yfinance
AHR,"AMERICAN HEALTHCARE REIT, INC.",ABR,Arbor Realty Trust Common Stock,1,True,2/07/2024,9.84086256326035,9.84868536760249,9.58271598815918,9332600,8502420.0,1.097640436487494,0.0015924606093407623,0.0007949307585440651,-0.0270055717606965,-0.024681421552040936,2024-02-07,yfinance
AHR,"AMERICAN HEALTHCARE REIT, INC.",WHR,Whirlpool Corporation Common Stock,1,True,2/07/2024,96.89463780533393,97.01775624892969,95.90089416503906,866000,1495280.0,0.5791557434059172,0.008697311192973838,0.0012706424873903577,-0.011511934794956104,-0.0016478075946560107,2024-02-07,yfinance
GUTS,"FRACTYL HEALTH, INC.",GITS,"Global Interactive Technologies, Inc. Common Stock - Common Stock",1,True,2/02/2024,0.5009999871253967,0.5080000162124634,0.5,288100,191060.0,1.5079032764576572,0.022448933417477248,0.01397211430529357,-0.01574806290777261,0.02040814340536656,2024-02-02,yfinance
AS,"AMER SPORTS, INC.",AZ,A2Z Cust2Mate Solutions Corp. - Common Shares,1,True,2/01/2024,2.8499999046325684,3.0,2.8499999046325684,6240,18288.0,0.34120734908136485,-0.033898353028728144,0.05263161417079772,-0.05000003178914388,-0.033898353028728144,2024-02-01,yfinance
AS,"AMER SPORTS, INC.",QS,QuantumScape Corporation - Common Stock,1,True,2/01/2024,6.909999847412109,7.039999961853027,6.96999979019165,6047500,7285060.0,0.8301235679596325,0.014684273931396366,0.018813331014703973,-0.009943206255778433,0.023494838290234184,2024-02-01,yfinance
AS,"AMER SPORTS, INC.",ZS,"Zscaler, Inc. - Common Stock",1,True,2/01/2024,236.61000061035156,240.36000061035156,238.05999755859375,1033500,1533420.0,0.6739836444027076,0.003988638556921395,0.015848865180366933,-0.009568992535851901,0.010141296763345808,2024-02-01,yfinance
AS,"AMER SPORTS, INC.",AA,Alcoa Corporation Common Stock ,1,True,2/01/2024,29.35335261846,29.670502286678982,28.972774505615234,4174600,4986280.0,0.8372173243379835,0.011092373846586852,0.010804546667678746,-0.023515873587923817,-0.0020168485496403076,2024-02-01,yfinance
AS,"AMER SPORTS, INC.",AD,"Array Digital Infrastructure, Inc. Common Shares",1,True,2/01/2024,31.3746048006187,31.3746048006187,30.858551025390625,128300,216220.0,0.5933771159004717,0.01328828123443987,0.0,-0.016448136271596966,-0.0033784224977164664,2024-02-01,yfinance
AS,"AMER SPORTS, INC.",AX,"Axos Financial, Inc. Common Stock",1,True,2/01/2024,56.2599983215332,56.27000045776367,54.290000915527344,1432300,813580.0,1.7604906708621155,0.01497380501150603,0.00017778415444140688,-0.03518748047145509,-0.020566469120910143,2024-02-01,yfinance
AS,"AMER SPORTS, INC.",WS,"Worthington Steel, Inc. Common Shares",1,True,2/01/2024,28.673348038863132,29.61408681231373,29.22051239013672,110700,146760.0,0.7542927228127555,-0.0026710514063775187,0.03280882205229552,-0.013290108341728774,0.01636065868286514,2024-02-01,yfinance
BOLD,"BOUNDLESS BIO, INC.",BILD,Nomura Global Listed Infrastructure ETF,1,True,3/28/2024,23.402517318725586,23.402517318725586,23.402517318725586,0,200.0,0.0,-0.004117403130275047,0.0,0.0,-0.004117403130275047,2024-03-28,yfinance
BOLD,"BOUNDLESS BIO, INC.",GOLD,"Gold.com, Inc. Common Stock",1,True,3/28/2024,28.75868472063212,29.59751860710576,29.25436019897461,410900,234200.0,1.7544833475661827,0.003993331062089518,0.02916801983895455,-0.0115941614121923,0.02129783853387386,2024-03-28,yfinance
MMA,MIXED MARTIAL ARTS GROUP LTD,MMS,"Maximus, Inc. Common Stock",1,True,3/28/2024,81.57717293198051,82.52189541654816,81.7135238647461,344500,268000.0,1.2854477611940298,0.003234017829825707,0.011580721059742576,-0.009795843245257852,0.004910858166365876,2024-03-28,yfinance
MMA,MIXED MARTIAL ARTS GROUP LTD,MNA,NYLI Merger Arbitrage ETF,1,True,3/28/2024,31.450000762939453,31.510000228881836,31.479999542236328,125300,37360.0,3.3538543897216275,-0.0003178106110669876,0.001907773115639664,-0.0009521004896093083,0.0006357424776132071,2024-03-28,yfinance
INTJ,INTELLIGENT GROUP LTD,IBTJ,iShares iBonds Dec 2029 Term Treasury ETF,1,True,3/20/2024,19.919772055803378,19.966358184814453,19.966358184814453,30700,42760.0,0.7179607109448082,-3.397652765604853e-07,0.0023386878564959726,0.0,0.0023383472966144857,2024-03-20,yfinance
INTJ,INTELLIGENT GROUP LTD,INTU,Intuit Inc. - Common Stock,1,True,3/20/2024,628.2155971516737,635.128837083496,632.6266479492188,1335500,1743300.0,0.7660758331899271,0.00100846392403092,0.011004565889746947,-0.00393965600076875,0.00803710059456455,2024-03-20,yfinance
ALAB,"ASTERA LABS, INC.",SLAB,"Silicon Laboratories, Inc. - Common Stock",1,True,3/20/2024,128.60000610351562,132.6999969482422,131.60000610351562,176000,290980.0,0.6048525671867482,-0.0033325015876094328,0.03188173133853746,-0.008289305727381431,0.01991790551447415,2024-03-20,yfinance
ALAB,"ASTERA LABS, INC.",ZLAB,Zai Lab Limited - American Depositary Shares,1,True,3/20/2024,18.010000228881836,18.079999923706055,17.209999084472656,921900,569560.0,1.618617880469134,-0.014230991919398184,0.0038867126004786695,-0.04811951564737976,-0.05801868345551013,2024-03-20,yfinance
ZONE,"CLEANCORE SOLUTIONS, INC.",XONE,BondBloxx Bloomberg One Year Target Duration US Treasury ETF,1,True,4/26/2024,45.82557784869109,45.8329896928729,45.823726654052734,23900,26320.0,0.9080547112462006,4.039816866775407e-05,0.00016174033214120772,-0.00020210418046558208,0.0,2024-04-26,yfinance
MRX,MAREX GROUP PLC,MTX,Minerals Technologies Inc. Common Stock,1,True,4/25/2024,70.9928931677844,71.51693418614698,70.3798599243164,111600,132820.0,0.8402349043818702,-0.004160772819623984,0.007381598283705161,-0.015899370894045275,-0.012759979362287845,2024-04-25,yfinance
NCI,NEO-CONCEPT INTERNATIONAL GROUP HOLDINGS LTD,BCI,abrdn Bloomberg All Commodity Strategy K-1 Free ETF,1,True,4/23/2024,19.64424879685411,19.87638150680022,19.857038497924805,108700,161040.0,0.6749875807252856,-0.00926835799810496,0.011816828036879945,-0.0009731655064479023,0.0014634084401526262,2024-04-23,yfinance
NCI,NEO-CONCEPT INTERNATIONAL GROUP HOLDINGS LTD,HCI,"HCI Group, Inc. Common Stock",1,True,4/23/2024,110.93259526297493,113.90540189117873,112.25275421142578,118700,123220.0,0.9633176432397338,0.0015892394870878205,0.026798314969162254,-0.014508949113158197,0.013508702779607423,2024-04-23,yfinance
NCI,NEO-CONCEPT INTERNATIONAL GROUP HOLDINGS LTD,JCI,Johnson Controls International plc Ordinary Share,1,True,4/23/2024,63.37177330724537,63.958095098785094,63.684478759765625,2654700,3850920.0,0.6893677355021657,0.0032486258978888425,0.009252096965900897,-0.00427805641485821,0.008199115669268738,2024-04-23,yfinance
NCI,NEO-CONCEPT INTERNATIONAL GROUP HOLDINGS LTD,MCI,Barings Corporate Investors Common Stock,1,True,4/23/2024,15.288208831009491,15.417916153016225,15.366033554077148,20900,23160.0,0.9024179620034543,0.003975159298848384,0.008484141173140248,-0.0033650850364059823,0.009085901152449845,2024-04-23,yfinance
MFI,MF INTERNATIONAL LTD,MCI,Barings Corporate Investors Common Stock,1,True,4/22/2024,15.02879010412351,15.227676391601562,15.227676391601562,31600,24640.0,1.2824675324675325,-0.010250658067595973,0.013233685885564579,0.0,0.0028473738289817134,2024-04-22,yfinance
YYGH,YY GROUP HOLDING LTD.,HYGH,iShares Interest Rate Hedged High Yield Bond ETF,1,True,4/22/2024,74.69582118424458,75.06568805807295,75.00404357910156,24600,24300.0,1.0123456790123457,0.0010620164960051183,0.004951640774067648,-0.0008212071395881726,0.0051927660778818795,2024-04-22,yfinance
MTEN,MINGTENG INTERNATIONAL CORP INC.,MTRN,Materion Corporation,1,True,4/18/2024,119.9097268377316,120.37549310209451,118.67098999023438,103700,88280.0,1.1746714997734482,0.0009927072598465995,0.0038843076091167545,-0.014159884773344088,-0.009348126492837722,2024-04-18,yfinance
CDTG,CDT ENVIRONMENTAL TECHNOLOGY INVESTMENT HOLDINGS LTD,CCTG,CCSC Technology International Holdings Limited - Class A Ordinary Shares,1,True,4/18/2024,2.6700000762939453,2.6700000762939453,2.4000000953674316,109000,99800.0,1.092184368737475,0.0809716782862743,0.0,-0.1011235854724331,-0.028340053616187213,2024-04-18,yfinance
IBTA,"IBOTTA, INC.",INTA,"Intapp, Inc. - Common Stock",1,True,4/18/2024,31.299999237060547,31.639999389648438,30.860000610351562,568900,453660.0,1.2540228364854737,0.00288369609830161,0.010862624948096351,-0.024652300706177157,-0.011214305811858295,2024-04-18,yfinance
CTRI,"CENTURI HOLDINGS, INC.",FTRI,First Trust Indxx Global Natural Resources Income ETF,1,True,4/18/2024,12.526171684265137,12.592098615290682,12.526171684265137,50800,65880.0,0.7710989678202793,0.00453171985934797,0.005263134873710888,-0.005235579313641184,0.00453171985934797,2024-04-18,yfinance
ULS,UL SOLUTIONS INC.,JLS,Nuveen Mortgage and Income Fund,1,True,4/12/2024,14.699687013807353,14.741999800232735,14.606596946716309,34200,13340.0,2.5637181409295353,0.0018455882552940318,0.002878482132690191,-0.009184836206163075,-0.004498891932478078,2024-04-12,yfinance
ULS,UL SOLUTIONS INC.,UPS,"United Parcel Service, Inc. Common Stock",1,True,4/12/2024,133.6362380973749,133.8618987446946,130.80194091796875,4123900,3098320.0,1.3310116450205272,-0.0064425361388095225,0.0016886186750877446,-0.02285906486775518,-0.02751494252717086,2024-04-12,yfinance
BOW,BOWHEAD SPECIALTY HOLDINGS INC.,BLW,Blackrock Limited Duration Income Trust,1,True,5/23/2024,11.842903321593953,11.877255437794336,11.782787322998047,73000,80380.0,0.9081861159492411,0.0029092006180908344,0.0029006498885916186,-0.007953699008247658,-0.0021816868491948338,2024-05-23,yfinance
BOW,BOWHEAD SPECIALTY HOLDINGS INC.,NOW,"ServiceNow, Inc. Common Stock",1,True,5/23/2024,156.33599853515625,156.33599853515625,151.6300048828125,4307500,4346500.0,0.9910272633153112,0.014075724633126813,0.0,-0.030101791631090544,-0.016449771527926725,2024-05-23,yfinance
HDL,SUPER HI INTERNATIONAL HOLDING LTD.,BDL,"Flanigan's Enterprises, Inc. Common Stock",1,True,5/17/2024,26.04955025173518,28.133514124657477,27.458154678344727,6100,1000.0,6.1,-0.004057606310740024,0.07999999434859657,-0.024005513257969974,0.049797022688290456,2024-05-17,yfinance
HDL,SUPER HI INTERNATIONAL HOLDING LTD.,GDL,"GDL Fund, The Common Shares of Beneficial Interest",1,True,5/17/2024,7.095499182558247,7.18577262142892,7.167717933654785,27500,9460.0,2.9069767441860463,-0.005063276214235151,0.012722633961057737,-0.002512560405862734,0.0050632963866770585,2024-05-17,yfinance
HDL,SUPER HI INTERNATIONAL HOLDING LTD.,HRL,Hormel Foods Corporation Common Stock,1,True,5/17/2024,34.0040753108468,34.23020540546609,34.211360931396484,2887600,1672360.0,1.7266617235523452,3.5706518873731295e-08,0.006650088042451604,-0.0005505217934390066,0.006095941154799368,2024-05-17,yfinance
HDL,SUPER HI INTERNATIONAL HOLDING LTD.,HXL,Hexcel Corporation Common Stock,1,True,5/17/2024,71.34463849346213,71.61029581419741,70.81331634521484,469500,687500.0,0.6829090909090909,0.000966410748653004,0.003723577921831234,-0.011129397804059369,-0.006488047426660113,2024-05-17,yfinance
RAY,RAYTECH HOLDING LTD,DAY,"Dayforce, Inc. Common Stock",1,True,5/15/2024,62.810001373291016,63.18000030517578,62.599998474121094,1904600,1718660.0,1.108188937893475,0.011433219269172786,0.005890764588362228,-0.009180149228444576,0.008051529988496937,2024-05-15,yfinance
ZK,ZEEKR INTELLIGENT TECHNOLOGY HOLDING LTD,ZM,"Zoom Communications, Inc. - Class A Common Stock",1,True,5/10/2024,61.279998779296875,62.08000183105469,61.970001220703125,2242500,2670300.0,0.8397932816537468,0.0024537495265950166,0.01305488034748606,-0.001771916995925992,0.013741209519232708,2024-05-10,yfinance
PAL,"PROFICIENT AUTO LOGISTICS, INC",PSL,Invesco Dorsey Wright Consumer Staples Momentum ETF,1,True,5/09/2024,97.24334544135147,97.24334544135147,97.2236099243164,400,3920.0,0.10204081632653061,0.010046017015530675,0.0,-0.00020294979512980408,0.009841028383305698,2024-05-09,yfinance
SVCO,"SILVACO GROUP, INC.",SCCO,Southern Copper Corporation Common Stock,1,True,5/09/2024,104.33915027692277,108.4480784442735,108.05104064941406,788173,1380305.2,0.5710135700423355,0.00017699209273315498,0.03938050249063158,-0.003661086490006024,0.03575852920399947,2024-05-09,yfinance
VIK,VIKING HOLDINGS LTD,CIK,"Credit Suisse Asset Management Income Fund, Inc. Common Stock",1,True,5/01/2024,2.4708381556309793,2.4793877601623535,2.4793877601623535,124700,350660.0,0.3556151257628472,-6.180225179691731e-08,0.003460204186943557,0.0,0.0034601421708433497,2024-05-01,yfinance
LSH,LAKESIDE HOLDING LTD,PSH,PGIM Short Duration High Yield ETF,1,True,6/28/2024,45.21487178391228,45.21487178391228,45.1251220703125,2100,3400.0,0.6176470588235294,0.00169016085800603,0.0,-0.001984960037677538,-0.0002981540814318968,2024-06-28,yfinance
LB,LANDBRIDGE CO LLC,KB,KB Financial Group Inc,1,True,6/28/2024,54.40660197756181,54.869226312210344,54.56081008911133,201700,280860.0,0.718151392152674,0.010924128389469583,0.008503091864463894,-0.005620932603352244,0.013789455300035922,2024-06-28,yfinance
LB,LANDBRIDGE CO LLC,LH,Labcorp Holdings Inc. Common Stock,1,True,6/28/2024,201.69182398924454,201.97690223510543,200.0502166748047,712500,654620.0,1.0884177079832575,0.0013664640176892042,0.0014134348146709692,-0.009539138084502538,-0.006783844107115449,2024-06-28,yfinance
LB,LANDBRIDGE CO LLC,PB,"Prosperity Bancshares, Inc. Common Stock",1,True,6/28/2024,57.80688853816455,58.930832312423874,58.235511779785156,874300,599140.0,1.4592582701872685,0.00763747468716784,0.019443076814578727,-0.011798926052027427,0.015108847938708161,2024-06-28,yfinance
RECT,RECTITUDE HOLDINGS LTD.,DECT,AllianzIM U.S. Large Cap Buffer10 Dec ETF,1,True,6/21/2024,30.950000762939453,31.010000228881836,30.993999481201172,1500,1560.0,0.9615384615384616,-0.0012907069530213072,0.001938593359074425,-0.000515986699856952,0.00012906454057916557,2024-06-21,yfinance
TEM,"TEMPUS AI, INC.",FEM,First Trust Emerging Markets AlphaDEX Fund,1,True,6/14/2024,22.477227815492625,22.571077018516434,22.542922973632812,31400,40080.0,0.783433133732535,-0.002083316551506097,0.004175301500442224,-0.001247350530084345,0.0008333373556404559,2024-06-14,yfinance
TEM,"TEMPUS AI, INC.",GEM,Goldman Sachs ActiveBeta Emerging Markets Equity ETF,1,True,6/14/2024,30.747918905481445,30.90989875793457,30.90989875793457,77200,42900.0,1.7995337995337994,-0.0030892928573156555,0.005267994004766589,0.0,0.0021624267711996266,2024-06-14,yfinance
TEM,"TEMPUS AI, INC.",REM,iShares Mortgage Real Estate ETF,1,True,6/14/2024,19.0014632726783,19.113641938774318,19.053237915039062,239000,265500.0,0.9001883239171374,-0.0040704791357713795,0.005903685652321119,-0.003160257157099864,-0.0013567989302362222,2024-06-14,yfinance
TEM,"TEMPUS AI, INC.",TSM,Taiwan Semiconductor Manufacturing Company Ltd.,1,True,6/14/2024,168.55391909241558,170.1610605135459,169.05369567871094,9192500,14770420.0,0.6223587413221832,-0.005262715737689465,0.009534880172374612,-0.006507745259067661,-0.002313235791650649,2024-06-14,yfinance
TEM,"TEMPUS AI, INC.",TWM,ProShares UltraShort Russell2000,1,True,6/14/2024,53.368384647108975,54.18873696550299,53.73298645019531,938760,874068.0,1.0740125482227927,0.025393915253092383,0.015371503631194397,-0.008410428823941997,0.03239919511770018,2024-06-14,yfinance
WAY,WAYSTAR HOLDING CORP.,SAY,Saratoga Investment Corp 8.125% Notes due 2027,1,True,6/07/2024,22.173838969664054,22.224374404118905,22.200437545776367,2500,4460.0,0.5605381165919282,-0.0023934120916253936,0.0022790566182061705,-0.0010770543146582864,-0.0011967354676574646,2024-06-07,yfinance
WAY,WAYSTAR HOLDING CORP.,WAT,Waters Corporation Common Stock,1,True,6/07/2024,300.6300048828125,304.67999267578125,302.0899963378906,453600,661660.0,0.6855484690022066,0.0002662355451462173,0.013471668586598538,-0.008500710253878451,0.005123968083414784,2024-06-07,yfinance
RAPP,"RAPPORT THERAPEUTICS, INC.",DAPP,VanEck Digital Transformation ETF,1,True,6/07/2024,11.163826452821118,11.530486387269372,10.768219947814941,331400,168660.0,1.9648997984110044,-0.006866895268179544,0.032843571690923105,-0.06610878447383077,-0.042060018184346376,2024-06-07,yfinance
GAUZ,GAUZY LTD.,HAUZ,Xtrackers International Real Estate ETF,1,True,6/06/2024,19.538722924719657,19.63015214334466,19.602724075317383,64500,60000.0,1.075,-0.007892377662928675,0.0046793855963497746,-0.0013972417445870804,-0.00464262436067914,2024-06-06,yfinance
FLYE,"FLY-E GROUP, INC.",FLYW,Flywire Corporation - Voting Common Stock,1,True,6/06/2024,17.239999771118164,17.674999237060547,17.3700008392334,887700,1096260.0,0.8097531607465382,-0.0017371561001911324,0.025231987918650032,-0.017255921413995567,0.005790409891087856,2024-06-06,yfinance
CON,"CONCENTRA GROUP HOLDINGS PARENT, INC.",DON,WisdomTree U.S. MidCap Dividend Fund,1,True,7/25/2024,46.77608931948295,47.73031161709727,47.142356872558594,172900,210940.0,0.8196643595335167,0.0020648494955495117,0.020399787829566893,-0.012318267461888284,0.009911248067714413,2024-07-25,yfinance
LINE,"LINEAGE, INC.",LIND,Lindblad Expeditions Holdings Inc.  - Common Stock,1,True,7/25/2024,9.739999771118164,10.140000343322754,9.520000457763672,175600,210040.0,0.8360312321462579,-0.0030706944974263485,0.041067821519945404,-0.061143970864592265,-0.025588535136796133,2024-07-25,yfinance
LINE,"LINEAGE, INC.",PINE,"Alpine Income Property Trust, Inc. Common Stock",1,True,7/25/2024,15.504251840023729,15.765964155290991,15.486202239990234,58300,45140.0,1.2915374390784227,0.006444158714194076,0.016880035100543214,-0.017744675336387197,0.005272485633269057,2024-07-25,yfinance
NVA,NOVA MINERALS LTD,JVA,"Coffee Holding Co., Inc. - Common Stock",1,True,7/24/2024,2.619999885559082,2.799999952316284,2.430000066757202,106600,153780.0,0.6931980751723241,-0.060931927820184195,0.06870231855708342,-0.13214281852147952,-0.1290322222286788,2024-07-24,yfinance
NVA,NOVA MINERALS LTD,NCA,Nuveen California Municipal Value Fund,1,True,7/24/2024,8.269379615783691,8.288281487525092,8.269379615783691,67200,50020.0,1.3434626149540183,-0.0045508324575918805,0.002285766601562543,-0.0022805537878811373,-0.0045508324575918805,2024-07-24,yfinance
NVA,NOVA MINERALS LTD,NVS,Novartis AG Common Stock,1,True,7/24/2024,104.36719108369584,105.85195385339476,105.36988830566406,2212300,1945080.0,1.1373825241121187,0.005106751848583591,0.014226336402100087,-0.004554148791607197,0.01476321320770812,2024-07-24,yfinance
OS,"ONESTREAM, INC.",OZ,"Belpointe PREP, LLC Class A Units",1,True,7/24/2024,67.0,71.98999786376953,71.0,10000,3940.0,2.5380710659898478,0.00754908257501756,0.07447758005626166,-0.013751880721582413,0.06770126660934697,2024-07-24,yfinance
PGHL,"DIRECTBOOKING TECHNOLOGY CO., LTD.",LGHL,Lion Group Holding Ltd. - American Depositary Share,1,True,7/23/2024,234.0,234.0,224.89999389648438,355,217.6,1.631433823529412,0.01123598172901735,0.0,-0.038888914972288996,-0.028089888381361592,2024-07-23,yfinance
ARDT,"ARDENT HEALTH, INC.",ARCT,Arcturus Therapeutics Holdings Inc. - Common Stock,1,True,7/18/2024,24.3799991607666,25.010000228881836,23.420000076293945,400100,478740.0,0.8357354722814053,0.004118553183406413,0.025840897858973703,-0.06357457569119652,-0.035420122983134024,2024-07-18,yfinance
ICON,ICON ENERGY CORP,UCON,First Trust Smith Unconstrained Bond ETF,1,True,7/12/2024,23.045933027045585,23.045933027045585,22.99937629699707,522100,682140.0,0.765385404755622,0.004056888596391533,0.0,-0.0020201711943655344,0.002028521792544819,2024-07-12,yfinance
AZI,AUTOZI INTERNET TECHNOLOGY (GLOBAL) LTD.,AZO,"AutoZone, Inc. Common Stock",1,True,8/28/2024,3190.199951171875,3211.330078125,3196.699951171875,60600,86180.0,0.7031793919702948,0.0026242133536634868,0.0066234490867455335,-0.0045557842380584855,0.0046670500054554415,2024-08-28,yfinance
SPAI,SAFE PRO GROUP INC.,SLAI,SOLAI Limited American Depositary Shares (each representing one hundred (100) Class A Ordinary Shares),1,True,8/28/2024,2.5,2.569999933242798,2.430000066757202,20800,65940.0,0.3154382772217167,0.004016060411629196,0.02799997329711914,-0.05447465763508616,-0.02409636246977518,2024-08-28,yfinance
WOK,WORK MEDICAL TECHNOLOGY GROUP LTD,AOK,iShares Core 30/70 Conservative Allocation ETF,1,True,8/23/2024,36.24373042545464,36.37687395882861,36.357852935791016,34700,64700.0,0.5363214837712519,0.004480688789561564,0.0036735604147540646,-0.0005228877846711995,0.00764354913653522,2024-08-23,yfinance
WOK,WORK MEDICAL TECHNOLOGY GROUP LTD,WLK,Westlake Corporation Common Stock,1,True,8/23/2024,142.7662791291518,146.84947889891066,146.4227294921875,475200,308640.0,1.5396578538102643,0.018121272389833534,0.02860058968172061,-0.0029060328298265866,0.04419682691679906,2024-08-23,yfinance
YXT,YXT.COM GROUP HOLDING LTD,TXT,Textron Inc. Common Stock,1,True,8/16/2024,87.71963124433042,87.96926025049986,87.80950164794922,683400,765640.0,0.8925865942218275,0.00045565145520495967,0.0028457598672996776,-0.0018160730475135604,0.0014806369906383819,2024-08-16,yfinance
CEP,"CANTOR EQUITY PARTNERS, INC.",FEP,First Trust Europe AlphaDEX Fund,1,True,8/13/2024,34.82094054612926,35.181780340539504,35.16278839111328,17400,13940.0,1.248206599713056,0.0008188729163185296,0.010362723945730921,-0.0005398234325378514,0.010644218514681877,2024-08-13,yfinance
CEP,"CANTOR EQUITY PARTNERS, INC.",CDP,COPT Defense Properties Common Shares of Beneficial Interest,1,True,8/13/2024,27.281217108248647,27.452080971998097,27.423603057861328,447600,656540.0,0.6817558716909861,0.007713812957616188,0.006263058685082923,-0.001037368138532626,0.01297326628869218,2024-08-13,yfinance
FDSB,"FIFTH DISTRICT BANCORP, INC.",TDSB,ETC Cabana Target Beta ETF,1,True,8/01/2024,21.534378292489674,21.56326939463896,21.5401554107666,10100,7000.0,1.4428571428571428,-0.0009827941195180423,0.0013416269444548568,-0.0010719146271068961,-0.0007147835700298098,2024-08-01,yfinance
BKV,BKV CORP,BIV,Vanguard Intermediate-Term Bond ETF,1,True,9/26/2024,74.28009991143666,74.31802297537777,74.19477844238281,885700,1090280.0,0.8123601276736251,0.0003827717463989572,0.0005105413695770862,-0.0016583397682119702,-0.0007663129721640769,2024-09-26,yfinance
BKV,BKV CORP,BLV,Vanguard Long-Term Bond ETF,1,True,9/26/2024,70.64185441361947,70.71707990005447,70.5854263305664,450400,564700.0,0.7975916415795998,0.0020004083790692477,0.0010648854996719761,-0.001861694086833529,0.001200019392503845,2024-09-26,yfinance
IBG,INNOVATION BEVERAGE GROUP LTD,IHG,Intercontinental Hotels Group American Depositary Shares (Each representing one Ordinary Share),1,True,9/26/2024,109.01772425276225,110.03994347039344,109.75761413574219,217700,179340.0,1.213895394223263,0.010832319312654536,0.009376633245995214,-0.0025656986522099856,0.017692713909725103,2024-09-26,yfinance
IBG,INNOVATION BEVERAGE GROUP LTD,ING,"ING Group, N.V. Common Stock",1,True,9/26/2024,17.52019883808146,17.66256377252095,17.634090423583984,1704600,1750420.0,0.9738234252350865,0.024417266265989404,0.008125760201422538,-0.001612073383212048,0.031076580338247523,2024-09-26,yfinance
GRDN,"GUARDIAN PHARMACY SERVICES, INC.",VRDN,"Viridian Therapeutics, Inc.  - Common Stock",1,True,9/26/2024,21.81999969482422,23.360000610351562,23.059999465942383,1327400,1684480.0,0.7880176671732523,0.019626172139286722,0.07057749482428441,-0.012842514407993619,0.07757008771040885,2024-09-26,yfinance
PC,PREMIUM CATERING (HOLDINGS) LTD,LC,LendingClub Corporation Common Stock,1,True,9/25/2024,10.930000305175781,10.930000305175781,10.579999923706055,1459700,1355080.0,1.0772057738288514,0.0036730909634501044,0.0,-0.0320219919210787,-0.02846652064678558,2024-09-25,yfinance
PC,PREMIUM CATERING (HOLDINGS) LTD,OC,Owens Corning Inc Common Stock New,1,True,9/25/2024,170.6940536248106,170.6940536248106,166.53817749023438,527900,947940.0,0.5568917863999832,0.0008026294612605802,0.0,-0.02434692976306569,-0.023563841864924186,2024-09-25,yfinance
PC,PREMIUM CATERING (HOLDINGS) LTD,PD,"PagerDuty, Inc. Common Stock",1,True,9/25/2024,17.84000015258789,18.239999771118164,17.780000686645508,709200,1115940.0,0.6355180386042261,-0.006128167447138818,0.02242150308907083,-0.025219248368688822,-0.009470755936954426,2024-09-25,yfinance
PC,PREMIUM CATERING (HOLDINGS) LTD,PX,"P10, Inc. Class A Common Stock",1,True,9/25/2024,10.767491613661244,10.777334153400728,10.718280792236328,509400,615660.0,0.8274047363804697,0.0036696916636281937,0.0009140977390682535,-0.005479403377853532,-0.0009173943298629989,2024-09-25,yfinance
GLE,GLOBAL ENGINE GROUP HOLDING LTD,BLE,BlackRock Municipal Income Trust II,1,True,9/20/2024,10.479455171160454,10.488704681396484,10.488704681396484,20100,81700.0,0.2460220318237454,-0.0008818543868849245,0.000882632740439089,0.0,0.0,2024-09-20,yfinance
GLE,GLOBAL ENGINE GROUP HOLDING LTD,GLW,Corning Incorporated Common Stock,1,True,9/20/2024,42.98093357280399,43.42966687913691,43.41015625,10034500,4566820.0,2.19726198974341,-0.008327646841764094,0.010440287565481198,-0.0004492465758765171,0.0015755410823151345,2024-09-20,yfinance
IBO,IMPACT BIOMEDICAL INC.,INO,"Inovio Pharmaceuticals, Inc. - Common Stock",1,True,9/16/2024,6.820000171661377,7.0,6.820000171661377,249300,178600.0,1.3958566629339306,0.0014684624032102835,0.026392936042225118,-0.025714261191231862,0.0014684624032102835,2024-09-16,yfinance
IBO,IMPACT BIOMEDICAL INC.,IBP,"Installed Building Products, Inc. Common Stock",1,True,9/16/2024,220.39054509497439,226.5820049485315,221.98992919921875,247200,242860.0,1.017870377995553,0.006046845810705084,0.028093128273216042,-0.020266727493897203,0.013347773047041026,2024-09-16,yfinance
KAPA,"KAIROS PHARMA, LTD.",KALA,"KALA BIO, Inc. - Common Stock",1,True,9/16/2024,5.929999828338623,6.0920000076293945,5.760000228881836,12900,7960.0,1.620603015075377,0.003384091614701366,0.027318749406466378,-0.054497665517362834,-0.025380646768706057,2024-09-16,yfinance
ZBIO,"ZENAS BIOPHARMA, INC.",XBIO,"Xenetic Biosciences, Inc. - Common Stock",1,True,9/13/2024,3.9649999141693115,4.130000114440918,3.990999937057495,2200,5660.0,0.38869257950530034,0.031209332813049637,0.04161417499202515,-0.03365621635151926,0.03797136732403019,2024-09-13,yfinance
ZBIO,"ZENAS BIOPHARMA, INC.",SBIO,ALPS Medical Breakthroughs ETF,1,True,9/13/2024,35.853428887121005,36.70340347290039,36.70340347290039,11400,3460.0,3.2947976878612715,0.008585942706855112,0.023706926008538805,0.0,0.03249641502385888,2024-09-13,yfinance
MBX,"MBX BIOSCIENCES, INC.",MGX,"Metagenomi, Inc. - Common Stock",1,True,9/13/2024,2.690000057220459,2.9000000953674316,2.700000047683716,115200,107120.0,1.075429424943988,0.0,0.07806692701856775,-0.06896553141608629,0.0037174684946251237,2024-09-13,yfinance
MBX,"MBX BIOSCIENCES, INC.",MBC,"MasterBrand, Inc. Common Stock",1,True,9/13/2024,16.270000457763672,16.610000610351562,16.59000015258789,507600,738160.0,0.6876557927820527,0.02006273682289646,0.02089736588947976,-0.0012041214346017145,0.04012541385429901,2024-09-13,yfinance
TDTH,TRIDENT DIGITAL TECH HOLDINGS LTD,TETH,21Shares Ethereum ETF,1,True,9/10/2024,11.729999542236328,11.930000305175781,11.899999618530273,58000,119300.0,0.4861693210393965,-0.0017021666181848405,0.017050364087339336,-0.0025147263938033715,0.012765924981299867,2024-09-10,yfinance
PLRZ,POLYRIZON LTD.,PLRX,"Pliant Therapeutics, Inc. - Common Stock",1,True,10/29/2024,14.829999923706055,15.1899995803833,14.720000267028809,321600,359520.0,0.8945260347129506,-0.00201882460728801,0.024275094978374163,-0.030941364472548086,-0.009421224285528813,2024-10-29,yfinance
GELS,GELTEQ LTD,GEOS,Geospace Technologies Corporation - Common Stock,1,True,10/29/2024,11.40999984741211,11.550000190734863,11.369999885559082,21100,22840.0,0.9238178633975481,-0.003493446508240121,0.012269968904031777,-0.015584441749202154,-0.006986893016480242,2024-10-29,yfinance
INGM,INGRAM MICRO HOLDING CORP,INGN,"Inogen, Inc - Common Stock",1,True,10/24/2024,9.1899995803833,9.520000457763672,9.260000228881836,99500,113840.0,0.874033731553057,0.0,0.03590869341112715,-0.027310947098726526,0.007617045886264941,2024-10-24,yfinance
SAG,INNEOVA HOLDINGS LTD,SAH,"Sonic Automotive, Inc. Common Stock",1,True,10/23/2024,53.156502409396616,55.04625029745943,54.0331916809082,251900,129560.0,1.9442729237418956,0.005527917459745891,0.03555064389881225,-0.01840377157529989,0.022111693620430924,2024-10-23,yfinance
SAG,INNEOVA HOLDINGS LTD,SSG,ProShares UltraShort Semiconductors,1,True,10/23/2024,102.05145615625432,107.48171998325068,105.98371124267578,10730,6708.0,1.599582587954681,0.022514077731238962,0.05321103717209005,-0.01393733502597785,0.06191367411661399,2024-10-23,yfinance
FBLA,"FB BANCORP, INC. /MD/",TBLA,Taboola.com Ltd. - Ordinary Shares,1,True,10/23/2024,3.700000047683716,3.734999895095825,3.6600000858306885,475400,680280.0,0.6988298935732346,-0.0026954151914918884,0.009459418097580857,-0.02008027078223319,-0.013477075957459443,2024-10-23,yfinance
FGL,FOUNDER GROUP LTD,FBL,GraniteShares 2x Long META Daily ETF,1,True,10/23/2024,32.65141677738939,33.18058229703356,30.848337173461914,1276100,432200.0,2.9525682554372974,-0.005966611538836332,0.01620651021828265,-0.07028945733059529,-0.060859216676828386,2024-10-23,yfinance
FGL,FOUNDER GROUP LTD,TGL,Treasure Global Inc. - Common Stock,1,True,10/23/2024,694.0,710.0,677.0,656,192.6,3.406022845275182,-0.03611111111111111,0.023054755043227664,-0.04647887323943662,-0.059722222222222225,2024-10-23,yfinance
ORIS,ORIENTAL RISE HOLDINGS LTD,OTIS,Otis Worldwide Corporation Common Stock ,1,True,10/17/2024,103.3076462495906,104.05136162389763,102.95536041259766,1657100,2300800.0,0.7202277468706537,0.004185221947022089,0.007199035127663428,-0.010533271205633675,0.0007608845987983808,2024-10-17,yfinance
SFHG,SAMFINE CREATION HOLDINGS GROUP LTD,SCHG,Schwab U.S. Large-Cap Growth ETF,1,True,10/15/2024,26.505982395030305,26.525882237129494,26.227392196655273,4615000,3737680.0,1.2347231437683268,-0.0003751624282081992,0.0007507679512727756,-0.01125278465032203,-0.010881684225791081,2024-10-15,yfinance
STFS,STAR FASHION CULTURE HOLDINGS LTD,STRS,Stratus Properties Inc. - Common Stock,1,True,10/11/2024,24.0,24.700000762939453,24.56999969482422,11200,9920.0,1.1290322580645162,-0.0029081718201795746,0.029166698455810547,-0.005263200975697599,0.020772746420412925,2024-10-11,yfinance
UPB,"UPSTREAM BIO, INC.",IPB,"Merrill Lynch & Co., Inc. 6.0518% Index Plus Trust Certificates Series 2003-1",1,True,10/11/2024,24.24190902709961,24.24190902709961,24.24190902709961,300,160.0,1.875,0.003029193871722352,0.0,0.0,0.003029193871722352,2024-10-11,yfinance
SKYQ,SKY QUARRY INC.,SKYW,"SkyWest, Inc. - Common Stock",1,True,10/10/2024,86.23999786376953,88.7300033569336,88.68000030517578,308900,268400.0,1.1508941877794336,-0.012707505778382113,0.02887297721293363,-0.0005635416416774555,0.015226123117205581,2024-10-10,yfinance
SKK,SKK HOLDINGS LTD,SKM,"SK Telecom Co., Ltd. Common Stock",1,True,10/08/2024,21.968465780415066,21.98778765272801,21.80423355102539,278700,177060.0,1.5740426973907151,-0.01813472694870266,0.0008795276149948007,-0.008348002291164811,-0.025474972023862855,2024-10-08,yfinance
FLX,BINGEX LTD,FLD,"Fold Holdings, Inc. - Class A Common Stock",1,True,10/04/2024,10.829999923706055,10.84000015258789,10.84000015258789,10400,7640.0,1.361256544502618,-0.0009225303266668801,0.0009233821747261687,0.0,0.0,2024-10-04,yfinance
FLX,BINGEX LTD,FOX,Fox Corporation - Class B Common Stock,1,True,10/04/2024,38.238276508312154,38.47584069217127,38.14918899536133,428700,693960.0,0.6177589486425731,0.0036371828965435287,0.006212732517049308,-0.008489787121828993,0.001298909608787209,2024-10-04,yfinance
FLX,BINGEX LTD,CLX,Clorox Company (The) Common Stock,1,True,10/04/2024,153.50766022908297,154.9710031123429,154.5310516357422,798300,1033740.0,0.772244471530559,-0.005391300402757769,0.00953270267474705,-0.0028389277204445293,0.001239469648960287,2024-10-04,yfinance
FLX,BINGEX LTD,DLX,Deluxe Corporation Common Stock,1,True,10/04/2024,17.55631449497615,17.833666496217916,17.815176010131836,196000,199340.0,0.983244707534865,0.017684895044923474,0.01579784876382411,-0.00103683031697386,0.03269029119214843,2024-10-04,yfinance
FLX,BINGEX LTD,FLS,Flowserve Corporation Common Stock,1,True,10/04/2024,52.00840064010319,52.194879681166626,51.71395492553711,1029700,1467020.0,0.7018990879469946,0.015134074783680514,0.00358555615570388,-0.009214021731006066,0.009386890206741659,2024-10-04,yfinance
FLX,BINGEX LTD,FPX,First Trust US Equity Opportunities ETF,1,True,10/04/2024,109.62425326377958,110.65787506103516,110.65787506103516,7500,11160.0,0.6720430107526881,0.00914921085164885,0.009428769332352581,0.0,0.018664245982694685,2024-10-04,yfinance
FLX,BINGEX LTD,RLX,"RLX Technology Inc. American Depositary Shares, each representing the right to receive one (1) Class A ordinary share",1,True,10/04/2024,1.9292817965471691,1.9392265382983878,1.7502762079238892,23423200,17773720.0,1.3178558005864838,0.026455065621434518,0.005154634107374413,-0.09743592439710358,-0.06878306576287312,2024-10-04,yfinance
CBNA,CHAIN BRIDGE BANCORP INC,CVNA,Carvana Co. Class A Common Stock,1,True,10/04/2024,179.8000030517578,182.83999633789062,180.1699981689453,2272400,2302440.0,0.9869529716300968,0.01788951354748793,0.016907637566934357,-0.014602921802793751,0.019984141709093226,2024-10-04,yfinance
WCT,WELLCHANGE HOLDINGS CO LTD,ACT,"Enact Holdings, Inc. - Common Stock",1,True,10/02/2024,35.086219616675855,35.29043451754004,35.037593841552734,300700,334080.0,0.9000838122605364,-0.006334410419539679,0.005820373442772599,-0.0071645668137534846,-0.0077115254246443625,2024-10-02,yfinance
FVR,"FRONTVIEW REIT, INC.",CVR,Chicago Rivet & Machine Co. Common Stock,1,True,10/02/2024,18.277453475528294,18.277453475528294,17.78346824645996,2700,2300.0,1.173913043478261,0.01425432727941998,0.0,-0.02702702702702705,-0.01315795183624004,2024-10-02,yfinance
FVR,"FRONTVIEW REIT, INC.",VVR,Invesco Senior Income Trust Common Stock (DE),1,True,10/02/2024,3.4587145626859965,3.467254386486326,3.450174331665039,566500,1560600.0,0.36300140971421246,2.2412240105646462e-08,0.0024690744626517133,-0.004926103745908235,-0.0024691698433159394,2024-10-02,yfinance
GRO,BRAZIL POTASH CORP.,GRI,"GRI Bio, Inc. - Common Stock",1,True,11/27/2024,12.17199993133545,13.09000015258789,12.920000076293945,10306,15156.4,0.6799767754875828,-0.023192400361663045,0.07541901301602481,-0.012987018664039994,0.03683489426927549,2024-11-27,yfinance
GRO,BRAZIL POTASH CORP.,BRO,"Brown & Brown, Inc. Common Stock",1,True,11/27/2024,113.0097547815141,113.417126103694,112.47322082519531,777600,1266180.0,0.6141306923186277,0.002821292168167087,0.0036047447670998324,-0.008322422820304091,-0.0019397806826495243,2024-11-27,yfinance
GRO,BRAZIL POTASH CORP.,FRO,Frontline Plc Ordinary Shares,1,True,11/27/2024,15.96598937813929,16.319304552284343,16.023284912109375,5913100,2132780.0,2.7724847382289783,-0.07470948749455,0.02212923770504414,-0.01813923131507048,-0.0713889908603707,2024-11-27,yfinance
GRO,BRAZIL POTASH CORP.,GDO,Western Asset Global Corporate Opportunity Fund Inc. Common Stock,1,True,11/27/2024,10.059641172372334,10.120661260278307,10.077075958251953,54100,56280.0,0.9612651030561479,0.0026062750619760774,0.006065831460624858,-0.004306566626967199,0.004343934032882047,2024-11-27,yfinance
GRO,BRAZIL POTASH CORP.,GEO,Geo Group Inc (The) REIT,1,True,11/27/2024,28.15999984741211,29.149999618530273,28.690000534057617,2501300,3120400.0,0.8015959492372773,0.011857704800960323,0.03515624206259165,-0.01578041476817862,0.03090192643583156,2024-11-27,yfinance
GRO,BRAZIL POTASH CORP.,GTO,Invesco Total Return Bond ETF,1,True,11/27/2024,44.823040887069574,44.84679341800346,44.76603698730469,105700,182760.0,0.5783541256292405,0.0023371104201787072,0.0005299178829416632,-0.0018007180568310349,0.0010623837831133355,2024-11-27,yfinance
MSW,MING SHING GROUP HOLDINGS LTD,MSS,Maison Solutions Inc. - Class A Common Stock,1,True,11/22/2024,0.949999988079071,0.9800000190734863,0.9300000071525574,14200,13960.0,1.0171919770773639,-0.03061227592911475,0.031578980390385335,-0.05102041933448131,-0.05102041933448131,2024-11-22,yfinance
MSW,MING SHING GROUP HOLDINGS LTD,MSA,MSA Safety Incorporated Common Stock,1,True,11/22/2024,170.38271664292444,172.90982743787345,172.7321319580078,253200,177240.0,1.4285714285714286,0.0047735073845105724,0.014831966790652499,-0.001027677156924348,0.0186283766632206,2024-11-22,yfinance
DMN,DAMON INC.,DNN,Denison Mines Corp Ordinary Shares (Canada),1,True,11/18/2024,2.180000066757202,2.3299999237060547,2.2699999809265137,34960400,27860380.0,1.2548428987687892,0.04306227573394995,0.0688072717226934,-0.025751049246433545,0.08612443739202005,2024-11-18,yfinance
DMN,DAMON INC.,EMN,Eastman Chemical Company Common Stock,1,True,11/18/2024,97.26812002602183,98.67080099663188,98.5760269165039,1180600,996120.0,1.185198570453359,0.010038331642352684,0.014420767772984556,-0.0009605078622115522,0.023619719801727387,2024-11-18,yfinance
DMN,DAMON INC.,FMN,Federated Hermes Premier Municipal Income Fund,1,True,11/18/2024,10.587117998040782,10.624996737262201,10.568178176879883,26600,34700.0,0.7665706051873199,-0.002676188809548281,0.003577814021571214,-0.005347630854610396,-0.004460350904175808,2024-11-18,yfinance
DMN,DAMON INC.,SMN,ProShares UltraShort Materials,1,True,11/18/2024,13.472078951668017,13.472078951668017,13.434314727783203,500,3120.0,0.16025641025641027,-0.012456640342830104,0.0,-0.0028031474592967874,-0.015224870002398515,2024-11-18,yfinance
ADUR,ADURO CLEAN TECHNOLOGIES INC.,ASUR,Asure Software Inc - Common Stock,1,True,11/07/2024,9.649999618530273,9.65999984741211,9.15999984741211,94300,215600.0,0.43738404452690166,0.0,0.001036293189342012,-0.051759835186120505,-0.05077718036146334,2024-11-07,yfinance
PHH,"PARK HA BIOLOGICAL TECHNOLOGY CO., LTD.",PBH,Prestige Consumer Healthcare Inc. Common Stock,1,True,12/27/2024,78.63999938964844,79.70999908447266,78.44999694824219,179300,230700.0,0.777199826614651,-0.007446723997059174,0.013606303447721863,-0.01580732844941049,-0.009844836244389053,2024-12-27,yfinance
HIT,"HEALTH IN TECH, INC.",HUT,Hut 8 Corp. - Common Stock,1,True,12/23/2024,23.790000915527344,23.809999465942383,21.649999618530273,5707600,8862000.0,0.6440532611148725,0.0046452959853855854,0.0008406284003959973,-0.09071818126253024,-0.08572637924340765,2024-12-23,yfinance
HIT,"HEALTH IN TECH, INC.",BIT,BlackRock Multi-Sector Income Trust Common Shares of Beneficial Interest,1,True,12/23/2024,12.950458199600696,12.959470555004458,12.914409637451172,160400,180200.0,0.8901220865704772,0.003491697310373702,0.0006959101573749455,-0.00347706469658865,0.000698403647749468,2024-12-23,yfinance
HIT,"HEALTH IN TECH, INC.",HIG,"The Hartford Insurance Group, Inc. Common Stock",1,True,12/23/2024,107.0227976044817,108.07502914770815,107.89801788330078,1095600,2580080.0,0.4246379957210629,-0.005846405737342881,0.009831844866503391,-0.001637855347375799,0.0022836694002474523,2024-12-23,yfinance
TDACU,TRANSLATIONAL DEVELOPMENT ACQUISITION CORP.,RDACU,Rising Dragon Acquisition Corp. - Unit,1,True,12/23/2024,10.130000114440918,10.130000114440918,10.130000114440918,0,10360.0,0.0,0.0,0.0,0.0,0.0,2024-12-23,yfinance
LSE,"LEISHEN ENERGY HOLDING CO., LTD.",LEE,"Lee Enterprises, Incorporated - Common Stock",1,True,12/19/2024,14.859999656677246,15.989999771118164,14.989999771118164,35400,46940.0,0.7541542394546229,-0.008010673513089275,0.07604307809880465,-0.06253908782451915,0.0006675720418842568,2024-12-19,yfinance
YSXT,"YSX TECH CO., LTD",YEXT,"Yext, Inc. Common Stock",1,True,12/18/2024,6.489999771118164,6.590000152587891,6.429999828338623,1377200,1663420.0,0.8279328131199577,0.0,0.015408379814549279,-0.024279259566699025,-0.009244983805169473,2024-12-18,yfinance
NTCL,NETCLASS TECHNOLOGY INC,BTCL,T-Rex 2X Long Bitcoin Daily Target ETF,1,True,12/13/2024,56.64571025496525,58.389382406114336,58.0406494140625,100400,142440.0,0.7048581859028363,0.008558466082632629,0.030782068815109326,-0.0059725411998075555,0.03339490457453765,2024-12-13,yfinance
AVR,ANTERIS TECHNOLOGIES GLOBAL CORP.,AVT,"Avnet, Inc. - Common Stock",1,True,12/13/2024,52.88416606980034,53.1177378141034,52.708988189697266,962200,607620.0,1.583555511668477,-0.0009193678101349893,0.004416666871418154,-0.007695162505538897,-0.004228805023686901,2024-12-13,yfinance
AVR,ANTERIS TECHNOLOGIES GLOBAL CORP.,ABR,Arbor Realty Trust Common Stock,1,True,12/13/2024,12.6036849580083,12.78057861328125,12.78057861328125,1700200,1649860.0,1.0305116797788902,-0.0014015250683623256,0.014035074334395612,0.0,0.0126138787575173,2024-12-13,yfinance
AVR,ANTERIS TECHNOLOGIES GLOBAL CORP.,ACR,ACRES Commercial Realty Corp. Common Stock,1,True,12/13/2024,17.1299991607666,17.530000686645508,17.1299991607666,15700,11900.0,1.319327731092437,-0.0005834439462043094,0.023350936688604332,-0.022818112390812998,-0.0005834439462043094,2024-12-13,yfinance
AVR,ANTERIS TECHNOLOGIES GLOBAL CORP.,AVD,American Vanguard Corporation Common Stock ($0.10 Par Value),1,True,12/13/2024,5.199999809265137,5.28000020980835,5.260000228881836,211100,223680.0,0.9437589413447782,-0.013282765069207891,0.0153846929764635,-0.003787875024959444,-0.0018974861633528294,2024-12-13,yfinance
INR,"INFINITY NATURAL RESOURCES, INC.",IJR,iShares Core S&P Small-Cap ETF,1,True,1/31/2025,117.818543569181,118.31105482646707,116.66606903076172,3536900,3795980.0,0.9317488500993156,0.0014234149194243709,0.004180252465919122,-0.01390390608990967,-0.008372284067415086,2025-01-31,yfinance
MTSR,"METSERA, INC.",MTDR,Matador Resources Company Common Stock,1,True,1/31/2025,57.79027670220565,57.79027670220565,56.314449310302734,901500,970460.0,0.9289409146178101,-0.00033605300516352646,0.0,-0.025537641903116044,-0.02586511290697324,2025-01-31,yfinance
CSAI,"CLOUDASTRUCTURE, INC.",CXAI,CXApp Inc. - Class A Common Stock,1,True,1/30/2025,1.5199999809265137,1.600000023841858,1.5299999713897705,874600,1069880.0,0.8174748569933077,-0.00653594160147165,0.052631607841587165,-0.04375003213062834,0.0,2025-01-30,yfinance
SFD,SMITHFIELD FOODS INC,SCD,LMP Capital and Income Fund Inc. Common Stock,1,True,1/28/2025,16.04571951474566,16.128382208590512,15.953873634338379,40900,27860.0,1.4680545585068199,-0.0022845315813032614,0.00515169754580887,-0.01081996768151887,-0.007995466233293535,2025-01-28,yfinance
SFD,SMITHFIELD FOODS INC,SDD,ProShares UltraShort SmallCap600,1,True,1/28/2025,13.757982466220612,13.815346717834473,13.815346717834473,200,980.0,0.20408163265306123,-0.006901283010110392,0.0041695249833835855,0.0,-0.0027605330986548624,2025-01-28,yfinance
VG,"VENTURE GLOBAL, INC.",CG,The Carlyle Group Inc. - Common Stock,1,True,1/24/2025,55.31289573804056,55.74145002174688,55.35185623168945,1172400,2178160.0,0.5382524699746575,-0.0029845436320819624,0.007747818623272468,-0.006989301317160387,-0.002282280374348439,2025-01-24,yfinance
VG,"VENTURE GLOBAL, INC.",BG,Bunge Limited Common Shares,1,True,1/24/2025,76.17724408370282,76.21589400312492,74.58297729492188,1237800,1412580.0,0.876268954678673,0.0021609315002523934,0.0005073683077800856,-0.021424884265427498,-0.01881267957379847,2025-01-24,yfinance
VG,"VENTURE GLOBAL, INC.",FG,"F&G Annuities & Life, Inc. Common Stock",1,True,1/24/2025,41.89243666067426,42.22375636992754,41.90217971801758,38100,68560.0,0.5557176196032673,-0.005091215767879218,0.007908819244317345,-0.007616012395784776,-0.004859826665004537,2025-01-24,yfinance
VG,"VENTURE GLOBAL, INC.",VB,Vanguard Small-Cap ETF,1,True,1/24/2025,248.90528336584774,249.53636141540517,248.2939453125,467200,736400.0,0.6344378055404671,0.0011104375636967227,0.0025354144396760553,-0.004978898048597044,-0.0013483969689022995,2025-01-24,yfinance
VG,"VENTURE GLOBAL, INC.",VT,Vanguard Total World Stock Index ETF,1,True,1/24/2025,119.74403527436564,119.98921143483003,119.54789733886719,1365700,2242360.0,0.609045826718279,0.0017228123799369892,0.002047502073089635,-0.003677948131216194,8.20137889113145e-05,2025-01-24,yfinance
VG,"VENTURE GLOBAL, INC.",VV,Vanguard Large-Cap ETF,1,True,1/24/2025,277.9366342316793,278.2825113878106,277.0471496582031,151300,224400.0,0.6742424242424242,-0.00017777595135171455,0.0012444460842213686,-0.004439235952869058,-0.0033775212708859665,2025-01-24,yfinance
DXST,DECENT HOLDING INC.,RXST,"RxSight, Inc. - Common Stock",1,True,1/22/2025,30.670000076293945,32.36000061035156,31.90999984741211,606900,658640.0,0.9214441880238067,-0.009686769251272957,0.05510272350354135,-0.013906080174655604,0.030351971420686536,2025-01-22,yfinance
DGNX,DIGINEX LTD,CGNX,Cognex Corporation - Common Stock,1,True,1/22/2025,40.79317750379129,40.83282192685909,40.0201301574707,1341000,1263020.0,1.0617409067156498,0.00341302949006605,0.000971839545083588,-0.01990290484561913,-0.015602056540893562,2025-01-22,yfinance
DGNX,DIGINEX LTD,FGNX,FG Nexus Inc. - Common Stock,1,True,1/22/2025,21.799999237060547,22.989999771118164,21.68000030517578,59700,70580.0,0.8458486823462738,-0.011337868873020747,0.05458718237175836,-0.056981273553038767,-0.016779997491468832,2025-01-22,yfinance
DGNX,DIGINEX LTD,RGNX,REGENXBIO Inc. - Common Stock,1,True,1/22/2025,7.53000020980835,7.860000133514404,7.849999904632568,1025500,1620120.0,0.6329778041132755,-0.005284010692994293,0.043824689842133974,-0.0012722937292578116,0.03698807485096005,2025-01-22,yfinance
PCLA,PICOCELA INC.,PVLA,"Palvella Therapeutics, Inc. - Common Stock",1,True,1/16/2025,13.357999801635742,13.625,13.220000267028809,32200,28140.0,1.144278606965174,0.004360872937526948,0.019988037305672255,-0.02972475104375717,-0.006015031771336723,2025-01-16,yfinance
UFG,UNI-FUELS HOLDINGS LTD,URG,Ur Energy Inc Common Shares (Canada),1,True,1/14/2025,1.1299999952316284,1.149999976158142,1.1100000143051147,4067100,2670020.0,1.5232470168762782,0.0,0.017699098239742965,-0.034782576245485725,-0.017699098239742965,2025-01-14,yfinance
UFG,UNI-FUELS HOLDINGS LTD,UTG,Reaves Utility Income Fund Common Shares of Beneficial Interest,1,True,1/14/2025,30.088173488029135,30.267100295741088,30.238849639892578,248600,312600.0,0.7952655150351887,0.007251010049212938,0.005946748737777012,-0.0009333783405899899,0.012295141631848375,2025-01-14,yfinance
MASK,3 E NETWORK TECHNOLOGY GROUP LTD,MASI,Masimo Corporation - Common Stock,1,True,1/08/2025,165.69000244140625,169.66000366210938,168.8000030517578,634300,420120.0,1.5098067218889841,0.0008456622595450383,0.023960415005166383,-0.005068964940401146,0.019631530897549515,2025-01-08,yfinance
ZYBT,ZHENGYE BIOTECHNOLOGY HOLDING LTD,SYBT,"Stock Yards Bancorp, Inc. - Common Stock",1,True,1/07/2025,69.12971394222086,69.65051941197503,68.54012298583984,120500,97160.0,1.2402223137093453,0.0021368741293510273,0.007533742584114534,-0.01594239979126805,-0.00641011390731934,2025-01-07,yfinance
STAK,STAK INC.,STAI,ScanTech AI Systems Inc. - Common stock,1,True,2/26/2025,48.599998474121094,54.959999084472656,50.20000076293945,142025,1004050.0,0.14145211891838055,-0.0544747659267688,0.13086421419824087,-0.08660841340657885,-0.023346317652058357,2025-02-26,yfinance
BMGL,BASEL MEDICAL GROUP LTD,BMBL,Bumble Inc. - common stock,1,True,2/25/2025,5.480000019073486,5.539999961853027,5.480000019073486,3133700,10169460.0,0.3081481219258446,-0.009041625467966503,0.010948894629691135,-0.010830314655719266,-0.009041625467966503,2025-02-25,yfinance
NPB,NORTHPOINTE BANCSHARES INC,MPB,Mid Penn Bancorp - Common Stock,1,True,2/14/2025,29.123609689863454,29.21165568501608,28.937734603881836,47900,44140.0,1.0851835070231084,0.009837167657421772,0.0030231827747393162,-0.009377115904962203,0.0033921022151703886,2025-02-14,yfinance
XHLD,"TEN HOLDINGS, INC.",SHLD,Global X Defense Tech ETF,1,True,2/13/2025,41.14884862543829,41.14884862543829,40.75961685180664,268400,324040.0,0.8282928033576101,0.011282794530286924,0.0,-0.0094591170016608,0.001716952255058442,2025-02-13,yfinance
XHLD,"TEN HOLDINGS, INC.",XYLD,Global X S&P 500 Covered Call ETF,1,True,2/13/2025,38.663331499864164,38.744842529296875,38.744842529296875,679200,462100.0,1.4698117290629733,0.00023441983782580722,0.0021082257082010026,0.0,0.002343139755955427,2025-02-13,yfinance
AGH,AUREUS GREENWAY HOLDINGS INC,AHH,"Armada Hoffler Properties, Inc. Common Stock",1,True,2/12/2025,8.965060267442494,9.059429682878635,9.049992561340332,394100,494660.0,0.796708850523592,-0.015544069799960689,0.010526355944181755,-0.0010416904671315325,-0.0062176293858493955,2025-02-12,yfinance
SION,"SIONNA THERAPEUTICS, INC.",ZION,Zions Bancorporation N.A. - Common Stock,1,True,2/07/2025,56.3887005282274,56.39836940741523,55.373294830322266,907300,1066100.0,0.8510458681174374,0.0006864768158643417,0.00017146838102764537,-0.018175606633020654,-0.017333139540905557,2025-02-07,yfinance
TTAM,TITAN AMERICA SA,TTAN,"ServiceTitan, Inc. - Class A Common Stock",1,True,2/07/2025,104.9800033569336,106.98999786376953,104.33000183105469,222600,185460.0,1.200258815917179,0.003345179324318402,0.01914645115795935,-0.024862100063800536,-0.002867202812179002,2025-02-07,yfinance
PLUT,PLUTUS FINANCIAL GROUP LTD,PLUG,"Plug Power, Inc. - Common Stock",1,True,2/05/2025,1.9700000286102295,2.0,1.850000023841858,52568100,64727900.0,0.8121397419041866,0.010256400224333537,0.015228411651818353,-0.07499998807907104,-0.05128206225463519,2025-02-05,yfinance
PLUT,PLUTUS FINANCIAL GROUP LTD,PLUR,Pluri Inc. - Common Stock,1,True,2/05/2025,4.46999979019165,4.489999771118164,4.400000095367432,3800,11160.0,0.34050179211469533,0.039534788817703385,0.004474268873658309,-0.0200444722357568,0.023255790743460066,2025-02-05,yfinance
CJMB,CALLAN JMB INC.,CMMB,Chemomab Therapeutics Ltd.  - American Depositary Shares,1,True,2/05/2025,8.279999732971191,8.760000228881836,8.319999694824219,54325,22330.0,2.4328257948947605,0.0,0.05797107625490241,-0.050228370155394476,0.004830913423070096,2025-02-05,yfinance
NMAX,NEWSMAX INC.,BMAX,REX Bitcoin Corporate Treasury Convertible Bond ETF,1,True,3/31/2025,25.239999771118164,25.780000686645508,25.309999465942383,19000,40340.0,0.4709965294992563,-0.021515809402374696,0.021394648194302302,-0.018231233831835926,-0.01880211703497092,2025-03-31,yfinance
NMAX,NEWSMAX INC.,MMAX,iShares Large Cap Max Buffer Mar ETF,1,True,3/31/2025,24.78606843010719,24.904757539296977,24.825632095336914,446500,0.0,1.0,0.0,0.004788541172815379,-0.003177121633696355,0.0015962057613650258,2025-04-01,yfinance
NCT,INTERCONT (CAYMAN) LTD,NXT,Nextpower Inc. - Class A Common Stock,1,True,3/28/2025,42.6150016784668,43.2400016784668,43.150001525878906,1407300,1829900.0,0.7690584184928139,-0.003157855474460892,0.01466619677069754,-0.002081409553522521,0.00935676083927266,2025-03-28,yfinance
NCT,INTERCONT (CAYMAN) LTD,NVT,nVent Electric plc Ordinary Shares ,1,True,3/28/2025,53.794327659000224,54.01251741151839,52.47525405883789,2427600,2367200.0,1.025515376816492,-0.006411448389781228,0.004055999247750782,-0.028461242436973875,-0.0307749172700042,2025-03-28,yfinance
WFF,WF HOLDING LTD,WFC,Wells Fargo & Company Common Stock,1,True,3/27/2025,72.3608090616604,72.3608090616604,71.09201049804688,10457600,15214300.0,0.6873533452081265,0.0013611203078547937,0.0,-0.01753433357181448,-0.016197079601468982,2025-03-27,yfinance
WFF,WF HOLDING LTD,WFG,West Fraser Timber Co. Ltd Common stock,1,True,3/27/2025,76.04889750143955,77.38309268373946,76.76577758789062,282600,171680.0,1.6460857409133272,-0.00598648060581645,0.017543912221405347,-0.007977389820432371,0.0033836552032312207,2025-03-27,yfinance
EPSM,EPSIUM ENTERPRISE LTD,EPAM,"EPAM Systems, Inc. Common Stock",1,True,3/26/2025,179.33999633789062,179.77000427246094,176.9199981689453,391100,940700.0,0.4157542255766982,0.001955365294069055,0.0023977246757613613,-0.0158536242742484,-0.011564932458185812,2025-03-26,yfinance
EPSM,EPSIUM ENTERPRISE LTD,SPSM,State Street SPDR Portfolio S&P 600 Small Cap ETF,1,True,3/26/2025,41.40661611723546,41.594112740788944,41.13031005859375,1509300,1530120.0,0.9863932240608579,0.001192906911722229,0.004528180303906562,-0.011150680989051833,-0.005488046326899544,2025-03-26,yfinance
RCT,REDCLOUD HOLDINGS PLC,RXT,"Rackspace Technology, Inc. - Common Stock",1,True,3/21/2025,1.8200000524520874,1.8899999856948853,1.8700000047683716,715300,1642880.0,0.43539394234515,-0.026737942346945313,0.03846150067330322,-0.010582000570312384,0.0,2025-03-21,yfinance
RCT,REDCLOUD HOLDINGS PLC,FCT,First Trust Senior Floating Rate Income Fund II Common Shares of Beneficial Interest,1,True,3/21/2025,9.343276590182422,9.379916856278319,9.324956893920898,83300,83840.0,0.9935591603053435,-2.45599569708786e-07,0.003921564960882975,-0.005859322976901861,-0.0019609808497134573,2025-03-21,yfinance
RCT,REDCLOUD HOLDINGS PLC,RVT,"Royce Small-Cap Trust, Inc. Common Stock",1,True,3/21/2025,13.507604771022198,13.572904572370632,13.51693344116211,188500,290500.0,0.648881239242685,-0.006177038581319217,0.004834299082285975,-0.004123740125784059,-0.005490681026319231,2025-03-21,yfinance
SAGT,SAGTEC GLOBAL LTD,SAFT,"Safety Insurance Group, Inc. - Common Stock",1,True,3/07/2025,73.48891007768142,74.34769529262496,73.66259002685547,62500,63580.0,0.9830135262661214,0.004616821995272843,0.011685915793767512,-0.009214882358800618,0.006991082253032727,2025-03-07,yfinance
TBH,"BRAG HOUSE HOLDINGS, INC.",TBN,Tamboran Resources Corporation Common stock,1,True,3/06/2025,23.299999237060547,23.67300033569336,23.100000381469727,19700,21900.0,0.8995433789954338,0.003445302587069605,0.016008631366799527,-0.02420478799046366,-0.00516791280935787,2025-03-06,yfinance
PN,SKYCORP SOLAR GROUP LTD,ON,ON Semiconductor Corporation - Common Stock,1,True,3/04/2025,45.09000015258789,45.7400016784668,44.4900016784668,10433100,11239860.0,0.9282233052724856,0.004008022840956513,0.014415647009963475,-0.027328376784657344,-0.009351996668276864,2025-03-04,yfinance
PN,SKYCORP SOLAR GROUP LTD,PB,"Prosperity Bancshares, Inc. Common Stock",1,True,3/04/2025,72.93605136555573,72.93605136555573,71.27291870117188,876200,540520.0,1.6210315992007696,-0.009585173938598006,0.0,-0.022802614526638215,-0.03216922143874359,2025-03-04,yfinance
PN,SKYCORP SOLAR GROUP LTD,PH,Parker-Hannifin Corporation Common Stock,1,True,3/04/2025,641.3430345742174,645.6909931408549,620.3279418945312,2175000,823180.0,2.642192473092155,-0.006901820623431809,0.006779458623923477,-0.039280478612454116,-0.039442986823952954,2025-03-04,yfinance
PN,SKYCORP SOLAR GROUP LTD,PM,Philip Morris International Inc Common Stock,1,True,3/04/2025,153.07182246292072,154.0666722517396,148.6964111328125,6242900,7480040.0,0.8346078363217309,-0.0019522816832970502,0.006499235279307237,-0.03485673468790362,-0.030480519110988008,2025-03-04,yfinance
DAAQU,DIGITAL ASSET ACQUISITION CORP.,RAAQU,Real Asset Acquisition Corp. - Unit,1,True,4/29/2025,10.079999923706055,10.119999885559082,10.109999656677246,865800,0.0,1.0,0.0,0.003968250213867144,-0.0009881649204468812,0.002976164007763363,2025-04-30,yfinance
RAAQU,REAL ASSET ACQUISITION CORP.,DAAQU,Digital Asset Acquisition Corp. - Units,1,True,4/29/2025,10.180000305175781,10.354000091552734,10.234999656677246,796700,0.0,1.0,0.0,0.01709231642051003,-0.011493184645862064,0.005402686626001545,2025-04-30,yfinance
PFAI,PINNACLE FOOD GROUP LTD,LFAI,LifeX 2050 Longevity Income ETF,1,True,4/22/2025,148.31993103027344,148.31993103027344,148.31993103027344,0,0.0,1.0,0.0022657530102375453,0.0,0.0,0.0022657530102375453,2025-04-22,yfinance
PFAI,PINNACLE FOOD GROUP LTD,PFSI,"PennyMac Financial Services, Inc. Common Stock",1,True,4/22/2025,95.26536295990607,96.84221397906957,95.60255432128906,646000,394520.0,1.6374328297678191,0.019528781179224703,0.01655219662394129,-0.012800819052406563,0.023137399117726117,2025-04-22,yfinance
TMDE,TMD ENERGY LTD,FMDE,Fidelity Enhanced Mid Cap ETF,1,True,4/21/2025,29.251519016139188,29.3495844326419,28.835479736328125,461100,312520.0,1.4754255727633432,-0.011051520861503709,0.003352489709973927,-0.017516592014911164,-0.025117163497156845,2025-04-21,yfinance
EDHL,EVERBRIGHT DIGITAL HOLDING LTD.,EDBL,Edible Garden AG Incorporated - Common Stock,1,True,4/17/2025,1.8600000143051147,1.9270000457763672,1.899999976158142,26500,94500.0,0.2804232804232804,0.0,0.03602152201933357,-0.014011452504842606,0.021505355669564928,2025-04-17,yfinance
EDHL,EVERBRIGHT DIGITAL HOLDING LTD.,RDHL,Redhill Biopharma Ltd. - American Depositary Shares,1,True,4/17/2025,1.9299999475479126,2.490000009536743,2.259999990463257,1321900,1302980.0,1.0145205605611751,-0.06763284551201197,0.2901554804187001,-0.09236948521790453,0.09178747021639308,2025-04-17,yfinance
CHA,CHAGEE HOLDINGS LTD.,CNA,CNA Financial Corporation Common Stock,1,True,4/17/2025,46.62372918371528,46.8859881050122,46.55573654174805,218500,355280.0,0.6150078811078586,0.005446138142300407,0.005625009536743099,-0.007043715545132156,0.003979868916630635,2025-04-17,yfinance
ATHR,"AETHER HOLDINGS, INC.",ATYR,"aTyr Pharma, Inc. - Common Stock",1,True,4/10/2025,2.819999933242798,2.880000114440918,2.740000009536743,1279100,1783620.0,0.7171370583420236,-0.017421586867605077,0.021276660503010796,-0.04861114560453843,-0.0452961258557732,2025-04-10,yfinance
MB,MASTERBEEF GROUP,NB,NioCorp Developments Ltd. - Common Stock,1,True,4/10/2025,1.9900000095367432,2.200000047683716,2.049999952316284,550100,362760.0,1.5164295953247326,0.0,0.10552765685456407,-0.06818186005284872,0.030150724870352412,2025-04-10,yfinance
MB,MASTERBEEF GROUP,KB,KB Financial Group Inc,1,True,4/10/2025,50.571340970494234,50.63026808049879,50.031150817871094,209500,247700.0,0.8457811869196609,-0.003290673003863967,0.0011652273575054014,-0.011833183693105013,-0.013937267559960189,2025-04-10,yfinance
MB,MASTERBEEF GROUP,MG,Mistras Group Inc Common Stock,1,True,4/10/2025,9.220000267028809,9.4399995803833,9.199999809265137,177200,227100.0,0.7802730074856892,-0.0325288011152686,0.023861096202049036,-0.025423705697709274,-0.03462748509471047,2025-04-10,yfinance
TOPW,ASIASTRATEGY,TOPS,"TOP Ships, Inc. Common Stock",1,True,4/02/2025,6.5,6.550000190734863,6.460000038146973,11400,8620.0,1.322505800464037,0.0,0.0076923370361328125,-0.01374048091100792,-0.0061538402850811295,2025-04-02,yfinance
SMA,"SMARTSTOP SELF STORAGE REIT, INC.",DMA,Destra Multi-Alternative Fund Common Stock,1,True,4/02/2025,8.020057440494627,8.115534683337515,8.010510444641113,10600,9460.0,1.120507399577167,-0.0023752137720238382,0.011904807858458355,-0.01294113607967606,-0.0035627763011138523,2025-04-02,yfinance
SMA,"SMARTSTOP SELF STORAGE REIT, INC.",EMA,Emera Incorporated Common Shares,1,True,4/02/2025,41.820367059821216,41.820367059821216,41.439205169677734,123500,70580.0,1.7497874752054405,0.006823641860160613,0.0,-0.009114264578267686,-0.002352815195407919,2025-04-02,yfinance
SMA,"SMARTSTOP SELF STORAGE REIT, INC.",SNA,Snap-On Incorporated Common Stock,1,True,4/02/2025,329.33706969463145,336.45950202563967,335.2544860839844,302400,320060.0,0.9448228457164282,-0.010071166323623903,0.02162657346047406,-0.0035814590891341887,0.0077155380705128136,2025-04-02,yfinance
WTF,WATON FINANCIAL LTD,WFF,WF Holding Limited - Ordinary Shares,1,True,4/01/2025,4.0,4.085999965667725,3.4649999141693115,468700,1252666.6666666667,0.37416178818520485,0.0,0.021499991416931152,-0.1519823927352703,-0.13375002145767212,2025-04-01,yfinance
WXM,WF INTERNATIONAL LTD.,WSM,"Williams-Sonoma, Inc. Common Stock (DE)",1,True,4/01/2025,155.60700166114665,158.77800935626223,156.9405975341797,1604700,1774200.0,0.9044639837673317,-0.0036685915986846515,0.020378309852797212,-0.01157220593413414,0.004870249457520509,2025-04-01,yfinance
FTRK,FAST TRACK GROUP,FTEK,"Fuel Tech, Inc. - Common Stock",1,True,5/23/2025,1.6399999856948853,1.7799999713897705,1.600000023841858,375700,1307340.0,0.287377422858629,-0.023809501846360367,0.08536584568052041,-0.10112356766352869,-0.047619003692720735,2025-05-23,yfinance
HNGE,"HINGE HEALTH, INC.",BNGE,First Trust S-Network Streaming and Gaming ETF,1,True,5/22/2025,31.738744828996442,31.840808868408203,31.840808868408203,1000,320.0,3.125,-0.0029882325627264045,0.003215755379164077,0.0,0.00021791339149989183,2025-05-22,yfinance
ARAI,ARRIVE AI INC.,ATAI,Atai Beckley N.V - Common Shares,1,True,5/15/2025,1.4299999475479126,1.6299999952316284,1.6299999952316284,2452200,1195860.0,2.0505744819627716,0.0,0.13986017833543646,0.0,0.13986017833543646,2025-05-15,yfinance
APUS,"APIMEDS PHARMACEUTICALS US, INC.",SPUS,SP Funds S&P 500 Sharia Industry Exclusions ETF,1,True,5/09/2025,39.510371787652396,39.59998719748971,39.36101150512695,142700,280980.0,0.5078653284931312,0.00532039865132493,0.002268148989307176,-0.006034741657136349,0.001520005691770994,2025-05-09,yfinance
AII,"AMERICAN INTEGRITY INSURANCE GROUP, INC.",SII,Sprott Inc. Common Shares,1,True,5/08/2025,53.523524729902284,54.08054094270905,53.55336380004883,194700,181100.0,1.075096631695196,-0.00185489330750711,0.010406941912320914,-0.009748000546420083,-0.0012984329098534569,2025-05-08,yfinance
AHL,ASPEN INSURANCE HOLDINGS LTD,ANL,Adlai Nortye Ltd. - American Depositary Shares,1,True,5/08/2025,1.75,1.8650000095367432,1.840000033378601,7300,7280.0,1.0027472527472527,-0.06865351359081102,0.06571429116385323,-0.013404812884881412,-0.020755676525742547,2025-05-08,yfinance
AHL,ASPEN INSURANCE HOLDINGS LTD,AGL,"agilon health, inc. Common Stock",1,True,5/08/2025,3.359999895095825,3.4000000953674316,3.2200000286102295,5598200,5784600.0,0.9677765100439097,-0.008849619138639415,0.011904821881092846,-0.05294119462009894,-0.05014751357913327,2025-05-08,yfinance
CEPT,"CANTOR EQUITY PARTNERS II, INC.",CRPT,First Trust SkyBridge Crypto Industry and Digital Economy ETF,1,True,5/02/2025,15.728075188077439,16.383825489672326,16.17517852783203,63400,40320.0,1.5724206349206349,0.016698829403600374,0.04169297855925652,-0.012734935560185054,0.04560061406034705,2025-05-02,yfinance
SDM,SMART DIGITAL GROUP LTD,SFM,"Sprouts Farmers Market, Inc. - Common Stock",1,True,5/02/2025,173.0,178.16000366210938,173.92999267578125,2009400,2176240.0,0.9233356615079219,0.007806106893299591,0.029826610763638007,-0.023742764365623736,0.01322375023444632,2025-05-02,yfinance
SDM,SMART DIGITAL GROUP LTD,SSM,Sono Group N.V. - Ordinary Shares,1,True,5/02/2025,8.0,10.0,9.0,3100,3820.0,0.8115183246073299,-0.1111111111111111,0.25,-0.1,0.0,2025-05-02,yfinance
SDM,SMART DIGITAL GROUP LTD,ADM,Archer-Daniels-Midland Company Common Stock,1,True,5/02/2025,46.81150219137586,46.8601657681158,46.568199157714844,2691000,2574760.0,1.0451459553511784,0.010928890069542334,0.001039564518587612,-0.006230592777791933,0.0056745817424150805,2025-05-02,yfinance
SDM,SMART DIGITAL GROUP LTD,DDM,ProShares Ultra Dow30,1,True,5/02/2025,42.80924152232706,43.25574033195774,43.07714080810547,341000,415520.0,0.8206584520600693,0.019855852971328886,0.010429963104994631,-0.004128920750902492,0.02623808832267116,2025-05-02,yfinance
SDM,SMART DIGITAL GROUP LTD,SCM,Stellus Capital Investment Corporation Common Stock,1,True,5/02/2025,11.910015053987843,12.21755058929886,12.105719566345215,156600,148940.0,1.0514301060829865,0.007092309695029974,0.025821590813862497,-0.009153309588224306,0.023640778229646338,2025-05-02,yfinance
SDM,SMART DIGITAL GROUP LTD,SEM,Select Medical Holdings Corporation Common Stock,1,True,5/02/2025,16.260133094097117,16.46720672201112,14.061219215393066,4344700,1333240.0,3.25875311271789,-0.09594299593423322,0.01273505122717454,-0.14610780973570078,-0.21820174264163245,2025-05-02,yfinance
JCAP,"JEFFERSON CAPITAL, INC. / DE",ICAP,Infrastructure Capital Equity Income ETF,1,True,6/26/2025,24.929706877932805,25.006207632501088,24.984214782714844,7000,5420.0,1.2915129151291513,0.008861861031271458,0.0030686584059277265,-0.0008794956080289234,0.011067701097044538,2025-06-26,yfinance
FMFC,KANDAL M VENTURE LTD,TMFC,Motley Fool 100 Index ETF ETF,1,True,6/25/2025,63.23730521965017,63.33715732523457,63.16740417480469,104300,112200.0,0.9295900178253119,0.0038041298905542886,0.0015790063355415717,-0.0026801510771663766,0.002694548176788374,2025-06-25,yfinance
EGG,ENIGMATIG LTD,EFG,iShares MSCI EAFE Growth ETF,1,True,6/18/2025,106.96695779202875,107.4886506052258,106.75040435791016,848000,637580.0,1.3300291728096867,0.00341639818717057,0.004877139856696251,-0.006868132060072137,0.0013849926824836285,2025-06-18,yfinance
EGG,ENIGMATIG LTD,EGY,"VAALCO Energy, Inc.  Common Stock",1,True,6/18/2025,3.806914446962669,3.898705327289243,3.7875900268554688,1081300,1019040.0,1.061096718480138,-0.002531597087402914,0.02411162152588138,-0.028500563932343216,-0.007594883570481091,2025-06-18,yfinance
EGG,ENIGMATIG LTD,ETG,Eaton Vance Tax-Advantaged Global Dividend Income Fund Common Shares of Beneficial Interest,1,True,6/18/2025,19.38577361984385,19.51115343345392,19.433996200561523,74400,109600.0,0.6788321167883211,-0.0019861164350498243,0.00646761981589056,-0.003954519303820472,0.0004964672369428183,2025-06-18,yfinance
EGG,ENIGMATIG LTD,EVG,Eaton Vance Short Diversified Income Fund Eaton Vance Short Duration Diversified Income Fund Common Shares of Beneficial Interest,1,True,6/18/2025,10.423266168726865,10.461692918448007,10.394445419311523,13900,38180.0,0.3640649554740702,-0.0018398853982155093,0.0036866322992339974,-0.006427974866085009,-0.004599838187835265,2025-06-18,yfinance
CAI,"CARIS LIFE SCIENCES, INC.",CWI,SPDR MSCI ACWI ex-US ETF,1,True,6/18/2025,31.24515749042393,31.313914218678704,31.156755447387695,392900,235460.0,1.6686486027350718,0.0031535974906607084,0.0022005563030317644,-0.0050188159229632105,0.000315371198330333,2025-06-18,yfinance
CAI,"CARIS LIFE SCIENCES, INC.",FAI,First Trust Bloomberg Artificial Intelligence ETF,1,True,6/18/2025,33.81999969482422,33.81999969482422,33.54899978637695,1900,2800.0,0.6785714285714286,0.008949857785311072,0.0,-0.008013007418469586,0.0008651350900135392,2025-06-18,yfinance
AIRO,"AIRO GROUP HOLDINGS, INC.",AIRI,Air Industries Group Common Stock,1,True,6/13/2025,3.5199999809265137,3.5799999237060547,3.4100000858306885,32900,57660.0,0.5705861949358307,-0.005649712187014997,0.017045438382004816,-0.047485989245323934,-0.03672312921559748,2025-06-13,yfinance
ASIC,ATEGRITY SPECIALTY INSURANCE CO HOLDINGS,ASIX,AdvanSix Inc. Common Stock ,1,True,6/11/2025,24.271073605008944,24.388702962091916,24.320085525512695,138000,132040.0,1.0451378370190851,0.006503987424224016,0.004846483472354363,-0.002813492652146143,0.008536476560104863,2025-06-11,yfinance
JEM,707 CAYMAN HOLDINGS LTD.,JSM,"Navient Corporation - 6% Senior Notes due December 15, 2043",1,True,6/09/2025,17.169219025014044,17.32950286306479,17.32007598876953,7200,16420.0,0.438489646772229,-0.0027382657555069774,0.00933553458763765,-0.0005439783454694397,0.006024152446420096,2025-06-09,yfinance
JEM,707 CAYMAN HOLDINGS LTD.,MEM,Matthews Emerging Markets Equity Active ETF,1,True,6/09/2025,30.530648457144967,30.64833348833083,30.647369384765625,3200,4460.0,0.7174887892376681,0.0038058443585316333,0.0038546521981364275,-3.145696537049912e-05,0.0076434683601648646,2025-06-09,yfinance
JEM,707 CAYMAN HOLDINGS LTD.,NEM,Newmont Corporation,1,True,6/09/2025,52.03520965026214,53.29733224967625,52.949501037597656,8173300,12123040.0,0.674195581306339,-1.0568958009170141e-10,0.02425516506798113,-0.006526240571463286,0.017570629346637032,2025-06-09,yfinance
OMDA,"OMADA HEALTH, INC.",KMDA,Kamada Ltd. - Ordinary Shares,1,True,6/06/2025,6.78000020980835,6.900000095367432,6.849999904632568,74900,59820.0,1.2520896021397525,0.0,0.017699097617354508,-0.007246404354172798,0.010324438445142383,2025-06-06,yfinance
CRCL,"CIRCLE INTERNET GROUP, INC.",CRVL,CorVel Corp. - Common Stock,1,True,6/05/2025,110.86000061035156,111.2300033569336,109.55999755859375,86900,122560.0,0.7090404699738904,-0.004400519716966245,0.0033375676036888117,-0.015013986765610781,-0.016075446251068954,2025-06-05,yfinance
SI,"SHOULDER INNOVATIONS, INC.",SJ,Scienjoy Holding Corporation - Class A Ordinary Shares,1,True,7/31/2025,0.8870000243186951,0.8870000243186951,0.8399999737739563,37300,15960.0,2.337092731829574,0.05595244287160712,0.0,-0.05298765417829556,0.0,2025-07-31,yfinance
SI,"SHOULDER INNOVATIONS, INC.",AI,"C3.ai, Inc. Class A Common Stock",1,True,7/31/2025,24.510000228881836,24.670000076293945,23.559999465942383,6026300,9545000.0,0.6313567312729178,0.011973613697315104,0.006527941489921752,-0.04499394434206717,-0.027250200913432592,2025-07-31,yfinance
SI,"SHOULDER INNOVATIONS, INC.",SO,Southern Company (The) Common Stock,1,True,7/31/2025,93.36553306557568,94.36925614087382,92.971923828125,12682300,4896240.0,2.5902120811071354,-0.0002107688411022674,0.010750466926517422,-0.014807071390526668,-0.004425667679750317,2025-07-31,yfinance
SI,"SHOULDER INNOVATIONS, INC.",SU,Suncor Energy  Inc. Common Stock,1,True,7/31/2025,39.29999923706055,39.720001220703125,39.459999084472656,3013700,3031280.0,0.9942004697685466,-0.009826137645315798,0.0106870735825997,-0.006545874326281458,-0.005794899223845079,2025-07-31,yfinance
FIG,"FIGMA, INC.",GIG,GigCapital7 Corp. - Class A Ordinary Share,1,True,7/31/2025,10.380000114440918,10.380000114440918,10.369999885559082,3800,247340.0,0.015363467291986739,0.0004819387412932982,0.0,-0.0009634131764529912,-0.0004819387412932982,2025-07-31,yfinance
FIG,"FIGMA, INC.",CIG,Comp En De Mn Cemig ADS American Depositary Shares,1,True,7/31/2025,1.809999942779541,1.840000033378601,1.809999942779541,2318000,2325400.0,0.9968177517846392,-0.016304396768935924,0.01657463621407091,-0.016304396768935924,-0.016304396768935924,2025-07-31,yfinance
FIG,"FIGMA, INC.",DIG,ProShares Ultra Energy,1,True,7/31/2025,34.238751853475584,35.20572477582162,34.406490325927734,143000,47320.0,3.021978021978022,-0.01894258462981658,0.028242061114966733,-0.02270183201689917,-0.014136303345198296,2025-07-31,yfinance
FIG,"FIGMA, INC.",RIG,Transocean Ltd (Switzerland) Common Stock,1,True,7/31/2025,2.9000000953674316,3.0,2.9200000762939453,24100700,26798380.0,0.899334213486039,-0.016949136104436064,0.03448272460139292,-0.026666641235351562,-0.010169481662661638,2025-07-31,yfinance
FIG,"FIGMA, INC.",VIG,Vanguard Div Appreciation ETF,1,True,7/31/2025,206.03717861224683,206.81093282586568,204.41030883789062,693200,882420.0,0.7855669635774348,0.00014447460860085402,0.0037554106439936074,-0.011607819544029485,-0.00775266719216242,2025-07-31,yfinance
YMAT,"J-STAR HOLDING CO., LTD.",TMAT,Main Thematic Innovation ETF,1,True,7/30/2025,24.694264783168432,24.769246222082927,24.63427734375,18400,14560.0,1.2637362637362637,0.008986937288193499,0.00303639082081935,-0.005449050694671364,0.006535900850946765,2025-07-30,yfinance
LHAI,LINKHOME HOLDINGS INC.,LNAI,Lunai Bioworks Inc. - Common Stock,1,True,7/24/2025,3.200000047683716,3.369999885559082,3.259999990463257,139110,121460.0,1.1453153301498435,-0.058823541786431094,0.05312494854442852,-0.03264091953450504,-0.04117650028743462,2025-07-24,yfinance
ARX,ACCELERANT HOLDINGS,ADX,Adams Diversified Equity Fund Inc.,1,True,7/24/2025,21.19468782309131,21.271480097306878,21.12749481201172,303500,327120.0,0.9277940816825629,0.0022696479649823766,0.0036231849629746755,-0.006768935900863261,-0.0009078234902507514,2025-07-24,yfinance
MH,"MCGRAW HILL, INC.",MB,MasterBeef Group - Ordinary Shares,1,True,7/24/2025,14.960000038146973,16.0,14.880000114440918,38500,36060.0,1.0676650027731558,-0.018372686166428186,0.06951871385034084,-0.06999999284744263,-0.023622025071121953,2025-07-24,yfinance
MH,"MCGRAW HILL, INC.",MU,"Micron Technology, Inc. - Common Stock",1,True,7/24/2025,110.94566654590871,112.61395315229545,111.61498260498047,20293100,24393940.0,0.8318910352325208,0.011199042662684658,0.015036969521440622,-0.00887075286278253,0.017299431972546207,2025-07-24,yfinance
MH,"MCGRAW HILL, INC.",MG,Mistras Group Inc Common Stock,1,True,7/24/2025,8.229999542236328,8.329999923706055,8.260000228881836,89900,114220.0,0.7870775696025214,-0.009627060570480832,0.012150715313715994,-0.00840332478575529,-0.00601686982070809,2025-07-24,yfinance
MH,"MCGRAW HILL, INC.",MJ,Amplify Alternative Harvest ETF,1,True,7/24/2025,21.75,21.959999084472656,21.829999923706055,36100,54300.0,0.6648250460405156,-0.008660005899392665,0.009655130320581896,-0.005919816310854065,-0.005013701352504882,2025-07-24,yfinance
CRE,CRE8 ENTERPRISE LTD,CDE,"Coeur Mining, Inc. Common Stock",1,True,7/23/2025,9.5600004196167,9.59000015258789,9.510000228881836,11714500,9467000.0,1.237403612548854,-0.0010448563768426743,0.0031380472441856046,-0.008342014852259045,-0.006269536871023367,2025-07-23,yfinance
CRE,CRE8 ENTERPRISE LTD,CEE,"The Central and Eastern Europe Fund, Inc. (The) Common Stock",1,True,7/23/2025,15.770000457763672,15.979999542236328,15.930000305175781,10000,17900.0,0.5586592178770949,0.001269870334201389,0.013316365147552824,-0.0031288634851581298,0.011428590804811508,2025-07-23,yfinance
CRE,CRE8 ENTERPRISE LTD,CRS,Carpenter Technology Corporation Common Stock,1,True,7/23/2025,275.4336037692941,281.4036914256983,273.3769836425781,512800,815380.0,0.6289092202408693,0.005356758327539588,0.021675233430866313,-0.02852381837087429,-0.002150085120067584,2025-07-23,yfinance
CRE,CRE8 ENTERPRISE LTD,VRE,"Veris Residential, Inc. Common Stock",1,True,7/23/2025,14.362934736246693,14.53202753901131,14.452454566955566,514800,437100.0,1.1777625257378175,-0.00687760290605999,0.011772858811221176,-0.0054756964809025525,-0.0006877711973160174,2025-07-23,yfinance
CARL,"CARLSMED, INC.",CADL,"Candel Therapeutics, Inc. - Common Stock",1,True,7/23/2025,6.699999809265137,7.130000114440918,6.960000038146973,977100,1063740.0,0.9185515257487732,0.0044977110386871496,0.06417915185328105,-0.02384292756877122,0.043478254653058435,2025-07-23,yfinance
TDIC,DREAMLAND LTD,TDOC,"Teladoc Health, Inc. Common Stock",1,True,7/23/2025,8.600000381469727,8.90999984741211,8.579999923706055,11515700,6585800.0,1.7485650945974673,0.021377708259476432,0.036046447929273744,-0.03703702910858101,0.019002357002653753,2025-07-23,yfinance
LAWR,"ROBOT CONSULTING CO., LTD.",LASR,"nLIGHT, Inc. - Common Stock",1,True,7/17/2025,19.450000762939453,19.75,19.15999984741211,369100,474180.0,0.7783963895567084,0.0,0.015424124693721009,-0.029873425447488132,-0.01491007219289776,2025-07-17,yfinance
BMHL,BLUEMOUNT HOLDINGS LTD,BMBL,Bumble Inc. - common stock,1,True,7/11/2025,6.599999904632568,6.775000095367432,6.519999980926514,1479500,1959060.0,0.755209130909722,-0.011976036790700247,0.026515180797507268,-0.037638392745600165,-0.023952073581400495,2025-07-11,yfinance
MSGY,MASONGLORY LTD,MAGY,Roundhill Magnificent Seven Covered Call ETF,1,True,7/08/2025,47.88060423032584,47.88060423032584,47.677650451660156,34500,23940.0,1.4411027568922306,0.004078443674801678,0.0,-0.0042387472323738296,-0.00017759104941110967,2025-07-08,yfinance
MAMK,MAXSMAKING INC.,MAMO,Massimo Group - Common Stock,1,True,7/07/2025,2.8299999237060547,2.8299999237060547,2.4800000190734863,35300,106440.0,0.3316422397594889,0.014336904085998865,0.0,-0.12367488129618834,-0.11111109212118021,2025-07-07,yfinance
COSO,"COASTALSOUTH BANCSHARES, INC.",CISO,"CISO Global, Inc. - Common Stock",1,True,7/02/2025,1.1699999570846558,1.25,1.2000000476837158,688600,926000.0,0.7436285097192225,0.0,0.06837610756387046,-0.039999961853027344,0.0256411040166298,2025-07-02,yfinance
COSO,"COASTALSOUTH BANCSHARES, INC.",CPSO,Calamos S&P 500 Structured Alt Protection ETF - October,1,True,7/02/2025,26.239999771118164,26.239999771118164,26.239999771118164,1100,280.0,3.9285714285714284,0.0007627939850282585,0.0,0.0,0.0007627939850282585,2025-07-02,yfinance
CV,"CAPSOVISION, INC",CG,The Carlyle Group Inc. - Common Stock,1,True,7/02/2025,52.13044188239157,53.99753497477619,53.79008102416992,3122700,2857200.0,1.0929231415371692,-0.0009466183554731184,0.035815792557386206,-0.0038419152041509427,0.030859520956446593,2025-07-02,yfinance
CV,"CAPSOVISION, INC",FV,First Trust Dorsey Wright Focus 5 ETF,1,True,7/02/2025,59.25586246448357,59.435184478759766,59.435184478759766,120100,136800.0,0.8779239766081871,-0.0008398729158609042,0.0030262324573146885,0.0,0.0021838178907757863,2025-07-02,yfinance
CV,"CAPSOVISION, INC",CB,Chubb Limited  Common Stock,1,True,7/02/2025,288.1700134277344,288.489990234375,280.0799865722656,2546700,2166740.0,1.1753602185772174,-0.004903425284412893,0.0011103750970982516,-0.029151804037557495,-0.03283956588931621,2025-07-02,yfinance
CV,"CAPSOVISION, INC",CC,Chemours Company (The) Common Stock,1,True,7/02/2025,12.406972811308584,12.688276347021882,12.564897537231445,4413000,8500160.0,0.5191666980386251,0.017813693877207427,0.022673019437658263,-0.009723843208963131,0.030769146515870805,2025-07-02,yfinance
CV,"CAPSOVISION, INC",CF,"CF Industries Holdings, Inc. Common Stock",1,True,7/02/2025,92.17331601306621,93.23073451370523,92.74649810791016,2526700,2937460.0,0.860164904373166,0.008433329501874589,0.01147206747437751,-0.00519395678175086,0.01470429764445936,2025-07-02,yfinance
CV,"CAPSOVISION, INC",DV,"DoubleVerify Holdings, Inc. Common Stock",1,True,7/02/2025,15.079999923706055,15.270000457763672,15.119999885559082,2163700,2048160.0,1.0564116084680883,0.0013279882823445822,0.012599504974726998,-0.00982321988918642,0.003984028172019791,2025-07-02,yfinance
CV,"CAPSOVISION, INC",VV,Vanguard Large-Cap ETF,1,True,7/02/2025,283.3356119767895,284.7181396484375,284.7181396484375,401600,330420.0,1.215422795230313,-0.0006314892782337991,0.0048794701873242155,0.0,0.004244899575983659,2025-07-02,yfinance
CV,"CAPSOVISION, INC",XV,Simplify Target 15 Distribution ETF,1,True,7/02/2025,23.68126628264646,23.947446937396023,23.592538833618164,124400,12760.0,9.74921630094044,0.006789754130218192,0.011240136045622597,-0.014820289808164865,0.003017578878877775,2025-07-02,yfinance
PMI,"PICARD MEDICAL, INC.",OMI,"Owens & Minor, Inc. Common Stock",1,True,8/29/2025,4.949999809265137,4.989999771118164,4.900000095367432,1157800,1695220.0,0.6829792003397789,-0.002016175162283258,0.008080800685720759,-0.018036007991752916,-0.01209676256413027,2025-08-29,yfinance
PMI,"PICARD MEDICAL, INC.",PNI,Pimco New York Municipal Income Fund II Common Shares of Beneficial Interest,1,True,8/29/2025,6.4377929176224375,6.506593456012121,6.486936092376709,18200,54100.0,0.3364140480591497,-0.007575714336391153,0.010686975997838157,-0.003021145207289469,0.0,2025-08-29,yfinance
THH,TRYHARD HOLDINGS LTD,TBH,"Brag House Holdings, Inc. - Common Stock",1,True,8/28/2025,1.1399999856948853,1.2000000476837158,1.184999942779541,158100,63420.0,2.492904446546831,-0.008695644061371431,0.05263163398397555,-0.012500086923436843,0.03043475421480001,2025-08-28,yfinance
THH,TRYHARD HOLDINGS LTD,THG,Hanover Insurance Group Inc,1,True,8/28/2025,173.0719726205072,173.0719726205072,171.6761474609375,130300,175340.0,0.7431276377324056,0.001088055635926845,0.0,-0.008064998268843444,-0.006985717799736755,2025-08-28,yfinance
CURX,CURANEX PHARMACEUTICALS INC,CYRX,"CryoPort, Inc. - Common Stock",1,True,8/26/2025,8.859999656677246,9.050000190734863,8.789999961853027,274200,440600.0,0.622333182024512,0.005675282029410189,0.02144475636795598,-0.02872930645327686,-0.002270199411016832,2025-08-26,yfinance
ETS,ELITE EXPRESS HOLDING INC.,ETD,Ethan Allen Interiors Inc. Common Stock,1,True,8/21/2025,28.617269110108687,28.617269110108687,28.33207893371582,235500,267440.0,0.8805713431049955,-1.4183132454623078e-08,0.0,-0.00996566706961311,-0.009965681111401187,2025-08-21,yfinance
ETS,ELITE EXPRESS HOLDING INC.,WTS,"Watts Water Technologies, Inc. Class A Common Stock",1,True,8/21/2025,273.89710856358056,275.20223196674993,270.1909484863281,232200,152680.0,1.5208278752947342,-0.004850480938229765,0.004765013438856413,-0.01820945798516371,-0.01831606090651024,2025-08-21,yfinance
CEPF,"CANTOR EQUITY PARTNERS IV, INC.",CEPT,"Cantor Equity Partners II, Inc. - Class A ordinary share",1,True,8/21/2025,10.520000457763672,10.630000114440918,10.520000457763672,361000,197600.0,1.8269230769230769,0.0009514965427265139,0.010456240674026517,-0.010348039086830386,0.0009514965427265139,2025-08-21,yfinance
CEPF,"CANTOR EQUITY PARTNERS IV, INC.",CSPF,Cohen & Steers Preferred and Income Opportunities Active ETF,1,True,8/21/2025,25.174782614113706,25.279502538679093,25.256013870239258,43900,9300.0,4.720430107526882,-0.0026367148802003103,0.004159715147120204,-0.0009291586495381554,0.0005814687166807846,2025-08-21,yfinance
MAGH,MAGNITUDE INTERNATIONAL LTD,MAGN,Magnera Corporation Common Stock,1,True,8/12/2025,12.890000343322754,13.5600004196167,13.479999542236328,625400,989760.0,0.6318703524086647,0.0031128374058812538,0.05197828226909374,-0.005899769535746996,0.04902717058865527,2025-08-12,yfinance
EFTY,"ETOILES CAPITAL GROUP CO., LTD",SFTY,Horizon Managed Risk ETF,1,True,8/08/2025,26.27592360517628,26.310858203092348,26.30087661743164,11900,17200.0,0.6918604651162791,0.009007315377213937,0.0013295288280250847,-0.00037937134485161464,0.009965522300200839,2025-08-08,yfinance
WYFI,"WHITEFIBER, INC.",SYFI,AB Short Duration High Yield ETF,1,True,8/07/2025,35.231719970703125,35.40812387089808,35.231719970703125,65400,93540.0,0.6991661321359846,0.000835168583877226,0.005006962485556876,-0.00498201770978162,0.000835168583877226,2025-08-07,yfinance
FLY,FIREFLY AEROSPACE INC.,VLY,Valley National Bancorp - Common Stock,1,True,8/07/2025,9.15947041725786,9.15947041725786,9.012369155883789,6534000,7366060.0,0.8870413762581353,0.014115066027874427,0.0,-0.016060018174949127,-0.0021716403640229713,2025-08-07,yfinance
FLY,FIREFLY AEROSPACE INC.,DLY,DoubleLine Yield Opportunities Fund Common Shares of Beneficial Interest,1,True,8/07/2025,14.856141976615001,14.894604443908458,14.83691120147705,152300,112680.0,1.3516151934682286,0.0019455114827157715,0.0025889943266562744,-0.003873432332404243,0.0006485267835837245,2025-08-07,yfinance
FLY,FIREFLY AEROSPACE INC.,FLG,"Flagstar Bank, N.A. Common Stock",1,True,8/07/2025,11.41218848905276,11.561954357315976,11.35228157043457,8891400,6532580.0,1.361085512921388,0.011504467380682117,0.013123325855236317,-0.01813471843959776,0.006194695651321286,2025-08-07,yfinance
FLY,FIREFLY AEROSPACE INC.,RLY,State Street Multi-Asset Real Return ETF,1,True,8/07/2025,28.9462072319648,28.9462072319648,28.926681518554688,35200,41300.0,0.8523002421307506,0.005766672326303688,0.0,-0.0006745517039119831,0.0050882307037480945,2025-08-07,yfinance
CTW,CTW CAYMAN,CGW,Invesco S&P Global Water Index ETF,1,True,8/06/2025,62.06632383805097,62.223827445722414,62.125389099121094,19800,19040.0,1.0399159663865547,0.0012703885636843593,0.002537666127647846,-0.0015820040431808419,0.002223245012160554,2025-08-06,yfinance
CTW,CTW CAYMAN,CTS,CTS Corporation Common Stock,1,True,8/06/2025,38.566268739030185,38.70600098980057,38.336708068847656,220000,217080.0,1.0134512622074812,-0.007449204507187173,0.0036231726671803514,-0.00954097327311669,-0.013357233291235478,2025-08-06,yfinance
CTW,CTW CAYMAN,DTW,DTE Energy Company 2017 Series E 5.25% Junior Subordinated Debentures due 2077,1,True,8/06/2025,22.422297406995582,22.422297406995582,22.286346435546875,18200,27860.0,0.6532663316582915,0.0013010098251543107,0.0,-0.006063204362202949,-0.004770082825495783,2025-08-06,yfinance
CTW,CTW CAYMAN,FTW,EQV Ventures Acquisition Corp. Class A Ordinary Shares,1,True,8/06/2025,10.479999542236328,10.489999771118164,10.390000343322754,238700,130300.0,1.831926323867997,0.0,0.0009542203548323808,-0.009532834125577,-0.008587710195106485,2025-08-06,yfinance
APACU,STONEBRIDGE ACQUISITION II CORP,APADU,A Paradise Acquisition Corp. - Unit,1,True,9/30/2025,10.029999732971191,10.100000381469727,9.979999542236328,2100,6320.0,0.3322784810126582,0.0,0.00697912765325656,-0.011881270762480528,-0.0049850640145582235,2025-09-30,yfinance
MGN,MEGAN HOLDINGS LTD.,MGM,MGM Resorts International Common Stock,1,True,9/26/2025,34.529998779296875,35.79999923706055,35.599998474121094,4411100,5290140.0,0.8338342652557399,0.0014500939015181897,0.03677962648886988,-0.005586613608986063,0.03248256806131396,2025-09-26,yfinance
MGN,MEGAN HOLDINGS LTD.,MHN,"Blackrock MuniHoldings New York Quality Fund, Inc. Common Stock",1,True,9/26/2025,9.948903777506048,9.988305337560423,9.96860408782959,463400,258520.0,1.792511217700758,-0.0029614618247377567,0.003960392113094821,-0.001972431665334409,-0.0009871771149999695,2025-09-26,yfinance
MGN,MEGAN HOLDINGS LTD.,MTN,"Vail Resorts, Inc. Common Stock",1,True,9/26/2025,145.3037880325299,147.6200598611936,145.61920166015625,551100,790600.0,0.6970655198583354,0.004360278107771766,0.015940890874401335,-0.013554107774503972,0.006540461591294348,2025-09-26,yfinance
MGN,MEGAN HOLDINGS LTD.,MYN,"Blackrock MuniYield New York Quality Fund, Inc.Common Stock",1,True,9/26/2025,9.671133922518036,9.720376137973824,9.690831184387207,43800,152100.0,0.2879684418145957,-7.50047677918542e-09,0.005091669275836775,-0.0030394866584633807,0.002036699040787132,2025-09-26,yfinance
PTRN,PATTERN GROUP INC.,LTRN,Lantern Pharma Inc. - Common Stock,1,True,9/19/2025,4.070000171661377,4.144000053405762,4.03000020980835,69800,210200.0,0.33206470028544244,0.0,0.018181788359526767,-0.027509614413185376,-0.009828000040771332,2025-09-19,yfinance
PTRN,PATTERN GROUP INC.,PTEN,"Patterson-UTI Energy, Inc. - Common Stock",1,True,9/19/2025,5.394681372361709,5.414405966272173,5.276333808898926,15244500,6990900.0,2.1806205209629663,-0.010849965131464842,0.003656303783114603,-0.025500887490398135,-0.03254976321881128,2025-09-19,yfinance
NTSK,NETSKOPE INC,NTWK,NETSOL Technologies Inc. - Common Stock,1,True,9/18/2025,5.010000228881836,5.190000057220459,5.099999904632568,40900,571180.0,0.07160614867467348,0.0,0.035928107807451454,-0.017341069671604366,0.017964006315189157,2025-09-18,yfinance
WBI,WATERBRIDGE INFRASTRUCTURE LLC,ABI,VictoryShares Pioneer Asset-Based Income ETF,1,True,9/17/2025,24.53539276123047,24.53539276123047,24.53539276123047,100,100.0,1.0,-0.0001995930416020917,0.0,0.0,-0.0001995930416020917,2025-09-17,yfinance
WBI,WATERBRIDGE INFRASTRUCTURE LLC,EBI,Longview Advantage ETF,1,True,9/17/2025,54.369998931884766,54.400001525878906,54.23099899291992,600,3340.0,0.17964071856287425,0.0014366594572551127,0.0005518225967178728,-0.003106664121665278,-0.001123569295298406,2025-09-17,yfinance
WBI,WATERBRIDGE INFRASTRUCTURE LLC,SBI,Western Asset Intermediate Muni Fund Inc Common Stock,1,True,9/17/2025,7.751580715179443,7.780942501709733,7.751580715179443,38600,65020.0,0.59366348815749,0.0,0.003787845035631527,-0.0037735514076653017,0.0,2025-09-17,yfinance
LGN,LEGENCE CORP.,OGN,Organon & Co. Common Stock ,1,True,9/12/2025,10.541623307868225,10.68623449512886,10.621408462524414,2698200,3514380.0,0.7677598893688218,-0.008442804590602036,0.013718113713349786,-0.006066312004850284,-0.0009381213102624982,2025-09-12,yfinance
VIA,"VIA TRANSPORTATION, INC.",CIA,"Citizens, Inc. Class A Common Stock ($1.00 Par)",1,True,9/12/2025,5.349999904632568,5.460000038146973,5.449999809265137,126900,158400.0,0.8011363636363636,-0.01654414552228438,0.02056077298602475,-0.0018315437384556939,0.0018381896947602346,2025-09-12,yfinance
FIGR,"FIGURE TECHNOLOGY SOLUTIONS, INC.",TIGR,UP Fintech Holding Limited - American Depositary Shares representing fifteen Class A Ordinary Shares,1,True,9/11/2025,11.489999771118164,11.65999984741211,11.239999771118164,5797900,5582060.0,1.0386667287703824,0.02589285417783012,0.01479548126025781,-0.03602059020499582,0.003571425226269879,2025-09-11,yfinance
ZGM,ZENTA GROUP CO LTD,AGM,Federal Agricultural Mortgage Corporation Common Stock,1,True,9/09/2025,198.9966290325728,199.4198304369744,196.5853271484375,40000,76160.0,0.5252100840336135,-0.005948777857894233,0.0021266762480299287,-0.014213748363569709,-0.01799399488760537,2025-09-09,yfinance
MPLT,"MAPLIGHT THERAPEUTICS, INC.",KPLT,"Katapult Holdings, Inc. - Common Stock",1,True,10/27/2025,12.40999984741211,12.5600004196167,12.329999923706055,45000,59420.0,0.7573207674183776,-0.011155405672910687,0.01208707284842311,-0.01831214078236978,-0.01752990148886416,2025-10-27,yfinance
LAFAU,LAFAYETTE ACQUISITION CORP.,LATAU,Galata Acquisition Corp. II - Units,1,True,10/24/2025,10.09000015258789,10.09000015258789,10.09000015258789,0,8220.0,0.0,0.0,0.0,0.0,0.0,2025-10-24,yfinance
MCTA,CHARMING MEDICAL LTD,MCGA,Yorkville Acquisition Corp. - Class A Ordinary Share,1,True,10/21/2025,10.4399995803833,10.470000267028809,10.470000267028809,171200,179100.0,0.9558905639307649,-0.0019120896453854153,0.0028736291045335796,0.0,0.0009560448226927077,2025-10-21,yfinance
BGIN,BGIN BLOCKCHAIN LTD,BFIN,BankFinancial Corporation - Common Stock,1,True,10/21/2025,11.498513557645952,11.498513557645952,11.409300804138184,12800,24560.0,0.5211726384364821,0.007819300677514815,0.0,-0.007758633588638585,0.0,2025-10-21,yfinance
BGIN,BGIN BLOCKCHAIN LTD,BBIN,JPMorgan BetaBuilders International Equity ETF,1,True,10/21/2025,69.92536597989869,70.11186219902845,69.79776763916016,77300,53420.0,1.4470235866716585,-0.005583486952647622,0.0026670753383454112,-0.004479906110276545,-0.0073980773418393245,2025-10-21,yfinance
ACCL,ACCO GROUP HOLDINGS LTD,ACCO,Acco Brands Corporation Common Stock,1,True,10/17/2025,3.7030732614862174,3.7812383225359767,3.7226145267486572,380200,582000.0,0.6532646048109966,-0.005249338904693745,0.02110815950165349,-0.01550386164181316,0.0,2025-10-17,yfinance
SEV,APTERA MOTORS CORP,EEV,ProShares UltraShort MSCI Emerging Markets,1,True,10/16/2025,19.282452913917243,19.51904720902419,19.499332427978516,4750,15360.0,0.3092447916666667,-0.023952095550297463,0.01226992728379404,-0.0010100278376579841,-0.012973990422148043,2025-10-16,yfinance
SEV,APTERA MOTORS CORP,SEB,Seaboard Corporation Common Stock,1,True,10/16/2025,3435.8016989626612,3482.2339773309436,3437.75048828125,1500,2080.0,0.7211538461538461,-0.002069689614993509,0.0135142486198494,-0.012774411294380983,-0.0015036627892423546,2025-10-16,yfinance
SEV,APTERA MOTORS CORP,SEG,Seaport Entertainment Group Inc. Common Stock,1,True,10/16/2025,24.229999542236328,24.395000457763672,24.18000030517578,55200,83100.0,0.6642599277978339,-0.008592511752552894,0.006809777905266722,-0.00881328749963057,-0.010638307004925003,2025-10-16,yfinance
SEV,APTERA MOTORS CORP,SRV,NXG Cushing Midstream Energy Fund Common Shares of Beneficial Interest,1,True,10/16/2025,40.359962568472106,40.69382311547548,38.91323471069336,59900,27160.0,2.2054491899852726,0.0011501765239758791,0.008272072761142167,-0.04375574149741122,-0.034736671679614445,2025-10-16,yfinance
SLGB,SMART LOGISTICS GLOBAL LTD,SLGN,Silgan Holdings Inc. Common Stock,1,True,10/15/2025,43.1909795527131,43.45961775339232,42.713401794433594,993100,1155180.0,0.8596928617185201,-0.0002302770376382871,0.0062197755980819185,-0.017170329550367052,-0.011285080332973535,2025-10-15,yfinance
LFS,"LEIFRAS CO., LTD.",OFS,OFS Capital Corporation - Closed End Fund,1,True,10/09/2025,7.180867597565441,7.287179362401387,7.016568183898926,94600,53360.0,1.772863568215892,-0.006684524403993447,0.01480486353375875,-0.037135243287505046,-0.029411743365895787,2025-10-09,yfinance
LFS,"LEIFRAS CO., LTD.",KFS,"Kingsway Financial Services, Inc. Common Stock (DE)",1,True,10/09/2025,15.010000228881836,15.199999809265137,15.050000190734863,40100,49240.0,0.814378554021121,-0.0039813846819777695,0.012658199699271738,-0.009868396079771092,-0.0013271071330030807,2025-10-09,yfinance
LFS,"LEIFRAS CO., LTD.",LVS,Las Vegas Sands Corp. Common Stock,1,True,10/09/2025,52.765437915030596,52.765437915030596,51.64997482299805,5423300,5150020.0,1.0530638715966152,-0.0054439762504187045,0.0,-0.02114003287206305,-0.026468923285593172,2025-10-09,yfinance
LFS,"LEIFRAS CO., LTD.",PFS,"Provident Financial Services, Inc Common Stock",1,True,10/09/2025,19.112193260030242,19.131935829679147,18.983856201171875,385500,649100.0,0.5938992451086119,-0.0005162272293958886,0.0010329829434172237,-0.007739918731985181,-0.007227691791775527,2025-10-09,yfinance
ALH,ALLIANCE LAUNDRY HOLDINGS INC.,ALB,Albemarle Corporation Common Stock,1,True,10/09/2025,95.33226839968528,99.55950749979519,96.2096176147461,5594900,2770500.0,2.01945497202671,0.04286183073931194,0.044342164212300104,-0.03364711185474663,0.05245935762055673,2025-10-09,yfinance
ALH,ALLIANCE LAUNDRY HOLDINGS INC.,ALG,"Alamo Group, Inc. Common Stock",1,True,10/09/2025,188.89030486257775,188.89030486257775,185.18638610839844,56600,71840.0,0.7878619153674833,-0.0013723625553452759,0.0,-0.01960883464545204,-0.02095428677037594,2025-10-09,yfinance
ALH,ALLIANCE LAUNDRY HOLDINGS INC.,APH,Amphenol Corporation Common Stock,1,True,10/09/2025,125.8672890963752,126.2465550064561,126.00701904296875,3322800,6533900.0,0.5085477280031834,0.002543922403119538,0.003013220613582164,-0.0018973663358584805,0.0036568836001133944,2025-10-09,yfinance
POM,POMDOCTOR LTD,PIM,Putnam Master Intermediate Income Trust Common Stock,1,True,10/08/2025,3.362836050899502,3.362836050899502,3.353031873703003,27700,45560.0,0.6079894644424935,0.0058650467121648285,0.0,-0.0029154490579095353,0.002932498409343717,2025-10-08,yfinance
CBK,"COMMERCIAL BANCGROUP, INC.",CBL,"CBL & Associates Properties, Inc. Common Stock",1,True,10/02/2025,30.179670647361302,30.209257355456604,29.71612548828125,144100,112980.0,1.2754469817666845,-0.002282347925724209,0.000980352252382465,-0.016323865938607088,-0.017606808989323753,2025-10-02,yfinance
CBK,"COMMERCIAL BANCGROUP, INC.",CNK,"Cinemark Holdings Inc Cinemark Holdings, Inc. Common Stock",1,True,10/02/2025,27.718984906982357,27.918331121860675,27.728952407836914,2374200,2614600.0,0.908054769371988,-0.007494693593269921,0.007191685249199119,-0.006783310692789687,-0.00713779749758101,2025-10-02,yfinance
CBK,"COMMERCIAL BANCGROUP, INC.",FBK,FB Financial Corporation Common Stock,1,True,10/02/2025,55.717068238052505,56.70365366508635,56.61396408081055,319400,466680.0,0.6844090168852318,-0.0016071645148681766,0.01770705922319234,-0.0015817249591277493,0.014464290999628352,2025-10-02,yfinance
CBK,"COMMERCIAL BANCGROUP, INC.",VBK,Vanguard Small-Cap Growth ETF,1,True,10/02/2025,299.37429266442285,301.40174703860686,301.0721740722656,211200,163120.0,1.2947523295733203,0.003515186180909202,0.006772306186144829,-0.001093467339122677,0.009206555877152082,2025-10-02,yfinance
NP,NEPTUNE INSURANCE HOLDINGS INC.,BP,BP p.l.c. Common Stock,1,True,10/01/2025,34.18602383670546,34.30438178142132,33.9887580871582,5595000,5548400.0,1.008398817677168,0.0058038528222008785,0.003462173468351123,-0.009200681600216252,0.0,2025-10-01,yfinance
NP,NEPTUNE INSURANCE HOLDINGS INC.,HP,"Helmerich & Payne, Inc. Common Stock",1,True,10/01/2025,21.87016324344341,23.2178495040167,22.900747299194336,1915000,1807160.0,1.0596737422253701,-0.0009053904139787187,0.06162213997087203,-0.013657690595656012,0.046174778278165546,2025-10-01,yfinance
NP,NEPTUNE INSURANCE HOLDINGS INC.,MP,MP Materials Corp. Common Stock,1,True,10/01/2025,66.04000091552734,67.98999786376953,67.62999725341797,8046800,15777960.0,0.5100025605338079,-0.015357071477314467,0.029527512435023356,-0.0052949054517237954,0.00834944924916952,2025-10-01,yfinance
NP,NEPTUNE INSURANCE HOLDINGS INC.,NL,"NL Industries, Inc. Common Stock",1,True,10/01/2025,6.0463485258546426,6.183988846703199,6.066011428833008,18200,21380.0,0.8512628624883068,-7.59511309216487e-09,0.02276420557961494,-0.019077883352439668,0.0032520217487037968,2025-10-01,yfinance
