IPO_Ticker,IPO_Name,Typo_Ticker,Typo_Name,Distance,Keyboard_Proximate,IPO_Date,Date,Data_Source,Typo_Open,Typo_High,Typo_Close,Typo_Volume,Avg_Volume_5d,Volume_Spike_Ratio,Gap_Up_Pct,Intraday_High_Pct,Reversion_From_High_Pct,Day_Return
AMIX,"AUTONOMIX MEDICAL, INC.",ANIX,"Anixa Biosciences, Inc. - Common Stock",1,True,1/29/2024,2024-01-29,yfinance,4.369999885559082,4.670000076293945,4.440000057220459,94200,137540.0,0.6848916678784354,-0.0022831572193035,0.06864993102774014,-0.049250538611556406,0.013698616715036242
HAO,HAOXI HEALTH TECHNOLOGY LTD,HAL,Halliburton Company Common Stock,1,True,1/26/2024,2024-01-26,yfinance,35.06344369662073,36.00493729895607,35.691104888916016,8835500,12212500.0,0.7234800409416582,-0.0035135874883422276,0.02685114475581528,-0.008716371519668108,0.014324245418053029
HAO,HAOXI HEALTH TECHNOLOGY LTD,HZO,"MarineMax, Inc.  (FL) Common Stock",1,True,1/26/2024,2024-01-26,yfinance,28.8700008392334,29.290000915527344,28.010000228881836,1169900,610840.0,1.9152314845131295,0.01762425044797816,0.014547975894866576,-0.043700943893345806,-0.012689481836521873
YIBO,PLANET IMAGE INTERNATIONAL LTD,GIBO,GIBO Holdings Limited - Class A Ordinary Shares,1,True,1/25/2024,2024-01-25,yfinance,2088.0,2088.60009765625,2088.0,751,21.2,35.424528301886795,0.0009587727708533077,0.0002874030920737548,-0.0002873205152692502,0.0009587727708533077
CGON,"CG ONCOLOGY, INC.",CBON,VanEck China Bond ETF,1,True,1/25/2024,2024-01-25,yfinance,21.18943042405204,21.208676486696106,21.146127700805664,5300,5740.0,0.9233449477351916,0.00022716613710384447,0.0009082859831012158,-0.0029492074118664616,-0.0018168982521672905
JL,J-LONG GROUP LTD,HL,Hecla Mining Company Common Stock,1,True,1/24/2024,2024-01-24,yfinance,4.120274757012849,4.140083752102961,3.8924713134765625,4860600,5261020.0,0.9238892838270906,0.029702893804964024,0.004807687899064577,-0.059808557858430623,-0.027227742830081742
JL,J-LONG GROUP LTD,NL,"NL Industries, Inc. Common Stock",1,True,1/24/2024,2024-01-24,yfinance,4.2420365446964015,4.364638833567544,4.23386287689209,12300,22820.0,0.5390008764241893,-0.0038391634467227795,0.028901752160628118,-0.02996260668114923,-0.005758592398326585
JL,J-LONG GROUP LTD,UL,Unilever PLC American Depositary Shares (each representing One Ordinary Share),1,True,1/24/2024,2024-01-24,yfinance,50.12289504914903,50.154484337954024,49.60692596435547,2223641,2407297.0,0.9237086242370592,0.0027385900612684616,0.0006302367166545135,-0.010917436014474076,-0.0075836810703924
SYNX,SILYNXCOM LTD.,SYBX,"Synlogic, Inc. - Common Stock",1,True,1/12/2024,2024-01-12,yfinance,3.7899999618530273,3.9600000381469727,3.7799999713897705,11100,23420.0,0.4739538855678907,-0.001580622222244554,0.0448549018482913,-0.04545456187455763,-0.004214971656703877
SDHC,SMITH DOUGLAS HOMES CORP.,SCHC,Schwab International Small-Cap Equity ETF,1,True,1/11/2024,2024-01-11,yfinance,31.855882734259964,31.902386962949112,31.80007553100586,279800,582280.0,0.48052483341347807,-0.0008749524652287767,0.0014598317389941412,-0.003207014950388375,-0.0026252845803101084
BRRR,COINSHARES BITCOIN ETF,GRRR,Gorilla Technology Group Inc. - Ordinary shares,1,True,1/11/2024,2024-01-11,yfinance,5.289999961853027,5.409999847412109,5.380000114440918,37530,85318.0,0.439883729107574,0.017307722286360898,0.0226842885490395,-0.00554523730449676,0.034615444572721796
WETH,WETOUCH TECHNOLOGY INC.,AETH,Bitwise Trendwise Ether and Treasuries Rotation Strategy ETF,1,True,2/21/2024,2024-02-21,yfinance,33.61564748623737,33.887976522614956,33.73649215698242,3800,6600.0,0.5757575757575758,-0.03157802193704506,0.00810125809681575,-0.004470150807955197,-0.028096648117629526
WETH,WETOUCH TECHNOLOGY INC.,EETH,ProShares Ether ETF,1,True,2/21/2024,2024-02-21,yfinance,41.60777963055805,42.319343398599436,41.94795608520508,68200,62980.0,1.0828834550651,-0.0338427999178151,0.01710170007530977,-0.008775828818900084,-0.025943701867548637
WETH,WETOUCH TECHNOLOGY INC.,SETH,ProShares Short Ether ETF,1,True,2/21/2024,2024-02-21,yfinance,91.42405063986924,91.42405063986924,90.9190673828125,450,2540.0,0.17716535433070865,0.032516290446968736,0.0,-0.0055235274910967165,0.0268131583316797
CHRO,PELTHOS THERAPEUTICS INC.,CGRO,CoreValues Alpha Greater China Growth ETF,1,True,2/16/2024,2024-02-16,yfinance,18.31920051574707,18.31920051574707,18.31920051574707,100,280.0,0.35714285714285715,0.00828523932575482,0.0,0.0,0.00828523932575482
TELO,"TELOMIR PHARMACEUTICALS, INC.",TWLO,Twilio Inc. Class A Common Stock,1,True,2/09/2024,2024-02-09,yfinance,71.69000244140625,72.58999633789062,71.5999984741211,3310900,2363860.0,1.4006328631983282,0.018902811533788047,0.012553966603920247,-0.013638213441440426,0.017623619286710173
MGX,"METAGENOMI, INC.",MTX,Minerals Technologies Inc. Common Stock,1,True,2/09/2024,2024-02-09,yfinance,68.83692032613939,70.14020076550004,70.13032531738281,135600,292900.0,0.4629566404916354,0.0001434184797269655,0.0189328696459094,-0.00014079583476306925,0.01893552137003773
PMNT,PERFECT MOMENT LTD.,PNNT,PennantPark Investment Corporation Common Stock,1,True,2/08/2024,2024-02-08,yfinance,5.3067521057823,5.314454389774369,5.206624984741211,478300,481140.0,0.9940973521220435,0.007309972594484549,0.00145141205741956,-0.020289835442116922,-0.011695823331420219
AHR,"AMERICAN HEALTHCARE REIT, INC.",AUR,"Aurora Innovation, Inc.  - Class A Common Stock",1,True,2/07/2024,2024-02-07,yfinance,3.1700000762939453,3.180000066757202,3.0799999237060547,3293200,3909000.0,0.8424661038628806,0.0031645538581142403,0.003154571048133175,-0.031446585204987866,-0.025316506313829312
AHR,"AMERICAN HEALTHCARE REIT, INC.",ABR,Arbor Realty Trust Common Stock,1,True,2/07/2024,2024-02-07,yfinance,9.84086256326035,9.84868536760249,9.58271598815918,9332600,8502420.0,1.097640436487494,0.001592266172334748,0.0007949307585440651,-0.0270055717606965,-0.0246816108885543
AHR,"AMERICAN HEALTHCARE REIT, INC.",WHR,Whirlpool Corporation Common Stock,1,True,2/07/2024,2024-02-07,yfinance,96.89463780533393,97.01775624892969,95.90089416503906,866000,1495280.0,0.5791557434059172,0.008697231078308677,0.0012706424873903577,-0.011511934794956104,-0.0016478868876715854
GUTS,"FRACTYL HEALTH, INC.",GITS,"Global Interactive Technologies, Inc. Common Stock - Common Stock",1,True,2/02/2024,2024-02-02,yfinance,0.5009999871253967,0.5080000162124634,0.5,288100,191060.0,1.5079032764576572,0.022448933417477248,0.01397211430529357,-0.01574806290777261,0.02040814340536656
AS,"AMER SPORTS, INC.",AZ,A2Z Cust2Mate Solutions Corp. - Common Shares,1,True,2/01/2024,2024-02-01,yfinance,2.8499999046325684,3.0,2.8499999046325684,6240,18288.0,0.34120734908136485,-0.033898353028728144,0.05263161417079772,-0.05000003178914388,-0.033898353028728144
AS,"AMER SPORTS, INC.",QS,QuantumScape Corporation - Common Stock,1,True,2/01/2024,2024-02-01,yfinance,6.909999847412109,7.039999961853027,6.96999979019165,6047500,7285060.0,0.8301235679596325,0.014684273931396366,0.018813331014703973,-0.009943206255778433,0.023494838290234184
AS,"AMER SPORTS, INC.",ZS,"Zscaler, Inc. - Common Stock",1,True,2/01/2024,2024-02-01,yfinance,236.61000061035156,240.36000061035156,238.05999755859375,1033500,1533420.0,0.6739836444027076,0.003988638556921395,0.015848865180366933,-0.009568992535851901,0.010141296763345808
AS,"AMER SPORTS, INC.",AA,Alcoa Corporation Common Stock ,1,True,2/01/2024,2024-02-01,yfinance,29.353354550863024,29.67050423996074,28.972776412963867,4174600,4986280.0,0.8372173243379835,0.011092373980833774,0.010804546667678567,-0.023515873587923716,-0.002016848417134027
AS,"AMER SPORTS, INC.",AD,"Array Digital Infrastructure, Inc. Common Shares",1,True,2/01/2024,2024-02-01,yfinance,31.3746048006187,31.3746048006187,30.858551025390625,128300,216220.0,0.5933771159004717,0.01328828123443987,0.0,-0.016448136271596966,-0.0033784224977164664
AS,"AMER SPORTS, INC.",AX,"Axos Financial, Inc. Common Stock",1,True,2/01/2024,2024-02-01,yfinance,56.2599983215332,56.27000045776367,54.290000915527344,1432300,813580.0,1.7604906708621155,0.01497380501150603,0.00017778415444140688,-0.03518748047145509,-0.020566469120910143
AS,"AMER SPORTS, INC.",WS,"Worthington Steel, Inc. Common Shares",1,True,2/01/2024,2024-02-01,yfinance,28.673346167230275,29.614084879274802,29.220510482788086,110700,146760.0,0.7542927228127555,-0.0026711165063312277,0.03280882205229552,-0.013290108341728855,0.016360592340629698
BOLD,"BOUNDLESS BIO, INC.",BILD,Nomura Global Listed Infrastructure ETF,1,True,3/28/2024,2024-03-28,yfinance,23.40251922607422,23.40251922607422,23.40251922607422,0,200.0,0.0,-0.0041174027960807725,0.0,0.0,-0.0041174027960807725
BOLD,"BOUNDLESS BIO, INC.",GOLD,"Gold.com, Inc. Common Stock",1,True,3/28/2024,2024-03-28,yfinance,28.75868659566332,29.597520536827904,29.254362106323242,410900,234200.0,1.7544833475661827,0.003993463374519909,0.02916801983895454,-0.011594161412192393,0.021297973126798816
MMA,MIXED MARTIAL ARTS GROUP LTD,MMS,"Maximus, Inc. Common Stock",1,True,3/28/2024,2024-03-28,yfinance,81.57717293198051,82.52189541654816,81.7135238647461,344500,268000.0,1.2854477611940298,0.003234017829825707,0.011580721059742576,-0.009795843245257852,0.004910858166365876
MMA,MIXED MARTIAL ARTS GROUP LTD,MNA,NYLI Merger Arbitrage ETF,1,True,3/28/2024,2024-03-28,yfinance,31.450000762939453,31.510000228881836,31.479999542236328,125300,37360.0,3.3538543897216275,-0.0003178106110669876,0.001907773115639664,-0.0009521004896093083,0.0006357424776132071
INTJ,INTELLIGENT GROUP LTD,IBTJ,iShares iBonds Dec 2029 Term Treasury ETF,1,True,3/20/2024,2024-03-20,yfinance,19.919773958701725,19.966360092163086,19.966360092163086,30700,42760.0,0.7179607109448082,-1.4848570811592927e-07,0.0023386878564959834,0.0,0.002338539023526145
INTJ,INTELLIGENT GROUP LTD,INTU,Intuit Inc. - Common Stock,1,True,3/20/2024,2024-03-20,yfinance,628.2155971516737,635.128837083496,632.6266479492188,1335500,1743300.0,0.7660758331899271,0.0010085612764813435,0.011004565889746947,-0.00393965600076875,0.008037198630580627
ALAB,"ASTERA LABS, INC.",SLAB,"Silicon Laboratories, Inc. - Common Stock",1,True,3/20/2024,2024-03-20,yfinance,128.60000610351562,132.6999969482422,131.60000610351562,176000,290980.0,0.6048525671867482,-0.0033325015876094328,0.03188173133853746,-0.008289305727381431,0.01991790551447415
ALAB,"ASTERA LABS, INC.",ZLAB,Zai Lab Limited - American Depositary Shares,1,True,3/20/2024,2024-03-20,yfinance,18.010000228881836,18.079999923706055,17.209999084472656,921900,569560.0,1.618617880469134,-0.014230991919398184,0.0038867126004786695,-0.04811951564737976,-0.05801868345551013
ZONE,"CLEANCORE SOLUTIONS, INC.",XONE,BondBloxx Bloomberg One Year Target Duration US Treasury ETF,1,True,4/26/2024,2024-04-26,yfinance,45.82558929324521,45.83300113927806,45.82373809814453,23900,26320.0,0.9080547112462006,4.039816866778431e-05,0.00016174033214112047,-0.0002021041804655251,0.0
MRX,MAREX GROUP PLC,MTX,Minerals Technologies Inc. Common Stock,1,True,4/25/2024,2024-04-25,yfinance,70.9928931677844,71.51693418614698,70.3798599243164,111600,132820.0,0.8402349043818702,-0.004160879394199402,0.007381598283705161,-0.015899370894045275,-0.012760085016577376
NCI,NEO-CONCEPT INTERNATIONAL GROUP HOLDINGS LTD,BCI,abrdn Bloomberg All Commodity Strategy K-1 Free ETF,1,True,4/23/2024,2024-04-23,yfinance,19.64424879685411,19.87638150680022,19.857038497924805,108700,161040.0,0.6749875807252856,-0.00926835799810496,0.011816828036879945,-0.0009731655064479023,0.0014634084401526262
NCI,NEO-CONCEPT INTERNATIONAL GROUP HOLDINGS LTD,HCI,"HCI Group, Inc. Common Stock",1,True,4/23/2024,2024-04-23,yfinance,110.93259526297493,113.90540189117873,112.25275421142578,118700,123220.0,0.9633176432397338,0.0015892394870878205,0.026798314969162254,-0.014508949113158197,0.013508702779607423
NCI,NEO-CONCEPT INTERNATIONAL GROUP HOLDINGS LTD,JCI,Johnson Controls International plc Ordinary Share,1,True,4/23/2024,2024-04-23,yfinance,63.37177710321159,63.958098929871966,63.68448257446289,2654700,3850920.0,0.6893677355021657,0.003248746579708715,0.009252096965900927,-0.004278056414858216,0.008199236946588194
NCI,NEO-CONCEPT INTERNATIONAL GROUP HOLDINGS LTD,MCI,Barings Corporate Investors Common Stock,1,True,4/23/2024,2024-04-23,yfinance,15.288207882165272,15.417915196121877,15.366032600402832,20900,23160.0,0.9024179620034543,0.003975096988342514,0.008484141173140173,-0.003365085036405892,0.00908583852475197
MFI,MF INTERNATIONAL LTD,MCI,Barings Corporate Investors Common Stock,1,True,4/22/2024,2024-04-22,yfinance,15.02879010412351,15.227676391601562,15.227676391601562,31600,24640.0,1.2824675324675325,-0.010250658067595973,0.013233685885564579,0.0,0.0028473738289817134
YYGH,YY GROUP HOLDING LTD.,HYGH,iShares Interest Rate Hedged High Yield Bond ETF,1,True,4/22/2024,2024-04-22,yfinance,74.69583638032901,75.06570332940295,75.00405883789062,24600,24300.0,1.0123456790123457,0.0010623225082173485,0.004951640774067848,-0.0008212071395883319,0.00519307335281294
MTEN,MINGTENG INTERNATIONAL CORP INC.,MTRN,Materion Corporation,1,True,4/18/2024,2024-04-18,yfinance,119.9097268377316,120.37549310209451,118.67098999023438,103700,88280.0,1.1746714997734482,0.0009926435073114618,0.0038843076091167545,-0.014159884773344088,-0.00934818958677229
CDTG,CDT ENVIRONMENTAL TECHNOLOGY INVESTMENT HOLDINGS LTD,CCTG,CCSC Technology International Holdings Limited - Class A Ordinary Shares,1,True,4/18/2024,2024-04-18,yfinance,2.6700000762939453,2.6700000762939453,2.4000000953674316,109000,99800.0,1.092184368737475,0.0809716782862743,0.0,-0.1011235854724331,-0.028340053616187213
IBTA,"IBOTTA, INC.",INTA,"Intapp, Inc. - Common Stock",1,True,4/18/2024,2024-04-18,yfinance,31.299999237060547,31.639999389648438,30.860000610351562,568900,453660.0,1.2540228364854737,0.00288369609830161,0.010862624948096351,-0.024652300706177157,-0.011214305811858295
CTRI,"CENTURI HOLDINGS, INC.",FTRI,First Trust Indxx Global Natural Resources Income ETF,1,True,4/18/2024,2024-04-18,yfinance,12.526171684265137,12.592098615290682,12.526171684265137,50800,65880.0,0.7710989678202793,0.00453171985934797,0.005263134873710888,-0.005235579313641184,0.00453171985934797
ULS,UL SOLUTIONS INC.,JLS,Nuveen Mortgage and Income Fund,1,True,4/12/2024,2024-04-12,yfinance,14.699687013807353,14.741999800232735,14.606596946716309,34200,13340.0,2.5637181409295353,0.0018455882552940318,0.002878482132690191,-0.009184836206163075,-0.004498891932478078
ULS,UL SOLUTIONS INC.,UPS,"United Parcel Service, Inc. Common Stock",1,True,4/12/2024,2024-04-12,yfinance,133.6362380973749,133.8618987446946,130.80194091796875,4123900,3098320.0,1.3310116450205272,-0.006442423423772633,0.0016886186750877446,-0.02285906486775518,-0.027514832202712423
BOW,BOWHEAD SPECIALTY HOLDINGS INC.,BLW,Blackrock Limited Duration Income Trust,1,True,5/23/2024,2024-05-23,yfinance,11.842902363053971,11.877254476473967,11.78278636932373,73000,80380.0,0.9081861159492411,0.002909038448426263,0.002900649888591738,-0.007953699008247673,-0.0021818481956666215
BOW,BOWHEAD SPECIALTY HOLDINGS INC.,NOW,"ServiceNow, Inc. Common Stock",1,True,5/23/2024,2024-05-23,yfinance,156.33599853515625,156.33599853515625,151.6300048828125,4307500,4346500.0,0.9910272633153112,0.014075724633126813,0.0,-0.030101791631090544,-0.016449771527926725
HDL,SUPER HI INTERNATIONAL HOLDING LTD.,BDL,"Flanigan's Enterprises, Inc. Common Stock",1,True,5/17/2024,2024-05-17,yfinance,26.04955025173518,28.133514124657477,27.458154678344727,6100,1000.0,6.1,-0.004057606310740024,0.07999999434859657,-0.024005513257969974,0.049797022688290456
HDL,SUPER HI INTERNATIONAL HOLDING LTD.,GDL,"GDL Fund, The Common Shares of Beneficial Interest",1,True,5/17/2024,2024-05-17,yfinance,7.095499182558247,7.18577262142892,7.167717933654785,27500,9460.0,2.9069767441860463,-0.00506320969027599,0.012722633961057737,-0.002512560405862734,0.005063363587724205
HDL,SUPER HI INTERNATIONAL HOLDING LTD.,HRL,Hormel Foods Corporation Common Stock,1,True,5/17/2024,2024-05-17,yfinance,34.00407151926267,34.23020158866759,34.21135711669922,2887600,1672360.0,1.7266617235523452,3.6386239686211115e-08,0.006650088042451575,-0.0005505217934389939,0.006095941838663678
HDL,SUPER HI INTERNATIONAL HOLDING LTD.,HXL,Hexcel Corporation Common Stock,1,True,5/17/2024,2024-05-17,yfinance,71.34464618010107,71.61030352945815,70.81332397460938,469500,687500.0,0.6829090909090909,0.0009665185923193364,0.003723577921831223,-0.011129397804059353,-0.006487940386133714
RAY,RAYTECH HOLDING LTD,DAY,"Dayforce, Inc. Common Stock",1,True,5/15/2024,2024-05-15,yfinance,62.810001373291016,63.18000030517578,62.599998474121094,1904600,1718660.0,1.108188937893475,0.011433219269172786,0.005890764588362228,-0.009180149228444576,0.008051529988496937
ZK,ZEEKR INTELLIGENT TECHNOLOGY HOLDING LTD,ZM,"Zoom Communications, Inc. - Class A Common Stock",1,True,5/10/2024,2024-05-10,yfinance,61.279998779296875,62.08000183105469,61.970001220703125,2242500,2670300.0,0.8397932816537468,0.0024537495265950166,0.01305488034748606,-0.001771916995925992,0.013741209519232708
PAL,"PROFICIENT AUTO LOGISTICS, INC",PSL,Invesco Dorsey Wright Consumer Staples Momentum ETF,1,True,5/09/2024,2024-05-09,yfinance,97.2433530722947,97.2433530722947,97.22361755371094,400,3920.0,0.10204081632653061,0.010046016235521092,0.0,-0.00020294979512981007,0.009841027603454412
SVCO,"SILVACO GROUP, INC.",SCCO,Southern Copper Corporation Common Stock,1,True,5/09/2024,2024-05-09,yfinance,104.33915027692277,108.4480784442735,108.05104064941406,788173,1380305.2,0.5710135700423355,0.00017706523973495792,0.03938050249063158,-0.003661086490006024,0.03575860495322346
VIK,VIKING HOLDINGS LTD,CIK,"Credit Suisse Asset Management Income Fund, Inc. Common Stock",1,True,5/01/2024,2024-05-01,yfinance,2.4708381556309793,2.4793877601623535,2.4793877601623535,124700,350660.0,0.3556151257628472,3.4690742733835127e-08,0.003460204186943557,0.0,0.003460238997723344
LSH,LAKESIDE HOLDING LTD,PSH,PGIM Short Duration High Yield ETF,1,True,6/28/2024,2024-06-28,yfinance,45.21486796162793,45.21486796162793,45.125118255615234,2100,3400.0,0.6176470588235294,0.0016901608327586463,0.0,-0.0019849600376775096,-0.0002981541066291371
LB,LANDBRIDGE CO LLC,KB,KB Financial Group Inc,1,True,6/28/2024,2024-06-28,yfinance,54.4066057814774,54.869230148470976,54.560813903808594,201700,280860.0,0.718151392152674,0.010924127414828155,0.008503091864463866,-0.005620932603352313,0.013789454322631909
LB,LANDBRIDGE CO LLC,LH,Labcorp Holdings Inc. Common Stock,1,True,6/28/2024,2024-06-28,yfinance,201.69182398924454,201.97690223510543,200.0502166748047,712500,654620.0,1.0884177079832575,0.0013664640176892042,0.0014134348146709692,-0.009539138084502538,-0.006783844107115449
LB,LANDBRIDGE CO LLC,PB,"Prosperity Bancshares, Inc. Common Stock",1,True,6/28/2024,2024-06-28,yfinance,57.80688853816455,58.930832312423874,58.235511779785156,874300,599140.0,1.4592582701872685,0.00763747468716784,0.019443076814578727,-0.011798926052027427,0.015108847938708161
RECT,RECTITUDE HOLDINGS LTD.,DECT,AllianzIM U.S. Large Cap Buffer10 Dec ETF,1,True,6/21/2024,2024-06-21,yfinance,30.950000762939453,31.010000228881836,30.993999481201172,1500,1560.0,0.9615384615384616,-0.0012907069530213072,0.001938593359074425,-0.000515986699856952,0.00012906454057916557
TEM,"TEMPUS AI, INC.",FEM,First Trust Emerging Markets AlphaDEX Fund,1,True,6/14/2024,2024-06-14,yfinance,22.477227815492625,22.571077018516434,22.542922973632812,31400,40080.0,0.783433133732535,-0.002083232047764551,0.004175301500442224,-0.001247350530084345,0.000833422106364713
TEM,"TEMPUS AI, INC.",GEM,Goldman Sachs ActiveBeta Emerging Markets Equity ETF,1,True,6/14/2024,2024-06-14,yfinance,30.747920802834834,30.909900665283203,30.909900665283203,77200,42900.0,1.7995337995337994,-0.003089169692093526,0.0052679940047665064,0.0,0.0021625505852553256
TEM,"TEMPUS AI, INC.",REM,iShares Mortgage Real Estate ETF,1,True,6/14/2024,2024-06-14,yfinance,19.00146517484397,19.113643852169773,19.053239822387695,239000,265500.0,0.9001883239171374,-0.00407047900050011,0.005903685652321051,-0.0031602571570998658,-0.001356798794596438
TEM,"TEMPUS AI, INC.",TSM,Taiwan Semiconductor Manufacturing Company Ltd.,1,True,6/14/2024,2024-06-14,yfinance,168.55388866505714,170.16102979606623,169.0536651611328,9192500,14770420.0,0.6223587413221832,-0.005262984884977134,0.009534880172374584,-0.006507745259067645,-0.002313505736982737
TEM,"TEMPUS AI, INC.",TWM,ProShares UltraShort Russell2000,1,True,6/14/2024,2024-06-14,yfinance,53.36838843592185,54.18874081255562,53.73299026489258,938760,874068.0,1.0740125482227927,0.025394063204424895,0.015371503631194496,-0.008410428823942072,0.03239934407980573
WAY,WAYSTAR HOLDING CORP.,SAY,Saratoga Investment Corp 8.125% Notes due 2027,1,True,6/07/2024,2024-06-07,yfinance,22.173840874727475,22.22437631352407,22.200439453125,2500,4460.0,0.5605381165919282,-0.002393326382343317,0.0022790566182059706,-0.0010770543146581908,-0.0011966496555631252
WAY,WAYSTAR HOLDING CORP.,WAT,Waters Corporation Common Stock,1,True,6/07/2024,2024-06-07,yfinance,300.6300048828125,304.67999267578125,302.0899963378906,453600,661660.0,0.6855484690022066,0.0002662355451462173,0.013471668586598538,-0.008500710253878451,0.005123968083414784
RAPP,"RAPPORT THERAPEUTICS, INC.",DAPP,VanEck Digital Transformation ETF,1,True,6/07/2024,2024-06-07,yfinance,11.163826452821118,11.530486387269372,10.768219947814941,331400,168660.0,1.9648997984110044,-0.006866895268179544,0.032843571690923105,-0.06610878447383077,-0.042060018184346376
GAUZ,GAUZY LTD.,HAUZ,Xtrackers International Real Estate ETF,1,True,6/06/2024,2024-06-06,yfinance,19.538722924719657,19.63015214334466,19.602724075317383,64500,60000.0,1.075,-0.007892377662928675,0.0046793855963497746,-0.0013972417445870804,-0.00464262436067914
FLYE,"FLY-E GROUP, INC.",FLYW,Flywire Corporation - Voting Common Stock,1,True,6/06/2024,2024-06-06,yfinance,17.239999771118164,17.674999237060547,17.3700008392334,887700,1096260.0,0.8097531607465382,-0.0017371561001911324,0.025231987918650032,-0.017255921413995567,0.005790409891087856
CON,"CONCENTRA GROUP HOLDINGS PARENT, INC.",DON,WisdomTree U.S. MidCap Dividend Fund,1,True,7/25/2024,2024-07-25,yfinance,46.77609688960171,47.73031934164485,47.142364501953125,172900,210940.0,0.8196643595335167,0.0020647659988223053,0.020399787829566928,-0.01231826746188839,0.009911163917188529
LINE,"LINEAGE, INC.",LIND,Lindblad Expeditions Holdings Inc.  - Common Stock,1,True,7/25/2024,2024-07-25,yfinance,9.739999771118164,10.140000343322754,9.520000457763672,175600,210040.0,0.8360312321462579,-0.0030706944974263485,0.041067821519945404,-0.061143970864592265,-0.025588535136796133
LINE,"LINEAGE, INC.",PINE,"Alpine Income Property Trust, Inc. Common Stock",1,True,7/25/2024,2024-07-25,yfinance,15.504250885237878,15.765963184388323,15.486201286315918,58300,45140.0,1.2915374390784227,0.006444096735154271,0.01688003510054325,-0.017744675336387232,0.005272423726383452
NVA,NOVA MINERALS LTD,JVA,"Coffee Holding Co., Inc. - Common Stock",1,True,7/24/2024,2024-07-24,yfinance,2.619999885559082,2.799999952316284,2.430000066757202,106600,153780.0,0.6931980751723241,-0.060931927820184195,0.06870231855708342,-0.13214281852147952,-0.1290322222286788
NVA,NOVA MINERALS LTD,NCA,Nuveen California Municipal Value Fund,1,True,7/24/2024,2024-07-24,yfinance,8.269380569458008,8.288282443379284,8.269380569458008,67200,50020.0,1.3434626149540183,-0.0045504890989393285,0.002285766601562414,-0.002280553787881009,-0.0045504890989393285
NVA,NOVA MINERALS LTD,NVS,Novartis AG Common Stock,1,True,7/24/2024,2024-07-24,yfinance,104.36719108369584,105.85195385339476,105.36988830566406,2212300,1945080.0,1.1373825241121187,0.005106751848583591,0.014226336402100087,-0.004554148791607197,0.01476321320770812
OS,"ONESTREAM, INC.",OZ,"Belpointe PREP, LLC Class A Units",1,True,7/24/2024,2024-07-24,yfinance,67.0,71.98999786376953,71.0,10000,3940.0,2.5380710659898478,0.00754908257501756,0.07447758005626166,-0.013751880721582413,0.06770126660934697
PGHL,"DIRECTBOOKING TECHNOLOGY CO., LTD.",LGHL,Lion Group Holding Ltd. - American Depositary Share,1,True,7/23/2024,2024-07-23,yfinance,234.0,234.0,224.89999389648438,355,217.6,1.631433823529412,0.01123598172901735,0.0,-0.038888914972288996,-0.028089888381361592
ARDT,"ARDENT HEALTH, INC.",ARCT,Arcturus Therapeutics Holdings Inc. - Common Stock,1,True,7/18/2024,2024-07-18,yfinance,24.3799991607666,25.010000228881836,23.420000076293945,400100,478740.0,0.8357354722814053,0.004118553183406413,0.025840897858973703,-0.06357457569119652,-0.035420122983134024
ICON,ICON ENERGY CORP,UCON,First Trust Smith Unconstrained Bond ETF,1,True,7/12/2024,2024-07-12,yfinance,23.045927293416774,23.045927293416774,22.999370574951172,522100,682140.0,0.765385404755622,0.004056805667305231,0.0,-0.002020171194365506,0.002028439030989496
AZI,AUTOZI INTERNET TECHNOLOGY (GLOBAL) LTD.,AZO,"AutoZone, Inc. Common Stock",1,True,8/28/2024,2024-08-28,yfinance,3190.199951171875,3211.330078125,3196.699951171875,60600,86180.0,0.7031793919702948,0.0026242133536634868,0.0066234490867455335,-0.0045557842380584855,0.0046670500054554415
SPAI,SAFE PRO GROUP INC.,SLAI,SOLAI Limited American Depositary Shares (each representing one hundred (100) Class A Ordinary Shares),1,True,8/28/2024,2024-08-28,yfinance,2.5,2.569999933242798,2.430000066757202,20800,65940.0,0.3154382772217167,0.004016060411629196,0.02799997329711914,-0.05447465763508616,-0.02409636246977518
WOK,WORK MEDICAL TECHNOLOGY GROUP LTD,AOK,iShares Core 30/70 Conservative Allocation ETF,1,True,8/23/2024,2024-08-23,yfinance,36.24373803090151,36.376881592214545,36.35786056518555,34700,64700.0,0.5363214837712519,0.004480687178439666,0.003673560414753999,-0.0005228877846711584,0.007643547520340275
WOK,WORK MEDICAL TECHNOLOGY GROUP LTD,WLK,Westlake Corporation Common Stock,1,True,8/23/2024,2024-08-23,yfinance,142.76629400690027,146.8494942021715,146.42274475097656,475200,308640.0,1.5396578538102643,0.018121600065226236,0.028600589681720634,-0.002906032829826664,0.044197162984431215
YXT,YXT.COM GROUP HOLDING LTD,TXT,Textron Inc. Common Stock,1,True,8/16/2024,2024-08-16,yfinance,87.71963124433042,87.96926025049986,87.80950164794922,683400,765640.0,0.8925865942218275,0.00045565145520495967,0.0028457598672996776,-0.0018160730475135604,0.0014806369906383819
CEP,"CANTOR EQUITY PARTNERS, INC.",FEP,First Trust Europe AlphaDEX Fund,1,True,8/13/2024,2024-08-13,yfinance,34.82094054612926,35.181780340539504,35.16278839111328,17400,13940.0,1.248206599713056,0.0008186534537520202,0.010362723945730921,-0.0005398234325378514,0.010643996897584093
CEP,"CANTOR EQUITY PARTNERS, INC.",CDP,COPT Defense Properties Common Shares of Beneficial Interest,1,True,8/13/2024,2024-08-13,yfinance,27.281219005694144,27.452082881327406,27.42360496520996,447600,656540.0,0.6817558716909861,0.007713883045472929,0.006263058685082943,-0.0010373681385326102,0.01297333674235104
FDSB,"FIFTH DISTRICT BANCORP, INC.",TDSB,ETC Cabana Target Beta ETF,1,True,8/01/2024,2024-08-01,yfinance,21.534378292489674,21.56326939463896,21.5401554107666,10100,7000.0,1.4428571428571428,-0.0009828825177628747,0.0013416269444548568,-0.0010719146271068961,-0.0007148719919896112
BKV,BKV CORP,BIV,Vanguard Intermediate-Term Bond ETF,1,True,9/26/2024,2024-09-26,yfinance,74.2800922732686,74.3180153333101,74.19477081298828,885700,1090280.0,0.8123601276736251,0.0003829772472238679,0.0005105413695770881,-0.0016583397682120237,-0.000766107707386723
BKV,BKV CORP,BLV,Vanguard Long-Term Bond ETF,1,True,9/26/2024,2024-09-26,yfinance,70.64185441361947,70.71707990005447,70.5854263305664,450400,564700.0,0.7975916415795998,0.0020005168126567196,0.0010648854996719761,-0.001861694086833529,0.0012001277394755345
IBG,INNOVATION BEVERAGE GROUP LTD,IHG,Intercontinental Hotels Group American Depositary Shares (Each representing one Ordinary Share),1,True,9/26/2024,2024-09-26,yfinance,109.01772425276225,110.03994347039344,109.75761413574219,217700,179340.0,1.213895394223263,0.010832319312654536,0.009376633245995214,-0.0025656986522099856,0.017692713909725103
IBG,INNOVATION BEVERAGE GROUP LTD,ING,"ING Group, N.V. Common Stock",1,True,9/26/2024,2024-09-26,yfinance,17.52019883808146,17.66256377252095,17.634090423583984,1704600,1750420.0,0.9738234252350865,0.024417152018995195,0.008125760201422538,-0.001612073383212048,0.03107646534858073
GRDN,"GUARDIAN PHARMACY SERVICES, INC.",VRDN,"Viridian Therapeutics, Inc.  - Common Stock",1,True,9/26/2024,2024-09-26,yfinance,21.81999969482422,23.360000610351562,23.059999465942383,1327400,1684480.0,0.7880176671732523,0.019626172139286722,0.07057749482428441,-0.012842514407993619,0.07757008771040885
PC,PREMIUM CATERING (HOLDINGS) LTD,LC,LendingClub Corporation Common Stock,1,True,9/25/2024,2024-09-25,yfinance,10.930000305175781,10.930000305175781,10.579999923706055,1459700,1355080.0,1.0772057738288514,0.0036730909634501044,0.0,-0.0320219919210787,-0.02846652064678558
PC,PREMIUM CATERING (HOLDINGS) LTD,OC,Owens Corning Inc Common Stock New,1,True,9/25/2024,2024-09-25,yfinance,170.6940536248106,170.6940536248106,166.53817749023438,527900,947940.0,0.5568917863999832,0.0008027189974467711,0.0,-0.02434692976306569,-0.02356375450866923
PC,PREMIUM CATERING (HOLDINGS) LTD,PD,"PagerDuty, Inc. Common Stock",1,True,9/25/2024,2024-09-25,yfinance,17.84000015258789,18.239999771118164,17.780000686645508,709200,1115940.0,0.6355180386042261,-0.006128167447138818,0.02242150308907083,-0.025219248368688822,-0.009470755936954426
PC,PREMIUM CATERING (HOLDINGS) LTD,PX,"P10, Inc. Class A Common Stock",1,True,9/25/2024,2024-09-25,yfinance,10.767490655608325,10.777333194472055,10.718279838562012,509400,615660.0,0.8274047363804697,0.003669691581702233,0.0009140977390682003,-0.005479403377853537,-0.0009173944114145911
GLE,GLOBAL ENGINE GROUP HOLDING LTD,BLE,BlackRock Municipal Income Trust II,1,True,9/20/2024,2024-09-20,yfinance,10.479456123993769,10.4887056350708,10.4887056350708,20100,81700.0,0.2460220318237454,-0.0008818543868849297,0.0008826327404390942,0.0,0.0
GLE,GLOBAL ENGINE GROUP HOLDING LTD,GLW,Corning Incorporated Common Stock,1,True,9/20/2024,2024-09-20,yfinance,42.98093357280399,43.42966687913691,43.41015625,10034500,4566820.0,2.19726198974341,-0.008327646841764094,0.010440287565481198,-0.0004492465758765171,0.0015755410823151345
IBO,IMPACT BIOMEDICAL INC.,INO,"Inovio Pharmaceuticals, Inc. - Common Stock",1,True,9/16/2024,2024-09-16,yfinance,6.820000171661377,7.0,6.820000171661377,249300,178600.0,1.3958566629339306,0.0014684624032102835,0.026392936042225118,-0.025714261191231862,0.0014684624032102835
IBO,IMPACT BIOMEDICAL INC.,IBP,"Installed Building Products, Inc. Common Stock",1,True,9/16/2024,2024-09-16,yfinance,220.39054509497439,226.5820049485315,221.98992919921875,247200,242860.0,1.017870377995553,0.006046915885776357,0.028093128273216042,-0.020266727493897203,0.013347843630650245
KAPA,"KAIROS PHARMA, LTD.",KALA,"KALA BIO, Inc. - Common Stock",1,True,9/16/2024,2024-09-16,yfinance,5.929999828338623,6.0920000076293945,5.760000228881836,12900,7960.0,1.620603015075377,0.003384091614701366,0.027318749406466378,-0.054497665517362834,-0.025380646768706057
ZBIO,"ZENAS BIOPHARMA, INC.",XBIO,"Xenetic Biosciences, Inc. - Common Stock",1,True,9/13/2024,2024-09-13,yfinance,3.9649999141693115,4.130000114440918,3.990999937057495,2200,5660.0,0.38869257950530034,0.031209332813049637,0.04161417499202515,-0.03365621635151926,0.03797136732403019
ZBIO,"ZENAS BIOPHARMA, INC.",SBIO,ALPS Medical Breakthroughs ETF,1,True,9/13/2024,2024-09-13,yfinance,35.853428887121005,36.70340347290039,36.70340347290039,11400,3460.0,3.2947976878612715,0.008585942706855112,0.023706926008538805,0.0,0.03249641502385888
MBX,"MBX BIOSCIENCES, INC.",MGX,"Metagenomi, Inc. - Common Stock",1,True,9/13/2024,2024-09-13,yfinance,2.690000057220459,2.9000000953674316,2.700000047683716,115200,107120.0,1.075429424943988,0.0,0.07806692701856775,-0.06896553141608629,0.0037174684946251237
MBX,"MBX BIOSCIENCES, INC.",MBC,"MasterBrand, Inc. Common Stock",1,True,9/13/2024,2024-09-13,yfinance,16.270000457763672,16.610000610351562,16.59000015258789,507600,738160.0,0.6876557927820527,0.02006273682289646,0.02089736588947976,-0.0012041214346017145,0.04012541385429901
TDTH,TRIDENT DIGITAL TECH HOLDINGS LTD,TETH,21Shares Ethereum ETF,1,True,9/10/2024,2024-09-10,yfinance,11.729999542236328,11.930000305175781,11.899999618530273,58000,119300.0,0.4861693210393965,-0.0017021666181848405,0.017050364087339336,-0.0025147263938033715,0.012765924981299867
PLRZ,POLYRIZON LTD.,PLRX,"Pliant Therapeutics, Inc. - Common Stock",1,True,10/29/2024,2024-10-29,yfinance,14.829999923706055,15.1899995803833,14.720000267028809,321600,359520.0,0.8945260347129506,-0.00201882460728801,0.024275094978374163,-0.030941364472548086,-0.009421224285528813
GELS,GELTEQ LTD,GEOS,Geospace Technologies Corporation - Common Stock,1,True,10/29/2024,2024-10-29,yfinance,11.40999984741211,11.550000190734863,11.369999885559082,21100,22840.0,0.9238178633975481,-0.003493446508240121,0.012269968904031777,-0.015584441749202154,-0.006986893016480242
INGM,INGRAM MICRO HOLDING CORP,INGN,"Inogen, Inc - Common Stock",1,True,10/24/2024,2024-10-24,yfinance,9.1899995803833,9.520000457763672,9.260000228881836,99500,113840.0,0.874033731553057,0.0,0.03590869341112715,-0.027310947098726526,0.007617045886264941
SAG,INNEOVA HOLDINGS LTD,SAH,"Sonic Automotive, Inc. Common Stock",1,True,10/23/2024,2024-10-23,yfinance,53.156506162200365,55.04625418367777,54.03319549560547,251900,129560.0,1.9442729237418956,0.005527843330950549,0.03555064389881221,-0.01840377157529984,0.022111618269058556
SAG,INNEOVA HOLDINGS LTD,SSG,ProShares UltraShort Semiconductors,1,True,10/23/2024,2024-10-23,yfinance,102.05146350257964,107.48172772048159,105.98371887207031,10730,6708.0,1.599582587954681,0.02251422950292489,0.05321103717208999,-0.013937335025977772,0.061913831736379
FBLA,"FB BANCORP, INC. /MD/",TBLA,Taboola.com Ltd. - Ordinary Shares,1,True,10/23/2024,2024-10-23,yfinance,3.700000047683716,3.734999895095825,3.6600000858306885,475400,680280.0,0.6988298935732346,-0.0026954151914918884,0.009459418097580857,-0.02008027078223319,-0.013477075957459443
FGL,FOUNDER GROUP LTD,FBL,GraniteShares 2x Long META Daily ETF,1,True,10/23/2024,2024-10-23,yfinance,32.65141677738939,33.18058229703356,30.848337173461914,1276100,432200.0,2.9525682554372974,-0.005966611538836332,0.01620651021828265,-0.07028945733059529,-0.060859216676828386
FGL,FOUNDER GROUP LTD,TGL,Treasure Global Inc. - Common Stock,1,True,10/23/2024,2024-10-23,yfinance,694.0,710.0,677.0,656,192.6,3.406022845275182,-0.03611111111111111,0.023054755043227664,-0.04647887323943662,-0.059722222222222225
ORIS,ORIENTAL RISE HOLDINGS LTD,OTIS,Otis Worldwide Corporation Common Stock ,1,True,10/17/2024,2024-10-17,yfinance,103.3076462495906,104.05136162389763,102.95536041259766,1657100,2300800.0,0.7202277468706537,0.004185296417697174,0.007199035127663428,-0.010533271205633675,0.0007609588155235895
SFHG,SAMFINE CREATION HOLDINGS GROUP LTD,SCHG,Schwab U.S. Large-Cap Growth ETF,1,True,10/15/2024,2024-10-15,yfinance,26.505982395030305,26.525882237129494,26.227392196655273,4615000,3737680.0,1.2347231437683268,-0.00037530623857278626,0.0007507679512727756,-0.01125278465032203,-0.010881826524641876
STFS,STAR FASHION CULTURE HOLDINGS LTD,STRS,Stratus Properties Inc. - Common Stock,1,True,10/11/2024,2024-10-11,yfinance,24.0,24.700000762939453,24.56999969482422,11200,9920.0,1.1290322580645162,-0.0029081718201795746,0.029166698455810547,-0.005263200975697599,0.020772746420412925
UPB,"UPSTREAM BIO, INC.",IPB,"Merrill Lynch & Co., Inc. 6.0518% Index Plus Trust Certificates Series 2003-1",1,True,10/11/2024,2024-10-11,yfinance,24.241907119750977,24.241907119750977,24.241907119750977,300,160.0,1.875,0.003029114953582718,0.0,0.0,0.003029114953582718
SKYQ,SKY QUARRY INC.,SKYW,"SkyWest, Inc. - Common Stock",1,True,10/10/2024,2024-10-10,yfinance,86.23999786376953,88.7300033569336,88.68000030517578,308900,268400.0,1.1508941877794336,-0.012707505778382113,0.02887297721293363,-0.0005635416416774555,0.015226123117205581
SKK,SKK HOLDINGS LTD,SKM,"SK Telecom Co., Ltd. Common Stock",1,True,10/08/2024,2024-10-08,yfinance,21.968465780415066,21.98778765272801,21.80423355102539,278700,177060.0,1.5740426973907151,-0.01813472694870266,0.0008795276149948007,-0.008348002291164811,-0.025474972023862855
FLX,BINGEX LTD,FLD,"Fold Holdings, Inc. - Class A Common Stock",1,True,10/04/2024,2024-10-04,yfinance,10.829999923706055,10.84000015258789,10.84000015258789,10400,7640.0,1.361256544502618,-0.0009225303266668801,0.0009233821747261687,0.0,0.0
FLX,BINGEX LTD,FOX,Fox Corporation - Class B Common Stock,1,True,10/04/2024,2024-10-04,yfinance,38.238276508312154,38.47584069217127,38.14918899536133,428700,693960.0,0.6177589486425731,0.0036371828965435287,0.006212732517049308,-0.008489787121828993,0.001298909608787209
FLX,BINGEX LTD,CLX,Clorox Company (The) Common Stock,1,True,10/04/2024,2024-10-04,yfinance,153.50766022908297,154.9710031123429,154.5310516357422,798300,1033740.0,0.772244471530559,-0.00539139873466922,0.00953270267474705,-0.0028389277204445293,0.0012393706614982722
FLX,BINGEX LTD,DLX,Deluxe Corporation Common Stock,1,True,10/04/2024,2024-10-04,yfinance,17.556316374610255,17.8336684055462,17.81517791748047,196000,199340.0,0.983244707534865,0.01768500400146089,0.01579784876382425,-0.0010368303169739032,0.03269040175521073
FLX,BINGEX LTD,FLS,Flowserve Corporation Common Stock,1,True,10/04/2024,2024-10-04,yfinance,52.00840064010319,52.194879681166626,51.71395492553711,1029700,1467020.0,0.7018990879469946,0.0151341503682987,0.00358555615570388,-0.009214021731006066,0.009386965363437303
FLX,BINGEX LTD,FPX,First Trust US Equity Opportunities ETF,1,True,10/04/2024,2024-10-04,yfinance,109.62425326377958,110.65787506103516,110.65787506103516,7500,11160.0,0.6720430107526881,0.00914913997647046,0.009428769332352581,0.0,0.018664174439250586
FLX,BINGEX LTD,RLX,"RLX Technology Inc. American Depositary Shares, each representing the right to receive one (1) Class A ordinary share",1,True,10/04/2024,2024-10-04,yfinance,1.9292817965471691,1.9392265382983878,1.7502762079238892,23423200,17773720.0,1.3178558005864838,0.026455065621434518,0.005154634107374413,-0.09743592439710358,-0.06878306576287312
CBNA,CHAIN BRIDGE BANCORP INC,CVNA,Carvana Co. Class A Common Stock,1,True,10/04/2024,2024-10-04,yfinance,179.8000030517578,182.83999633789062,180.1699981689453,2272400,2302440.0,0.9869529716300968,0.01788951354748793,0.016907637566934357,-0.014602921802793751,0.019984141709093226
WCT,WELLCHANGE HOLDINGS CO LTD,ACT,"Enact Holdings, Inc. - Common Stock",1,True,10/02/2024,2024-10-02,yfinance,35.086219616675855,35.29043451754004,35.037593841552734,300700,334080.0,0.9000838122605364,-0.006334410419539679,0.005820373442772599,-0.0071645668137534846,-0.0077115254246443625
FVR,"FRONTVIEW REIT, INC.",CVR,Chicago Rivet & Machine Co. Common Stock,1,True,10/02/2024,2024-10-02,yfinance,18.277453475528294,18.277453475528294,17.78346824645996,2700,2300.0,1.173913043478261,0.01425432727941998,0.0,-0.02702702702702705,-0.01315795183624004
FVR,"FRONTVIEW REIT, INC.",VVR,Invesco Senior Income Trust Common Stock (DE),1,True,10/02/2024,2024-10-02,yfinance,3.458714084668522,3.4672539072885904,3.450173854827881,566500,1560600.0,0.36300140971421246,2.2070984483088752e-08,0.0024690744626515737,-0.004926103745908307,-0.0024691701837291475
GRO,BRAZIL POTASH CORP.,GRI,"GRI Bio, Inc. - Common Stock",1,True,11/27/2024,2024-11-27,yfinance,12.17199993133545,13.09000015258789,12.920000076293945,10306,15156.4,0.6799767754875828,-0.023192400361663045,0.07541901301602481,-0.012987018664039994,0.03683489426927549
GRO,BRAZIL POTASH CORP.,BRO,"Brown & Brown, Inc. Common Stock",1,True,11/27/2024,2024-11-27,yfinance,113.0097547815141,113.417126103694,112.47322082519531,777600,1266180.0,0.6141306923186277,0.002821292168167087,0.0036047447670998324,-0.008322422820304091,-0.0019397806826495243
GRO,BRAZIL POTASH CORP.,FRO,Frontline Plc Ordinary Shares,1,True,11/27/2024,2024-11-27,yfinance,15.965987477610891,16.319302609698703,16.023283004760742,5913100,2132780.0,2.7724847382289783,-0.0747095976374828,0.022129237705044245,-0.01813923131507062,-0.07138910139856236
GRO,BRAZIL POTASH CORP.,GDO,Western Asset Global Corporate Opportunity Fund Inc. Common Stock,1,True,11/27/2024,2024-11-27,yfinance,10.059642124396657,10.12066221807745,10.07707691192627,54100,56280.0,0.9612651030561479,0.0026065605403341628,0.006065831460625011,-0.004306566626967286,0.004344220006014708
GRO,BRAZIL POTASH CORP.,GEO,Geo Group Inc (The) REIT,1,True,11/27/2024,2024-11-27,yfinance,28.15999984741211,29.149999618530273,28.690000534057617,2501300,3120400.0,0.8015959492372773,0.011857704800960323,0.03515624206259165,-0.01578041476817862,0.03090192643583156
GRO,BRAZIL POTASH CORP.,GTO,Invesco Total Return Bond ETF,1,True,11/27/2024,2024-11-27,yfinance,44.82304852617917,44.84680106116116,44.76604461669922,105700,182760.0,0.5783541256292405,0.00233702473472723,0.0005299178829417366,-0.001800718056830992,0.0010622982066328251
MSW,MING SHING GROUP HOLDINGS LTD,MSS,Maison Solutions Inc. - Class A Common Stock,1,True,11/22/2024,2024-11-22,yfinance,0.949999988079071,0.9800000190734863,0.9300000071525574,14200,13960.0,1.0171919770773639,-0.03061227592911475,0.031578980390385335,-0.05102041933448131,-0.05102041933448131
MSW,MING SHING GROUP HOLDINGS LTD,MSA,MSA Safety Incorporated Common Stock,1,True,11/22/2024,2024-11-22,yfinance,170.38271664292444,172.90982743787345,172.7321319580078,253200,177240.0,1.4285714285714286,0.0047735073845105724,0.014831966790652499,-0.001027677156924348,0.0186283766632206
DMN,DAMON INC.,DNN,Denison Mines Corp Ordinary Shares (Canada),1,True,11/18/2024,2024-11-18,yfinance,2.180000066757202,2.3299999237060547,2.2699999809265137,34960400,27860380.0,1.2548428987687892,0.04306227573394995,0.0688072717226934,-0.025751049246433545,0.08612443739202005
DMN,DAMON INC.,EMN,Eastman Chemical Company Common Stock,1,True,11/18/2024,2024-11-18,yfinance,97.26812002602183,98.67080099663188,98.5760269165039,1180600,996120.0,1.185198570453359,0.010038331642352684,0.014420767772984556,-0.0009605078622115522,0.023619719801727387
DMN,DAMON INC.,FMN,Federated Hermes Premier Municipal Income Fund,1,True,11/18/2024,2024-11-18,yfinance,10.587117998040782,10.624996737262201,10.568178176879883,26600,34700.0,0.7665706051873199,-0.002676188809548281,0.003577814021571214,-0.005347630854610396,-0.004460350904175808
DMN,DAMON INC.,SMN,ProShares UltraShort Materials,1,True,11/18/2024,2024-11-18,yfinance,13.472078951668017,13.472078951668017,13.434314727783203,500,3120.0,0.16025641025641027,-0.012456571306476587,0.0,-0.0028031474592967874,-0.015224801159564075
ADUR,ADURO CLEAN TECHNOLOGIES INC.,ASUR,Asure Software Inc - Common Stock,1,True,11/07/2024,2024-11-07,yfinance,9.649999618530273,9.65999984741211,9.15999984741211,94300,215600.0,0.43738404452690166,0.0,0.001036293189342012,-0.051759835186120505,-0.05077718036146334
PHH,"PARK HA BIOLOGICAL TECHNOLOGY CO., LTD.",PBH,Prestige Consumer Healthcare Inc. Common Stock,1,True,12/27/2024,2024-12-27,yfinance,78.63999938964844,79.70999908447266,78.44999694824219,179300,230700.0,0.777199826614651,-0.007446723997059174,0.013606303447721863,-0.01580732844941049,-0.009844836244389053
HIT,"HEALTH IN TECH, INC.",HUT,Hut 8 Corp. - Common Stock,1,True,12/23/2024,2024-12-23,yfinance,23.790000915527344,23.809999465942383,21.649999618530273,5707600,8862000.0,0.6440532611148725,0.0046452959853855854,0.0008406284003959973,-0.09071818126253024,-0.08572637924340765
HIT,"HEALTH IN TECH, INC.",BIT,BlackRock Multi-Sector Income Trust Common Shares of Beneficial Interest,1,True,12/23/2024,2024-12-23,yfinance,12.950458199600696,12.959470555004458,12.914409637451172,160400,180200.0,0.8901220865704772,0.0034916231550239938,0.0006959101573749455,-0.00347706469658865,0.0006983296988166822
HIT,"HEALTH IN TECH, INC.",HIG,"The Hartford Insurance Group, Inc. Common Stock",1,True,12/23/2024,2024-12-23,yfinance,107.0227976044817,108.07502914770815,107.89801788330078,1095600,2580080.0,0.4246379957210629,-0.005846405737342881,0.009831844866503391,-0.001637855347375799,0.0022836694002474523
TDACU,TRANSLATIONAL DEVELOPMENT ACQUISITION CORP.,RDACU,Rising Dragon Acquisition Corp. - Unit,1,True,12/23/2024,2024-12-23,yfinance,10.130000114440918,10.130000114440918,10.130000114440918,0,10360.0,0.0,0.0,0.0,0.0,0.0
LSE,"LEISHEN ENERGY HOLDING CO., LTD.",LEE,"Lee Enterprises, Incorporated - Common Stock",1,True,12/19/2024,2024-12-19,yfinance,14.859999656677246,15.989999771118164,14.989999771118164,35400,46940.0,0.7541542394546229,-0.008010673513089275,0.07604307809880465,-0.06253908782451915,0.0006675720418842568
YSXT,"YSX TECH CO., LTD",YEXT,"Yext, Inc. Common Stock",1,True,12/18/2024,2024-12-18,yfinance,6.489999771118164,6.590000152587891,6.429999828338623,1377200,1663420.0,0.8279328131199577,0.0,0.015408379814549279,-0.024279259566699025,-0.009244983805169473
NTCL,NETCLASS TECHNOLOGY INC,BTCL,T-Rex 2X Long Bitcoin Daily Target ETF,1,True,12/13/2024,2024-12-13,yfinance,56.64571025496525,58.389382406114336,58.0406494140625,100400,142440.0,0.7048581859028363,0.008558466082632629,0.030782068815109326,-0.0059725411998075555,0.03339490457453765
AVR,ANTERIS TECHNOLOGIES GLOBAL CORP.,AVT,"Avnet, Inc. - Common Stock",1,True,12/13/2024,2024-12-13,yfinance,52.88416606980034,53.1177378141034,52.708988189697266,962200,607620.0,1.583555511668477,-0.0009193678101349893,0.004416666871418154,-0.007695162505538897,-0.004228805023686901
AVR,ANTERIS TECHNOLOGIES GLOBAL CORP.,ABR,Arbor Realty Trust Common Stock,1,True,12/13/2024,2024-12-13,yfinance,12.6036849580083,12.78057861328125,12.78057861328125,1700200,1649860.0,1.0305116797788902,-0.0014015250683623256,0.014035074334395612,0.0,0.0126138787575173
AVR,ANTERIS TECHNOLOGIES GLOBAL CORP.,ACR,ACRES Commercial Realty Corp. Common Stock,1,True,12/13/2024,2024-12-13,yfinance,17.1299991607666,17.530000686645508,17.1299991607666,15700,11900.0,1.319327731092437,-0.0005834439462043094,0.023350936688604332,-0.022818112390812998,-0.0005834439462043094
AVR,ANTERIS TECHNOLOGIES GLOBAL CORP.,AVD,American Vanguard Corporation Common Stock ($0.10 Par Value),1,True,12/13/2024,2024-12-13,yfinance,5.199999809265137,5.28000020980835,5.260000228881836,211100,223680.0,0.9437589413447782,-0.013282765069207891,0.0153846929764635,-0.003787875024959444,-0.0018974861633528294
INR,"INFINITY NATURAL RESOURCES, INC.",IJR,iShares Core S&P Small-Cap ETF,1,True,1/31/2025,2025-01-31,yfinance,117.818543569181,118.31105482646707,116.66606903076172,3536900,3795980.0,0.9317488500993156,0.0014234149194243709,0.004180252465919122,-0.01390390608990967,-0.008372284067415086
MTSR,"METSERA, INC.",MTDR,Matador Resources Company Common Stock,1,True,1/31/2025,2025-01-31,yfinance,57.79028061687433,57.79028061687433,56.314453125,901500,970460.0,0.9289409146178101,-0.00033598528870045174,0.0,-0.02553764190311608,-0.025865046919828986
CSAI,"CLOUDASTRUCTURE, INC.",CXAI,CXApp Inc. - Class A Common Stock,1,True,1/30/2025,2025-01-30,yfinance,1.5199999809265137,1.600000023841858,1.5299999713897705,874600,1069880.0,0.8174748569933077,-0.00653594160147165,0.052631607841587165,-0.04375003213062834,0.0
SFD,SMITHFIELD FOODS INC,SCD,LMP Capital and Income Fund Inc. Common Stock,1,True,1/28/2025,2025-01-28,yfinance,16.045724310568588,16.128387029120066,15.953878402709961,40900,27860.0,1.4680545585068199,-0.0022839967248682452,0.0051516975458086745,-0.010819967681518758,-0.007994934438382896
SFD,SMITHFIELD FOODS INC,SDD,ProShares UltraShort SmallCap600,1,True,1/28/2025,2025-01-28,yfinance,13.757981516506154,13.815345764160156,13.815345764160156,200,980.0,0.20408163265306123,-0.0069012831993550796,0.004169524983383581,0.0,-0.002760533288688615
VG,"VENTURE GLOBAL, INC.",CG,The Carlyle Group Inc. - Common Stock,1,True,1/24/2025,2025-01-24,yfinance,55.31289192602834,55.74144618019988,55.35185241699219,1172400,2178160.0,0.5382524699746575,-0.002984612343637369,0.007747818623272423,-0.006989301317160322,-0.0022823491343018725
VG,"VENTURE GLOBAL, INC.",BG,Bunge Limited Common Shares,1,True,1/24/2025,2025-01-24,yfinance,76.17724408370282,76.21589400312492,74.58297729492188,1237800,1412580.0,0.876268954678673,0.0021609315002523934,0.0005073683077800856,-0.021424884265427498,-0.01881267957379847
VG,"VENTURE GLOBAL, INC.",FG,"F&G Annuities & Life, Inc. Common Stock",1,True,1/24/2025,2025-01-24,yfinance,41.89243666067426,42.22375636992754,41.90217971801758,38100,68560.0,0.5557176196032673,-0.005091305902357171,0.007908819244317345,-0.007616012395784776,-0.004859916820445352
VG,"VENTURE GLOBAL, INC.",VB,Vanguard Small-Cap ETF,1,True,1/24/2025,2025-01-24,yfinance,248.90528336584774,249.53636141540517,248.2939453125,467200,736400.0,0.6344378055404671,0.0011103761238807515,0.0025354144396760553,-0.004978898048597044,-0.0013484582578154975
VG,"VENTURE GLOBAL, INC.",VT,Vanguard Total World Stock Index ETF,1,True,1/24/2025,2025-01-24,yfinance,119.74404291627744,119.98921909238865,119.54790496826172,1365700,2242360.0,0.609045826718279,0.0017229402425359248,0.00204750207308966,-0.0036779481312161242,8.214144207439117e-05
VG,"VENTURE GLOBAL, INC.",VV,Vanguard Large-Cap ETF,1,True,1/24/2025,2025-01-24,yfinance,277.93666484723684,278.28254204146754,277.04718017578125,151300,224400.0,0.6742424242424242,-0.00017766581792180806,0.0012444460842213848,-0.004439235952869089,-0.003377411489917661
DXST,DECENT HOLDING INC.,RXST,"RxSight, Inc. - Common Stock",1,True,1/22/2025,2025-01-22,yfinance,30.670000076293945,32.36000061035156,31.90999984741211,606900,658640.0,0.9214441880238067,-0.009686769251272957,0.05510272350354135,-0.013906080174655604,0.030351971420686536
DGNX,DIGINEX LTD,CGNX,Cognex Corporation - Common Stock,1,True,1/22/2025,2025-01-22,yfinance,40.79317750379129,40.83282192685909,40.0201301574707,1341000,1263020.0,1.0617409067156498,0.00341302949006605,0.000971839545083588,-0.01990290484561913,-0.015602056540893562
DGNX,DIGINEX LTD,FGNX,FG Nexus Inc. - Common Stock,1,True,1/22/2025,2025-01-22,yfinance,21.799999237060547,22.989999771118164,21.68000030517578,59700,70580.0,0.8458486823462738,-0.011337868873020747,0.05458718237175836,-0.056981273553038767,-0.016779997491468832
DGNX,DIGINEX LTD,RGNX,REGENXBIO Inc. - Common Stock,1,True,1/22/2025,2025-01-22,yfinance,7.53000020980835,7.860000133514404,7.849999904632568,1025500,1620120.0,0.6329778041132755,-0.005284010692994293,0.043824689842133974,-0.0012722937292578116,0.03698807485096005
PCLA,PICOCELA INC.,PVLA,"Palvella Therapeutics, Inc. - Common Stock",1,True,1/16/2025,2025-01-16,yfinance,13.357999801635742,13.625,13.220000267028809,32200,28140.0,1.144278606965174,0.004360872937526948,0.019988037305672255,-0.02972475104375717,-0.006015031771336723
UFG,UNI-FUELS HOLDINGS LTD,URG,Ur Energy Inc Common Shares (Canada),1,True,1/14/2025,2025-01-14,yfinance,1.1299999952316284,1.149999976158142,1.1100000143051147,4067100,2670020.0,1.5232470168762782,0.0,0.017699098239742965,-0.034782576245485725,-0.017699098239742965
UFG,UNI-FUELS HOLDINGS LTD,UTG,Reaves Utility Income Fund Common Shares of Beneficial Interest,1,True,1/14/2025,2025-01-14,yfinance,30.088171590184565,30.267098386610513,30.238847732543945,248600,312600.0,0.7952655150351887,0.007250946515749855,0.005946748737777004,-0.0009333783405899708,0.012295077780221167
MASK,3 E NETWORK TECHNOLOGY GROUP LTD,MASI,Masimo Corporation - Common Stock,1,True,1/08/2025,2025-01-08,yfinance,165.69000244140625,169.66000366210938,168.8000030517578,634300,420120.0,1.5098067218889841,0.0008456622595450383,0.023960415005166383,-0.005068964940401146,0.019631530897549515
ZYBT,ZHENGYE BIOTECHNOLOGY HOLDING LTD,SYBT,"Stock Yards Bancorp, Inc. - Common Stock",1,True,1/07/2025,2025-01-07,yfinance,69.12971394222086,69.65051941197503,68.54012298583984,120500,97160.0,1.2402223137093453,0.002136763293732072,0.007533742584114534,-0.01594239979126805,-0.0064102237976475535
STAK,STAK INC.,STAI,ScanTech AI Systems Inc. - Common stock,1,True,2/26/2025,2025-02-26,yfinance,48.599998474121094,54.959999084472656,50.20000076293945,142025,1004050.0,0.14145211891838055,-0.0544747659267688,0.13086421419824087,-0.08660841340657885,-0.023346317652058357
BMGL,BASEL MEDICAL GROUP LTD,BMBL,Bumble Inc. - common stock,1,True,2/25/2025,2025-02-25,yfinance,5.480000019073486,5.539999961853027,5.480000019073486,3133700,10169460.0,0.3081481219258446,-0.009041625467966503,0.010948894629691135,-0.010830314655719266,-0.009041625467966503
NPB,NORTHPOINTE BANCSHARES INC,MPB,Mid Penn Bancorp - Common Stock,1,True,2/14/2025,2025-02-14,yfinance,29.123611609463516,29.21165761041944,28.93773651123047,47900,44140.0,1.0851835070231084,0.00983723421797217,0.0030231827747391636,-0.009377115904962102,0.0033921683509125443
XHLD,"TEN HOLDINGS, INC.",SHLD,Global X Defense Tech ETF,1,True,2/13/2025,2025-02-13,yfinance,41.14884862543829,41.14884862543829,40.75961685180664,268400,324040.0,0.8282928033576101,0.011282794530286924,0.0,-0.0094591170016608,0.001716952255058442
XHLD,"TEN HOLDINGS, INC.",XYLD,Global X S&P 500 Covered Call ETF,1,True,2/13/2025,2025-02-13,yfinance,38.663335306536105,38.74484634399414,38.74484634399414,679200,462100.0,1.4698117290629733,0.00023441960707344276,0.0021082257082010226,0.0,0.0023431395247166037
AGH,AUREUS GREENWAY HOLDINGS INC,AHH,"Armada Hoffler Properties, Inc. Common Stock",1,True,2/12/2025,2025-02-12,yfinance,8.965060267442494,9.059429682878635,9.049992561340332,394100,494660.0,0.796708850523592,-0.015544069799960689,0.010526355944181755,-0.0010416904671315325,-0.0062176293858493955
SION,"SIONNA THERAPEUTICS, INC.",ZION,Zions Bancorporation N.A. - Common Stock,1,True,2/07/2025,2025-02-07,yfinance,56.38870441287654,56.39837329273047,55.37329864501953,907300,1066100.0,0.8510458681174374,0.0006865457537157979,0.00017146838102771256,-0.01817560663302084,-0.01733307184443568
TTAM,TITAN AMERICA SA,TTAN,"ServiceTitan, Inc. - Class A Common Stock",1,True,2/07/2025,2025-02-07,yfinance,104.9800033569336,106.98999786376953,104.33000183105469,222600,185460.0,1.200258815917179,0.003345179324318402,0.01914645115795935,-0.024862100063800536,-0.002867202812179002
PLUT,PLUTUS FINANCIAL GROUP LTD,PLUG,"Plug Power, Inc. - Common Stock",1,True,2/05/2025,2025-02-05,yfinance,1.9700000286102295,2.0,1.850000023841858,52568100,64727900.0,0.8121397419041866,0.010256400224333537,0.015228411651818353,-0.07499998807907104,-0.05128206225463519
PLUT,PLUTUS FINANCIAL GROUP LTD,PLUR,Pluri Inc. - Common Stock,1,True,2/05/2025,2025-02-05,yfinance,4.46999979019165,4.489999771118164,4.400000095367432,3800,11160.0,0.34050179211469533,0.039534788817703385,0.004474268873658309,-0.0200444722357568,0.023255790743460066
CJMB,CALLAN JMB INC.,CMMB,Chemomab Therapeutics Ltd.  - American Depositary Shares,1,True,2/05/2025,2025-02-05,yfinance,8.279999732971191,8.760000228881836,8.319999694824219,54325,22330.0,2.4328257948947605,0.0,0.05797107625490241,-0.050228370155394476,0.004830913423070096
NMAX,NEWSMAX INC.,BMAX,REX Bitcoin Corporate Treasury Convertible Bond ETF,1,True,3/31/2025,2025-03-31,yfinance,25.239999771118164,25.780000686645508,25.309999465942383,19000,40340.0,0.4709965294992563,-0.021515809402374696,0.021394648194302302,-0.018231233831835926,-0.01880211703497092
NMAX,NEWSMAX INC.,MMAX,iShares Large Cap Max Buffer Mar ETF,1,True,3/31/2025,2025-04-01,yfinance,24.78606843010719,24.904757539296977,24.825632095336914,446500,0.0,1.0,0.0,0.004788541172815379,-0.003177121633696355,0.0015962057613650258
NCT,INTERCONT (CAYMAN) LTD,NXT,Nextpower Inc. - Class A Common Stock,1,True,3/28/2025,2025-03-28,yfinance,42.6150016784668,43.2400016784668,43.150001525878906,1407300,1829900.0,0.7690584184928139,-0.003157855474460892,0.01466619677069754,-0.002081409553522521,0.00935676083927266
NCT,INTERCONT (CAYMAN) LTD,NVT,nVent Electric plc Ordinary Shares ,1,True,3/28/2025,2025-03-28,yfinance,53.794327659000224,54.01251741151839,52.47525405883789,2427600,2367200.0,1.025515376816492,-0.006411448389781228,0.004055999247750782,-0.028461242436973875,-0.0307749172700042
WFF,WF HOLDING LTD,WFC,Wells Fargo & Company Common Stock,1,True,3/27/2025,2025-03-27,yfinance,72.3608090616604,72.3608090616604,71.09201049804688,10457600,15214300.0,0.6873533452081265,0.0013611203078547937,0.0,-0.01753433357181448,-0.016197079601468982
WFF,WF HOLDING LTD,WFG,West Fraser Timber Co. Ltd Common stock,1,True,3/27/2025,2025-03-27,yfinance,76.04889750143955,77.38309268373946,76.76577758789062,282600,171680.0,1.6460857409133272,-0.00598648060581645,0.017543912221405347,-0.007977389820432371,0.0033836552032312207
EPSM,EPSIUM ENTERPRISE LTD,EPAM,"EPAM Systems, Inc. Common Stock",1,True,3/26/2025,2025-03-26,yfinance,179.33999633789062,179.77000427246094,176.9199981689453,391100,940700.0,0.4157542255766982,0.001955365294069055,0.0023977246757613613,-0.0158536242742484,-0.011564932458185812
EPSM,EPSIUM ENTERPRISE LTD,SPSM,State Street SPDR Portfolio S&P 600 Small Cap ETF,1,True,3/26/2025,2025-03-26,yfinance,41.40661995755917,41.59411659850234,41.130313873291016,1509300,1530120.0,0.9863932240608579,0.0011930921166517984,0.004528180303906625,-0.011150680989051783,-0.005487862357841057
RCT,REDCLOUD HOLDINGS PLC,RXT,"Rackspace Technology, Inc. - Common Stock",1,True,3/21/2025,2025-03-21,yfinance,1.8200000524520874,1.8899999856948853,1.8700000047683716,715300,1642880.0,0.43539394234515,-0.026737942346945313,0.03846150067330322,-0.010582000570312384,0.0
RCT,REDCLOUD HOLDINGS PLC,FCT,First Trust Senior Floating Rate Income Fund II Common Shares of Beneficial Interest,1,True,3/21/2025,2025-03-21,yfinance,9.343276590182422,9.379916856278319,9.324956893920898,83300,83840.0,0.9935591603053435,-1.4352895924366435e-07,0.003921564960882975,-0.005859322976901861,-0.001960878979236485
RCT,REDCLOUD HOLDINGS PLC,RVT,"Royce Small-Cap Trust, Inc. Common Stock",1,True,3/21/2025,2025-03-21,yfinance,13.507604771022198,13.572904572370632,13.51693344116211,188500,290500.0,0.648881239242685,-0.006177038581319217,0.004834299082285975,-0.004123740125784059,-0.005490681026319231
SAGT,SAGTEC GLOBAL LTD,SAFT,"Safety Insurance Group, Inc. - Common Stock",1,True,3/07/2025,2025-03-07,yfinance,73.48891007768142,74.34769529262496,73.66259002685547,62500,63580.0,0.9830135262661214,0.004616821995272843,0.011685915793767512,-0.009214882358800618,0.006991082253032727
TBH,"BRAG HOUSE HOLDINGS, INC.",TBN,Tamboran Resources Corporation Common stock,1,True,3/06/2025,2025-03-06,yfinance,23.299999237060547,23.67300033569336,23.100000381469727,19700,21900.0,0.8995433789954338,0.003445302587069605,0.016008631366799527,-0.02420478799046366,-0.00516791280935787
PN,SKYCORP SOLAR GROUP LTD,ON,ON Semiconductor Corporation - Common Stock,1,True,3/04/2025,2025-03-04,yfinance,45.09000015258789,45.7400016784668,44.4900016784668,10433100,11239860.0,0.9282233052724856,0.004008022840956513,0.014415647009963475,-0.027328376784657344,-0.009351996668276864
PN,SKYCORP SOLAR GROUP LTD,PB,"Prosperity Bancshares, Inc. Common Stock",1,True,3/04/2025,2025-03-04,yfinance,72.93604355813152,72.93604355813152,71.27291107177734,876200,540520.0,1.6210315992007696,-0.009585279957343842,0.0,-0.02280261452663828,-0.032169325039984896
PN,SKYCORP SOLAR GROUP LTD,PH,Parker-Hannifin Corporation Common Stock,1,True,3/04/2025,2025-03-04,yfinance,641.3430976770854,645.6910566715262,620.3280029296875,2175000,823180.0,2.642192473092155,-0.00690162905214376,0.00677945862392357,-0.039280478612454005,-0.03944280152994247
PN,SKYCORP SOLAR GROUP LTD,PM,Philip Morris International Inc Common Stock,1,True,3/04/2025,2025-03-04,yfinance,153.07182246292072,154.0666722517396,148.6964111328125,6242900,7480040.0,0.8346078363217309,-0.0019522816832970502,0.006499235279307237,-0.03485673468790362,-0.030480519110988008
DAAQU,DIGITAL ASSET ACQUISITION CORP.,RAAQU,Real Asset Acquisition Corp. - Unit,1,True,4/29/2025,2025-04-30,yfinance,10.079999923706055,10.119999885559082,10.109999656677246,865800,0.0,1.0,0.0,0.003968250213867144,-0.0009881649204468812,0.002976164007763363
RAAQU,REAL ASSET ACQUISITION CORP.,DAAQU,Digital Asset Acquisition Corp. - Units,1,True,4/29/2025,2025-04-30,yfinance,10.180000305175781,10.354000091552734,10.234999656677246,796700,0.0,1.0,0.0,0.01709231642051003,-0.011493184645862064,0.005402686626001545
PFAI,PINNACLE FOOD GROUP LTD,LFAI,LifeX 2050 Longevity Income ETF,1,True,4/22/2025,2025-04-22,yfinance,148.31991577148438,148.31991577148438,148.31991577148438,0,0.0,1.0,0.0022655465553731873,0.0,0.0,0.0022655465553731873
PFAI,PINNACLE FOOD GROUP LTD,PFSI,"PennyMac Financial Services, Inc. Common Stock",1,True,4/22/2025,2025-04-22,yfinance,95.26536295990607,96.84221397906957,95.60255432128906,646000,394520.0,1.6374328297678191,0.019528781179224703,0.01655219662394129,-0.012800819052406563,0.023137399117726117
TMDE,TMD ENERGY LTD,FMDE,Fidelity Enhanced Mid Cap ETF,1,True,4/21/2025,2025-04-21,yfinance,29.251517081271267,29.349582491287354,28.835477828979492,461100,312520.0,1.4754255727633432,-0.011051586276386496,0.003352489709973874,-0.017516592014911198,-0.025117227981655194
EDHL,EVERBRIGHT DIGITAL HOLDING LTD.,EDBL,Edible Garden AG Incorporated - Common Stock,1,True,4/17/2025,2025-04-17,yfinance,1.8600000143051147,1.9270000457763672,1.899999976158142,26500,94500.0,0.2804232804232804,0.0,0.03602152201933357,-0.014011452504842606,0.021505355669564928
EDHL,EVERBRIGHT DIGITAL HOLDING LTD.,RDHL,Redhill Biopharma Ltd. - American Depositary Shares,1,True,4/17/2025,2025-04-17,yfinance,1.9299999475479126,2.490000009536743,2.259999990463257,1321900,1302980.0,1.0145205605611751,-0.06763284551201197,0.2901554804187001,-0.09236948521790453,0.09178747021639308
CHA,CHAGEE HOLDINGS LTD.,CNA,CNA Financial Corporation Common Stock,1,True,4/17/2025,2025-04-17,yfinance,46.62372918371528,46.8859881050122,46.55573654174805,218500,355280.0,0.6150078811078586,0.005446138142300407,0.005625009536743099,-0.007043715545132156,0.003979868916630635
ATHR,"AETHER HOLDINGS, INC.",ATYR,"aTyr Pharma, Inc. - Common Stock",1,True,4/10/2025,2025-04-10,yfinance,2.819999933242798,2.880000114440918,2.740000009536743,1279100,1783620.0,0.7171370583420236,-0.017421586867605077,0.021276660503010796,-0.04861114560453843,-0.0452961258557732
MB,MASTERBEEF GROUP,NB,NioCorp Developments Ltd. - Common Stock,1,True,4/10/2025,2025-04-10,yfinance,1.9900000095367432,2.200000047683716,2.049999952316284,550100,362760.0,1.5164295953247326,0.0,0.10552765685456407,-0.06818186005284872,0.030150724870352412
MB,MASTERBEEF GROUP,KB,KB Financial Group Inc,1,True,4/10/2025,2025-04-10,yfinance,50.57133711460939,50.630264220120964,50.03114700317383,209500,247700.0,0.8457811869196609,-0.0032907489994043605,0.0011652273575054118,-0.011833183693105051,-0.01393734274373565
MB,MASTERBEEF GROUP,MG,Mistras Group Inc Common Stock,1,True,4/10/2025,2025-04-10,yfinance,9.220000267028809,9.4399995803833,9.199999809265137,177200,227100.0,0.7802730074856892,-0.0325288011152686,0.023861096202049036,-0.025423705697709274,-0.03462748509471047
TOPW,ASIASTRATEGY,TOPS,"TOP Ships, Inc. Common Stock",1,True,4/02/2025,2025-04-02,yfinance,6.5,6.550000190734863,6.460000038146973,11400,8620.0,1.322505800464037,0.0,0.0076923370361328125,-0.01374048091100792,-0.0061538402850811295
SMA,"SMARTSTOP SELF STORAGE REIT, INC.",DMA,Destra Multi-Alternative Fund Common Stock,1,True,4/02/2025,2025-04-02,yfinance,8.020056485683712,8.11553371715976,8.010509490966797,10600,9460.0,1.120507399577167,-0.0023754508890469032,0.011904807858458426,-0.012941136079676,-0.003563013135875064
SMA,"SMARTSTOP SELF STORAGE REIT, INC.",EMA,Emera Incorporated Common Shares,1,True,4/02/2025,2025-04-02,yfinance,41.820367059821216,41.820367059821216,41.439205169677734,123500,70580.0,1.7497874752054405,0.006823641860160613,0.0,-0.009114264578267686,-0.002352815195407919
SMA,"SMARTSTOP SELF STORAGE REIT, INC.",SNA,Snap-On Incorporated Common Stock,1,True,4/02/2025,2025-04-02,yfinance,329.33703971570446,336.45947139837125,335.25445556640625,302400,320060.0,0.9448228457164282,-0.010071347241542078,0.021626573460474183,-0.003581459089134243,0.007715353901923119
WTF,WATON FINANCIAL LTD,WFF,WF Holding Limited - Ordinary Shares,1,True,4/01/2025,2025-04-01,yfinance,4.0,4.085999965667725,3.4649999141693115,468700,1252666.6666666667,0.37416178818520485,0.0,0.021499991416931152,-0.1519823927352703,-0.13375002145767212
WXM,WF INTERNATIONAL LTD.,WSM,"Williams-Sonoma, Inc. Common Stock (DE)",1,True,4/01/2025,2025-04-01,yfinance,155.60700166114665,158.77800935626223,156.9405975341797,1604700,1774200.0,0.9044639837673317,-0.0036685915986846515,0.020378309852797212,-0.01157220593413414,0.004870249457520509
FTRK,FAST TRACK GROUP,FTEK,"Fuel Tech, Inc. - Common Stock",1,True,5/23/2025,2025-05-23,yfinance,1.6399999856948853,1.7799999713897705,1.600000023841858,375700,1307340.0,0.287377422858629,-0.023809501846360367,0.08536584568052041,-0.10112356766352869,-0.047619003692720735
HNGE,"HINGE HEALTH, INC.",BNGE,First Trust S-Network Streaming and Gaming ETF,1,True,5/22/2025,2025-05-22,yfinance,31.738744828996442,31.840808868408203,31.840808868408203,1000,320.0,3.125,-0.002988292299378203,0.003215755379164077,0.0,0.00021785346274963424
ARAI,ARRIVE AI INC.,ATAI,Atai Beckley N.V - Common Shares,1,True,5/15/2025,2025-05-15,yfinance,1.4299999475479126,1.6299999952316284,1.6299999952316284,2452200,1195860.0,2.0505744819627716,0.0,0.13986017833543646,0.0,0.13986017833543646
APUS,"APIMEDS PHARMACEUTICALS US, INC.",SPUS,SP Funds S&P 500 Sharia Industry Exclusions ETF,1,True,5/09/2025,2025-05-09,yfinance,39.51037561682501,39.59999103534745,39.36101531982422,142700,280980.0,0.5078653284931312,0.0053205936619614815,0.002268148989307006,-0.00603474165713621,0.0015201999652126378
AII,"AMERICAN INTEGRITY INSURANCE GROUP, INC.",SII,Sprott Inc. Common Shares,1,True,5/08/2025,2025-05-08,yfinance,53.523524729902284,54.08054094270905,53.55336380004883,194700,181100.0,1.075096631695196,-0.00185489330750711,0.010406941912320914,-0.009748000546420083,-0.0012984329098534569
AHL,ASPEN INSURANCE HOLDINGS LTD,ANL,Adlai Nortye Ltd. - American Depositary Shares,1,True,5/08/2025,2025-05-08,yfinance,1.75,1.8650000095367432,1.840000033378601,7300,7280.0,1.0027472527472527,-0.06865351359081102,0.06571429116385323,-0.013404812884881412,-0.020755676525742547
AHL,ASPEN INSURANCE HOLDINGS LTD,AGL,"agilon health, inc. Common Stock",1,True,5/08/2025,2025-05-08,yfinance,3.359999895095825,3.4000000953674316,3.2200000286102295,5598200,5784600.0,0.9677765100439097,-0.008849619138639415,0.011904821881092846,-0.05294119462009894,-0.05014751357913327
CEPT,"CANTOR EQUITY PARTNERS II, INC.",CRPT,First Trust SkyBridge Crypto Industry and Digital Economy ETF,1,True,5/02/2025,2025-05-02,yfinance,15.728075188077439,16.383825489672326,16.17517852783203,63400,40320.0,1.5724206349206349,0.016698829403600374,0.04169297855925652,-0.012734935560185054,0.04560061406034705
SDM,SMART DIGITAL GROUP LTD,SFM,"Sprouts Farmers Market, Inc. - Common Stock",1,True,5/02/2025,2025-05-02,yfinance,173.0,178.16000366210938,173.92999267578125,2009400,2176240.0,0.9233356615079219,0.007806106893299591,0.029826610763638007,-0.023742764365623736,0.01322375023444632
SDM,SMART DIGITAL GROUP LTD,SSM,Sono Group N.V. - Ordinary Shares,1,True,5/02/2025,2025-05-02,yfinance,8.0,10.0,9.0,3100,3820.0,0.8115183246073299,-0.1111111111111111,0.25,-0.1,0.0
SDM,SMART DIGITAL GROUP LTD,ADM,Archer-Daniels-Midland Company Common Stock,1,True,5/02/2025,2025-05-02,yfinance,46.81150219137586,46.8601657681158,46.568199157714844,2691000,2574760.0,1.0451459553511784,0.010928890069542334,0.001039564518587612,-0.006230592777791933,0.0056745817424150805
SDM,SMART DIGITAL GROUP LTD,DDM,ProShares Ultra Dow30,1,True,5/02/2025,2025-05-02,yfinance,42.80924152232706,43.25574033195774,43.07714080810547,341000,415520.0,0.8206584520600693,0.019855852971328886,0.010429963104994631,-0.004128920750902492,0.02623808832267116
SDM,SMART DIGITAL GROUP LTD,SCM,Stellus Capital Investment Corporation Common Stock,1,True,5/02/2025,2025-05-02,yfinance,11.910014115730899,12.217549626814629,12.105718612670898,156600,148940.0,1.0514301060829865,0.0070922303574851705,0.0258215908138625,-0.009153309588224435,0.023640697588432565
SDM,SMART DIGITAL GROUP LTD,SEM,Select Medical Holdings Corporation Common Stock,1,True,5/02/2025,2025-05-02,yfinance,16.260134196908407,16.46720783886677,14.061220169067383,4344700,1333240.0,3.25875311271789,-0.09594293461835932,0.012735051227174669,-0.1461078097357008,-0.21820168961771558
JCAP,"JEFFERSON CAPITAL, INC. / DE",ICAP,Infrastructure Capital Equity Income ETF,1,True,6/26/2025,2025-06-26,yfinance,24.929708781120187,25.0062095415287,24.984216690063477,7000,5420.0,1.2915129151291513,0.008861938049953362,0.0030686584059277044,-0.0008794956080288879,0.011067778284125026
FMFC,KANDAL M VENTURE LTD,TMFC,Motley Fool 100 Index ETF ETF,1,True,6/25/2025,2025-06-25,yfinance,63.23730521965017,63.33715732523457,63.16740417480469,104300,112200.0,0.9295900178253119,0.0038041298905542886,0.0015790063355415717,-0.0026801510771663766,0.002694548176788374
EGG,ENIGMATIG LTD,EFG,iShares MSCI EAFE Growth ETF,1,True,6/18/2025,2025-06-18,yfinance,106.96695779202875,107.4886506052258,106.75040435791016,848000,637580.0,1.3300291728096867,0.00341639818717057,0.004877139856696251,-0.006868132060072137,0.0013849926824836285
EGG,ENIGMATIG LTD,EGY,"VAALCO Energy, Inc.  Common Stock",1,True,6/18/2025,2025-06-18,yfinance,3.806914446962669,3.898705327289243,3.7875900268554688,1081300,1019040.0,1.061096718480138,-0.002531597087402914,0.02411162152588138,-0.028500563932343216,-0.007594883570481091
EGG,ENIGMATIG LTD,ETG,Eaton Vance Tax-Advantaged Global Dividend Income Fund Common Shares of Beneficial Interest,1,True,6/18/2025,2025-06-18,yfinance,19.38577361984385,19.51115343345392,19.433996200561523,74400,109600.0,0.6788321167883211,-0.0019861164350498243,0.00646761981589056,-0.003954519303820472,0.0004964672369428183
EGG,ENIGMATIG LTD,EVG,Eaton Vance Short Diversified Income Fund Eaton Vance Short Duration Diversified Income Fund Common Shares of Beneficial Interest,1,True,6/18/2025,2025-06-18,yfinance,10.423266168726865,10.461692918448007,10.394445419311523,13900,38180.0,0.3640649554740702,-0.0018398853982155093,0.0036866322992339974,-0.006427974866085009,-0.004599838187835265
CAI,"CARIS LIFE SCIENCES, INC.",CWI,SPDR MSCI ACWI ex-US ETF,1,True,6/18/2025,2025-06-18,yfinance,31.24515749042393,31.313914218678704,31.156755447387695,392900,235460.0,1.6686486027350718,0.0031535974906607084,0.0022005563030317644,-0.0050188159229632105,0.000315371198330333
CAI,"CARIS LIFE SCIENCES, INC.",FAI,First Trust Bloomberg Artificial Intelligence ETF,1,True,6/18/2025,2025-06-18,yfinance,33.81999969482422,33.81999969482422,33.54899978637695,1900,2800.0,0.6785714285714286,0.008949857785311072,0.0,-0.008013007418469586,0.0008651350900135392
AIRO,"AIRO GROUP HOLDINGS, INC.",AIRI,Air Industries Group Common Stock,1,True,6/13/2025,2025-06-13,yfinance,3.5199999809265137,3.5799999237060547,3.4100000858306885,32900,57660.0,0.5705861949358307,-0.005649712187014997,0.017045438382004816,-0.047485989245323934,-0.03672312921559748
ASIC,ATEGRITY SPECIALTY INSURANCE CO HOLDINGS,ASIX,AdvanSix Inc. Common Stock ,1,True,6/11/2025,2025-06-11,yfinance,24.271075508513725,24.388704874822,24.320087432861328,138000,132040.0,1.0451378370190851,0.006504066361199928,0.00484648347235431,-0.0028134926521461304,0.008536555656482533
JEM,707 CAYMAN HOLDINGS LTD.,JSM,"Navient Corporation - 6% Senior Notes due December 15, 2043",1,True,6/09/2025,2025-06-09,yfinance,17.169219025014044,17.32950286306479,17.32007598876953,7200,16420.0,0.438489646772229,-0.00273837623910361,0.00933553458763765,-0.0005439783454694397,0.006024040992061782
JEM,707 CAYMAN HOLDINGS LTD.,MEM,Matthews Emerging Markets Equity Active ETF,1,True,6/09/2025,2025-06-09,yfinance,30.530648457144967,30.64833348833083,30.647369384765625,3200,4460.0,0.7174887892376681,0.0038058443585316333,0.0038546521981364275,-3.145696537049912e-05,0.0076434683601648646
JEM,707 CAYMAN HOLDINGS LTD.,NEM,Newmont Corporation,1,True,6/09/2025,2025-06-09,yfinance,52.03520965026214,53.29733224967625,52.949501037597656,8173300,12123040.0,0.674195581306339,7.320423979490453e-08,0.02425516506798113,-0.006526240571463286,0.01757070394466801
OMDA,"OMADA HEALTH, INC.",KMDA,Kamada Ltd. - Ordinary Shares,1,True,6/06/2025,2025-06-06,yfinance,6.78000020980835,6.900000095367432,6.849999904632568,74900,59820.0,1.2520896021397525,0.0,0.017699097617354508,-0.007246404354172798,0.010324438445142383
CRCL,"CIRCLE INTERNET GROUP, INC.",CRVL,CorVel Corp. - Common Stock,1,True,6/05/2025,2025-06-05,yfinance,110.86000061035156,111.2300033569336,109.55999755859375,86900,122560.0,0.7090404699738904,-0.004400519716966245,0.0033375676036888117,-0.015013986765610781,-0.016075446251068954
SI,"SHOULDER INNOVATIONS, INC.",SJ,Scienjoy Holding Corporation - Class A Ordinary Shares,1,True,7/31/2025,2025-07-31,yfinance,0.8870000243186951,0.8870000243186951,0.8399999737739563,37300,15960.0,2.337092731829574,0.05595244287160712,0.0,-0.05298765417829556,0.0
SI,"SHOULDER INNOVATIONS, INC.",AI,"C3.ai, Inc. Class A Common Stock",1,True,7/31/2025,2025-07-31,yfinance,24.510000228881836,24.670000076293945,23.559999465942383,6026300,9545000.0,0.6313567312729178,0.011973613697315104,0.006527941489921752,-0.04499394434206717,-0.027250200913432592
SI,"SHOULDER INNOVATIONS, INC.",SO,Southern Company (The) Common Stock,1,True,7/31/2025,2025-07-31,yfinance,93.36553306557568,94.36925614087382,92.971923828125,12682300,4896240.0,2.5902120811071354,-0.0002107688411022674,0.010750466926517422,-0.014807071390526668,-0.004425667679750317
SI,"SHOULDER INNOVATIONS, INC.",SU,Suncor Energy  Inc. Common Stock,1,True,7/31/2025,2025-07-31,yfinance,39.29999923706055,39.720001220703125,39.459999084472656,3013700,3031280.0,0.9942004697685466,-0.009826137645315798,0.0106870735825997,-0.006545874326281458,-0.005794899223845079
FIG,"FIGMA, INC.",GIG,GigCapital7 Corp. - Class A Ordinary Share,1,True,7/31/2025,2025-07-31,yfinance,10.380000114440918,10.380000114440918,10.369999885559082,3800,247340.0,0.015363467291986739,0.0004819387412932982,0.0,-0.0009634131764529912,-0.0004819387412932982
FIG,"FIGMA, INC.",CIG,Comp En De Mn Cemig ADS American Depositary Shares,1,True,7/31/2025,2025-07-31,yfinance,1.809999942779541,1.840000033378601,1.809999942779541,2318000,2325400.0,0.9968177517846392,-0.016304396768935924,0.01657463621407091,-0.016304396768935924,-0.016304396768935924
FIG,"FIGMA, INC.",DIG,ProShares Ultra Energy,1,True,7/31/2025,2025-07-31,yfinance,34.238751853475584,35.20572477582162,34.406490325927734,143000,47320.0,3.021978021978022,-0.01894258462981658,0.028242061114966733,-0.02270183201689917,-0.014136303345198296
FIG,"FIGMA, INC.",RIG,Transocean Ltd (Switzerland) Common Stock,1,True,7/31/2025,2025-07-31,yfinance,2.9000000953674316,3.0,2.9200000762939453,24100700,26798380.0,0.899334213486039,-0.016949136104436064,0.03448272460139292,-0.026666641235351562,-0.010169481662661638
FIG,"FIGMA, INC.",VIG,Vanguard Div Appreciation ETF,1,True,7/31/2025,2025-07-31,yfinance,206.03717861224683,206.81093282586568,204.41030883789062,693200,882420.0,0.7855669635774348,0.00014447460860085402,0.0037554106439936074,-0.011607819544029485,-0.00775266719216242
YMAT,"J-STAR HOLDING CO., LTD.",TMAT,Main Thematic Innovation ETF,1,True,7/30/2025,2025-07-30,yfinance,24.694264783168432,24.769246222082927,24.63427734375,18400,14560.0,1.2637362637362637,0.008986937288193499,0.00303639082081935,-0.005449050694671364,0.006535900850946765
LHAI,LINKHOME HOLDINGS INC.,LNAI,Lunai Bioworks Inc. - Common Stock,1,True,7/24/2025,2025-07-24,yfinance,3.200000047683716,3.369999885559082,3.259999990463257,139110,121460.0,1.1453153301498435,-0.058823541786431094,0.05312494854442852,-0.03264091953450504,-0.04117650028743462
ARX,ACCELERANT HOLDINGS,ADX,Adams Diversified Equity Fund Inc.,1,True,7/24/2025,2025-07-24,yfinance,21.194685909676625,21.271478176959537,21.127492904663086,303500,327120.0,0.9277940816825629,0.0022695574820519784,0.003623184962974674,-0.006768935900863269,-0.000907913686325292
MH,"MCGRAW HILL, INC.",MB,MasterBeef Group - Ordinary Shares,1,True,7/24/2025,2025-07-24,yfinance,14.960000038146973,16.0,14.880000114440918,38500,36060.0,1.0676650027731558,-0.018372686166428186,0.06951871385034084,-0.06999999284744263,-0.023622025071121953
MH,"MCGRAW HILL, INC.",MU,"Micron Technology, Inc. - Common Stock",1,True,7/24/2025,2025-07-24,yfinance,110.94566654590871,112.61395315229545,111.61498260498047,20293100,24393940.0,0.8318910352325208,0.011199042662684658,0.015036969521440622,-0.00887075286278253,0.017299431972546207
MH,"MCGRAW HILL, INC.",MG,Mistras Group Inc Common Stock,1,True,7/24/2025,2025-07-24,yfinance,8.229999542236328,8.329999923706055,8.260000228881836,89900,114220.0,0.7870775696025214,-0.009627060570480832,0.012150715313715994,-0.00840332478575529,-0.00601686982070809
MH,"MCGRAW HILL, INC.",MJ,Amplify Alternative Harvest ETF,1,True,7/24/2025,2025-07-24,yfinance,21.75,21.959999084472656,21.829999923706055,36100,54300.0,0.6648250460405156,-0.008660005899392665,0.009655130320581896,-0.005919816310854065,-0.005013701352504882
CRE,CRE8 ENTERPRISE LTD,CDE,"Coeur Mining, Inc. Common Stock",1,True,7/23/2025,2025-07-23,yfinance,9.5600004196167,9.59000015258789,9.510000228881836,11714500,9467000.0,1.237403612548854,-0.0010448563768426743,0.0031380472441856046,-0.008342014852259045,-0.006269536871023367
CRE,CRE8 ENTERPRISE LTD,CEE,"The Central and Eastern Europe Fund, Inc. (The) Common Stock",1,True,7/23/2025,2025-07-23,yfinance,15.770000457763672,15.979999542236328,15.930000305175781,10000,17900.0,0.5586592178770949,0.001269870334201389,0.013316365147552824,-0.0031288634851581298,0.011428590804811508
CRE,CRE8 ENTERPRISE LTD,CRS,Carpenter Technology Corporation Common Stock,1,True,7/23/2025,2025-07-23,yfinance,275.4336037692941,281.4036914256983,273.3769836425781,512800,815380.0,0.6289092202408693,0.005356758327539588,0.021675233430866313,-0.02852381837087429,-0.002150085120067584
CRE,CRE8 ENTERPRISE LTD,VRE,"Veris Residential, Inc. Common Stock",1,True,7/23/2025,2025-07-23,yfinance,14.362934736246693,14.53202753901131,14.452454566955566,514800,437100.0,1.1777625257378175,-0.00687760290605999,0.011772858811221176,-0.0054756964809025525,-0.0006877711973160174
CARL,"CARLSMED, INC.",CADL,"Candel Therapeutics, Inc. - Common Stock",1,True,7/23/2025,2025-07-23,yfinance,6.699999809265137,7.130000114440918,6.960000038146973,977100,1063740.0,0.9185515257487732,0.0044977110386871496,0.06417915185328105,-0.02384292756877122,0.043478254653058435
TDIC,DREAMLAND LTD,TDOC,"Teladoc Health, Inc. Common Stock",1,True,7/23/2025,2025-07-23,yfinance,8.600000381469727,8.90999984741211,8.579999923706055,11515700,6585800.0,1.7485650945974673,0.021377708259476432,0.036046447929273744,-0.03703702910858101,0.019002357002653753
LAWR,"ROBOT CONSULTING CO., LTD.",LASR,"nLIGHT, Inc. - Common Stock",1,True,7/17/2025,2025-07-17,yfinance,19.450000762939453,19.75,19.15999984741211,369100,474180.0,0.7783963895567084,0.0,0.015424124693721009,-0.029873425447488132,-0.01491007219289776
BMHL,BLUEMOUNT HOLDINGS LTD,BMBL,Bumble Inc. - common stock,1,True,7/11/2025,2025-07-11,yfinance,6.599999904632568,6.775000095367432,6.519999980926514,1479500,1959060.0,0.755209130909722,-0.011976036790700247,0.026515180797507268,-0.037638392745600165,-0.023952073581400495
MSGY,MASONGLORY LTD,MAGY,Roundhill Magnificent Seven Covered Call ETF,1,True,7/08/2025,2025-07-08,yfinance,47.8806118921971,47.8806118921971,47.67765808105469,34500,23940.0,1.4411027568922306,0.00407884531456839,0.0,-0.0042387472323738,-0.00017719111209381737
MAMK,MAXSMAKING INC.,MAMO,Massimo Group - Common Stock,1,True,7/07/2025,2025-07-07,yfinance,2.8299999237060547,2.8299999237060547,2.4800000190734863,35300,106440.0,0.3316422397594889,0.014336904085998865,0.0,-0.12367488129618834,-0.11111109212118021
COSO,"COASTALSOUTH BANCSHARES, INC.",CISO,"CISO Global, Inc. - Common Stock",1,True,7/02/2025,2025-07-02,yfinance,1.1699999570846558,1.25,1.2000000476837158,688600,926000.0,0.7436285097192225,0.0,0.06837610756387046,-0.039999961853027344,0.0256411040166298
COSO,"COASTALSOUTH BANCSHARES, INC.",CPSO,Calamos S&P 500 Structured Alt Protection ETF - October,1,True,7/02/2025,2025-07-02,yfinance,26.239999771118164,26.239999771118164,26.239999771118164,1100,280.0,3.9285714285714284,0.0007627939850282585,0.0,0.0,0.0007627939850282585
CV,"CAPSOVISION, INC",CG,The Carlyle Group Inc. - Common Stock,1,True,7/02/2025,2025-07-02,yfinance,52.13044188239157,53.99753497477619,53.79008102416992,3122700,2857200.0,1.0929231415371692,-0.0009466183554731184,0.035815792557386206,-0.0038419152041509427,0.030859520956446593
CV,"CAPSOVISION, INC",FV,First Trust Dorsey Wright Focus 5 ETF,1,True,7/02/2025,2025-07-02,yfinance,59.25586246448357,59.435184478759766,59.435184478759766,120100,136800.0,0.8779239766081871,-0.0008398729158609042,0.0030262324573146885,0.0,0.0021838178907757863
CV,"CAPSOVISION, INC",CB,Chubb Limited  Common Stock,1,True,7/02/2025,2025-07-02,yfinance,288.1700134277344,288.489990234375,280.0799865722656,2546700,2166740.0,1.1753602185772174,-0.004903425284412893,0.0011103750970982516,-0.029151804037557495,-0.03283956588931621
CV,"CAPSOVISION, INC",CC,Chemours Company (The) Common Stock,1,True,7/02/2025,2025-07-02,yfinance,12.406972811308584,12.688276347021882,12.564897537231445,4413000,8500160.0,0.5191666980386251,0.017813693877207427,0.022673019437658263,-0.009723843208963131,0.030769146515870805
CV,"CAPSOVISION, INC",CF,"CF Industries Holdings, Inc. Common Stock",1,True,7/02/2025,2025-07-02,yfinance,92.17331601306621,93.23073451370523,92.74649810791016,2526700,2937460.0,0.860164904373166,0.008433329501874589,0.01147206747437751,-0.00519395678175086,0.01470429764445936
CV,"CAPSOVISION, INC",DV,"DoubleVerify Holdings, Inc. Common Stock",1,True,7/02/2025,2025-07-02,yfinance,15.079999923706055,15.270000457763672,15.119999885559082,2163700,2048160.0,1.0564116084680883,0.0013279882823445822,0.012599504974726998,-0.00982321988918642,0.003984028172019791
CV,"CAPSOVISION, INC",VV,Vanguard Large-Cap ETF,1,True,7/02/2025,2025-07-02,yfinance,283.3356119767895,284.7181396484375,284.7181396484375,401600,330420.0,1.215422795230313,-0.0006314892782337991,0.0048794701873242155,0.0,0.004244899575983659
CV,"CAPSOVISION, INC",XV,Simplify Target 15 Distribution ETF,1,True,7/02/2025,2025-07-02,yfinance,23.68126628264646,23.947446937396023,23.592538833618164,124400,12760.0,9.74921630094044,0.006789835770175838,0.011240136045622597,-0.014820289808164865,0.0030176602129520663
PMI,"PICARD MEDICAL, INC.",OMI,"Owens & Minor, Inc. Common Stock",1,True,8/29/2025,2025-08-29,yfinance,4.949999809265137,4.989999771118164,4.900000095367432,1157800,1695220.0,0.6829792003397789,-0.002016175162283258,0.008080800685720759,-0.018036007991752916,-0.01209676256413027
PMI,"PICARD MEDICAL, INC.",PNI,Pimco New York Municipal Income Fund II Common Shares of Beneficial Interest,1,True,8/29/2025,2025-08-29,yfinance,6.437792444397662,6.506592977730003,6.486935615539551,18200,54100.0,0.3364140480591497,-0.007575714336391107,0.010686975997838114,-0.003021145207289472,0.0
THH,TRYHARD HOLDINGS LTD,TBH,"Brag House Holdings, Inc. - Common Stock",1,True,8/28/2025,2025-08-28,yfinance,1.1399999856948853,1.2000000476837158,1.184999942779541,158100,63420.0,2.492904446546831,-0.008695644061371431,0.05263163398397555,-0.012500086923436843,0.03043475421480001
THH,TRYHARD HOLDINGS LTD,THG,Hanover Insurance Group Inc,1,True,8/28/2025,2025-08-28,yfinance,173.0719726205072,173.0719726205072,171.6761474609375,130300,175340.0,0.7431276377324056,0.001088055635926845,0.0,-0.008064998268843444,-0.006985717799736755
CURX,CURANEX PHARMACEUTICALS INC,CYRX,"CryoPort, Inc. - Common Stock",1,True,8/26/2025,2025-08-26,yfinance,8.859999656677246,9.050000190734863,8.789999961853027,274200,440600.0,0.622333182024512,0.005675282029410189,0.02144475636795598,-0.02872930645327686,-0.002270199411016832
ETS,ELITE EXPRESS HOLDING INC.,ETD,Ethan Allen Interiors Inc. Common Stock,1,True,8/21/2025,2025-08-21,yfinance,28.617269110108687,28.617269110108687,28.33207893371582,235500,267440.0,0.8805713431049955,-1.4183132454623078e-08,0.0,-0.00996566706961311,-0.009965681111401187
ETS,ELITE EXPRESS HOLDING INC.,WTS,"Watts Water Technologies, Inc. Class A Common Stock",1,True,8/21/2025,2025-08-21,yfinance,273.89710856358056,275.20223196674993,270.1909484863281,232200,152680.0,1.5208278752947342,-0.004850370596613657,0.004765013438856413,-0.01820945798516371,-0.018315952057950027
CEPF,"CANTOR EQUITY PARTNERS IV, INC.",CEPT,"Cantor Equity Partners II, Inc. - Class A ordinary share",1,True,8/21/2025,2025-08-21,yfinance,10.520000457763672,10.630000114440918,10.520000457763672,361000,197600.0,1.8269230769230769,0.0009514965427265139,0.010456240674026517,-0.010348039086830386,0.0009514965427265139
CEPF,"CANTOR EQUITY PARTNERS IV, INC.",CSPF,Cohen & Steers Preferred and Income Opportunities Active ETF,1,True,8/21/2025,2025-08-21,yfinance,25.174780712899704,25.27950062955658,25.256011962890625,43900,9300.0,4.720430107526882,-0.0026367902016468567,0.004159715147120105,-0.0009291586495380406,0.0005813931521951861
MAGH,MAGNITUDE INTERNATIONAL LTD,MAGN,Magnera Corporation Common Stock,1,True,8/12/2025,2025-08-12,yfinance,12.890000343322754,13.5600004196167,13.479999542236328,625400,989760.0,0.6318703524086647,0.0031128374058812538,0.05197828226909374,-0.005899769535746996,0.04902717058865527
WYFI,"WHITEFIBER, INC.",SYFI,AB Short Duration High Yield ETF,1,True,8/07/2025,2025-08-07,yfinance,26.52046553952395,26.52046553952395,26.04136085510254,12700,2409980.0,0.005269753275960796,0.01528464811751037,0.0,-0.018065470370698913,-0.0030569466108819852
FLY,FIREFLY AEROSPACE INC.,DLY,DoubleLine Yield Opportunities Fund Common Shares of Beneficial Interest,1,True,8/07/2025,2025-08-07,yfinance,14.856141976615001,14.894604443908458,14.83691120147705,152300,112680.0,1.3516151934682286,0.0019455114827157715,0.0025889943266562744,-0.003873432332404243,0.0006485267835837245
FLY,FIREFLY AEROSPACE INC.,FLG,"Flagstar Bank, N.A. Common Stock",1,True,8/07/2025,2025-08-07,yfinance,11.41218848905276,11.561954357315976,11.35228157043457,8891400,6532580.0,1.361085512921388,0.011504381880562098,0.013123325855236317,-0.01813471843959776,0.006194610600023922
FLY,FIREFLY AEROSPACE INC.,RLY,State Street Multi-Asset Real Return ETF,1,True,8/07/2025,2025-08-07,yfinance,28.9462072319648,28.9462072319648,28.926681518554688,35200,41300.0,0.8523002421307506,0.005766605671282994,0.0,-0.0006745517039119831,0.0050881640936896585
CTW,CTW CAYMAN,CGW,Invesco S&P Global Water Index ETF,1,True,8/06/2025,2025-08-06,yfinance,62.06632383805097,62.223827445722414,62.125389099121094,19800,19040.0,1.0399159663865547,0.0012703885636843593,0.002537666127647846,-0.0015820040431808419,0.002223245012160554
CTW,CTW CAYMAN,CTS,CTS Corporation Common Stock,1,True,8/06/2025,2025-08-06,yfinance,38.566268739030185,38.70600098980057,38.336708068847656,220000,217080.0,1.0134512622074812,-0.007449204507187173,0.0036231726671803514,-0.00954097327311669,-0.013357233291235478
CTW,CTW CAYMAN,DTW,DTE Energy Company 2017 Series E 5.25% Junior Subordinated Debentures due 2077,1,True,8/06/2025,2025-08-06,yfinance,22.422297406995582,22.422297406995582,22.286346435546875,18200,27860.0,0.6532663316582915,0.0013010098251543107,0.0,-0.006063204362202949,-0.004770082825495783
CTW,CTW CAYMAN,FTW,EQV Ventures Acquisition Corp. Class A Ordinary Shares,1,True,8/06/2025,2025-08-06,yfinance,10.479999542236328,10.489999771118164,10.390000343322754,238700,130300.0,1.831926323867997,0.0,0.0009542203548323808,-0.009532834125577,-0.008587710195106485
APACU,STONEBRIDGE ACQUISITION II CORP,APADU,A Paradise Acquisition Corp. - Unit,1,True,9/30/2025,2025-09-30,yfinance,10.029999732971191,10.100000381469727,9.979999542236328,2100,6320.0,0.3322784810126582,0.0,0.00697912765325656,-0.011881270762480528,-0.0049850640145582235
MGN,MEGAN HOLDINGS LTD.,MGM,MGM Resorts International Common Stock,1,True,9/26/2025,2025-09-26,yfinance,34.529998779296875,35.79999923706055,35.599998474121094,4411100,5290140.0,0.8338342652557399,0.0014500939015181897,0.03677962648886988,-0.005586613608986063,0.03248256806131396
MGN,MEGAN HOLDINGS LTD.,MHN,"Blackrock MuniHoldings New York Quality Fund, Inc. Common Stock",1,True,9/26/2025,2025-09-26,yfinance,9.948903777506048,9.988305337560423,9.96860408782959,463400,258520.0,1.792511217700758,-0.0029614618247377567,0.003960392113094821,-0.001972431665334409,-0.0009871771149999695
MGN,MEGAN HOLDINGS LTD.,MTN,"Vail Resorts, Inc. Common Stock",1,True,9/26/2025,2025-09-26,yfinance,145.3037880325299,147.6200598611936,145.61920166015625,551100,790600.0,0.6970655198583354,0.004360278107771766,0.015940890874401335,-0.013554107774503972,0.006540461591294348
MGN,MEGAN HOLDINGS LTD.,MYN,"Blackrock MuniYield New York Quality Fund, Inc.Common Stock",1,True,9/26/2025,2025-09-26,yfinance,9.671133922518036,9.720376137973824,9.690831184387207,43800,152100.0,0.2879684418145957,-1.0611085852951214e-07,0.005091669275836775,-0.0030394866584633807,0.0020366002295649703
PTRN,PATTERN GROUP INC.,LTRN,Lantern Pharma Inc. - Common Stock,1,True,9/19/2025,2025-09-19,yfinance,4.070000171661377,4.144000053405762,4.03000020980835,69800,210200.0,0.33206470028544244,0.0,0.018181788359526767,-0.027509614413185376,-0.009828000040771332
PTRN,PATTERN GROUP INC.,PTEN,"Patterson-UTI Energy, Inc. - Common Stock",1,True,9/19/2025,2025-09-19,yfinance,5.394681372361709,5.414405966272173,5.276333808898926,15244500,6990900.0,2.1806205209629663,-0.010849965131464842,0.003656303783114603,-0.025500887490398135,-0.03254976321881128
NTSK,NETSKOPE INC,NTWK,NETSOL Technologies Inc. - Common Stock,1,True,9/18/2025,2025-09-18,yfinance,5.010000228881836,5.190000057220459,5.099999904632568,40900,571180.0,0.07160614867467348,0.0,0.035928107807451454,-0.017341069671604366,0.017964006315189157
WBI,WATERBRIDGE INFRASTRUCTURE LLC,ABI,VictoryShares Pioneer Asset-Based Income ETF,1,True,9/17/2025,2025-09-17,yfinance,24.53539276123047,24.53539276123047,24.53539276123047,100,100.0,1.0,-0.0001995930416020917,0.0,0.0,-0.0001995930416020917
WBI,WATERBRIDGE INFRASTRUCTURE LLC,EBI,Longview Advantage ETF,1,True,9/17/2025,2025-09-17,yfinance,54.369998931884766,54.400001525878906,54.23099899291992,600,3340.0,0.17964071856287425,0.0014366594572551127,0.0005518225967178728,-0.003106664121665278,-0.001123569295298406
WBI,WATERBRIDGE INFRASTRUCTURE LLC,SBI,Western Asset Intermediate Muni Fund Inc Common Stock,1,True,9/17/2025,2025-09-17,yfinance,7.751580715179443,7.780942501709733,7.751580715179443,38600,65020.0,0.59366348815749,0.0,0.003787845035631527,-0.0037735514076653017,0.0
LGN,LEGENCE CORP.,OGN,Organon & Co. Common Stock ,1,True,9/12/2025,2025-09-12,yfinance,10.541623307868225,10.68623449512886,10.621408462524414,2698200,3514380.0,0.7677598893688218,-0.008442804590602036,0.013718113713349786,-0.006066312004850284,-0.0009381213102624982
VIA,"VIA TRANSPORTATION, INC.",CIA,"Citizens, Inc. Class A Common Stock ($1.00 Par)",1,True,9/12/2025,2025-09-12,yfinance,5.349999904632568,5.460000038146973,5.449999809265137,126900,158400.0,0.8011363636363636,-0.01654414552228438,0.02056077298602475,-0.0018315437384556939,0.0018381896947602346
FIGR,"FIGURE TECHNOLOGY SOLUTIONS, INC.",TIGR,UP Fintech Holding Limited - American Depositary Shares representing fifteen Class A Ordinary Shares,1,True,9/11/2025,2025-09-11,yfinance,11.489999771118164,11.65999984741211,11.239999771118164,5797900,5582060.0,1.0386667287703824,0.02589285417783012,0.01479548126025781,-0.03602059020499582,0.003571425226269879
ZGM,ZENTA GROUP CO LTD,AGM,Federal Agricultural Mortgage Corporation Common Stock,1,True,9/09/2025,2025-09-09,yfinance,198.9966290325728,199.4198304369744,196.5853271484375,40000,76160.0,0.5252100840336135,-0.005948777857894233,0.0021266762480299287,-0.014213748363569709,-0.01799399488760537
MPLT,"MAPLIGHT THERAPEUTICS, INC.",KPLT,"Katapult Holdings, Inc. - Common Stock",1,True,10/27/2025,2025-10-27,yfinance,12.40999984741211,12.5600004196167,12.329999923706055,45000,59420.0,0.7573207674183776,-0.011155405672910687,0.01208707284842311,-0.01831214078236978,-0.01752990148886416
LAFAU,LAFAYETTE ACQUISITION CORP.,LATAU,Galata Acquisition Corp. II - Units,1,True,10/24/2025,2025-10-24,yfinance,10.09000015258789,10.09000015258789,10.09000015258789,0,8220.0,0.0,0.0,0.0,0.0,0.0
MCTA,CHARMING MEDICAL LTD,MCGA,Yorkville Acquisition Corp. - Class A Ordinary Share,1,True,10/21/2025,2025-10-21,yfinance,10.4399995803833,10.470000267028809,10.470000267028809,171200,179100.0,0.9558905639307649,-0.0019120896453854153,0.0028736291045335796,0.0,0.0009560448226927077
BGIN,BGIN BLOCKCHAIN LTD,BFIN,BankFinancial Corporation - Common Stock,1,True,10/21/2025,2025-10-21,yfinance,11.498513557645952,11.498513557645952,11.409300804138184,12800,24560.0,0.5211726384364821,0.007819300677514815,0.0,-0.007758633588638585,0.0
BGIN,BGIN BLOCKCHAIN LTD,BBIN,JPMorgan BetaBuilders International Equity ETF,1,True,10/21/2025,2025-10-21,yfinance,69.92536597989869,70.11186219902845,69.79776763916016,77300,53420.0,1.4470235866716585,-0.005583486952647622,0.0026670753383454112,-0.004479906110276545,-0.0073980773418393245
ACCL,ACCO GROUP HOLDINGS LTD,ACCO,Acco Brands Corporation Common Stock,1,True,10/17/2025,2025-10-17,yfinance,3.7030732614862174,3.7812383225359767,3.7226145267486572,380200,582000.0,0.6532646048109966,-0.005249338904693745,0.02110815950165349,-0.01550386164181316,0.0
SEV,APTERA MOTORS CORP,EEV,ProShares UltraShort MSCI Emerging Markets,1,True,10/16/2025,2025-10-16,yfinance,19.282452913917243,19.51904720902419,19.499332427978516,4750,15360.0,0.3092447916666667,-0.023952095550297463,0.01226992728379404,-0.0010100278376579841,-0.012973990422148043
SEV,APTERA MOTORS CORP,SEB,Seaboard Corporation Common Stock,1,True,10/16/2025,2025-10-16,yfinance,3435.8016989626612,3482.2339773309436,3437.75048828125,1500,2080.0,0.7211538461538461,-0.002069689614993509,0.0135142486198494,-0.012774411294380983,-0.0015036627892423546
SEV,APTERA MOTORS CORP,SEG,Seaport Entertainment Group Inc. Common Stock,1,True,10/16/2025,2025-10-16,yfinance,24.229999542236328,24.395000457763672,24.18000030517578,55200,83100.0,0.6642599277978339,-0.008592511752552894,0.006809777905266722,-0.00881328749963057,-0.010638307004925003
SEV,APTERA MOTORS CORP,SRV,NXG Cushing Midstream Energy Fund Common Shares of Beneficial Interest,1,True,10/16/2025,2025-10-16,yfinance,40.359966524993325,40.69382710472534,38.913238525390625,59900,27160.0,2.2054491899852726,0.0011502746675732672,0.008272072761142274,-0.043755741497411314,-0.03473657705403509
SLGB,SMART LOGISTICS GLOBAL LTD,SLGN,Silgan Holdings Inc. Common Stock,1,True,10/15/2025,2025-10-15,yfinance,43.1909795527131,43.45961775339232,42.713401794433594,993100,1155180.0,0.8596928617185201,-0.0002302770376382871,0.0062197755980819185,-0.017170329550367052,-0.011285080332973535
LFS,"LEIFRAS CO., LTD.",OFS,OFS Capital Corporation - Closed End Fund,1,True,10/09/2025,2025-10-09,yfinance,7.180867597565441,7.287179362401387,7.016568183898926,94600,53360.0,1.772863568215892,-0.006684524403993447,0.01480486353375875,-0.037135243287505046,-0.029411743365895787
LFS,"LEIFRAS CO., LTD.",KFS,"Kingsway Financial Services, Inc. Common Stock (DE)",1,True,10/09/2025,2025-10-09,yfinance,15.010000228881836,15.199999809265137,15.050000190734863,40100,49240.0,0.814378554021121,-0.0039813846819777695,0.012658199699271738,-0.009868396079771092,-0.0013271071330030807
LFS,"LEIFRAS CO., LTD.",LVS,Las Vegas Sands Corp. Common Stock,1,True,10/09/2025,2025-10-09,yfinance,52.765437915030596,52.765437915030596,51.64997482299805,5423300,5150020.0,1.0530638715966152,-0.0054439762504187045,0.0,-0.02114003287206305,-0.026468923285593172
LFS,"LEIFRAS CO., LTD.",PFS,"Provident Financial Services, Inc Common Stock",1,True,10/09/2025,2025-10-09,yfinance,19.112193260030242,19.131935829679147,18.983856201171875,385500,649100.0,0.5938992451086119,-0.0005162272293958886,0.0010329829434172237,-0.007739918731985181,-0.007227691791775527
ALH,ALLIANCE LAUNDRY HOLDINGS INC.,ALB,Albemarle Corporation Common Stock,1,True,10/09/2025,2025-10-09,yfinance,95.33226839968528,99.55950749979519,96.2096176147461,5594900,2770500.0,2.01945497202671,0.04286183073931194,0.044342164212300104,-0.03364711185474663,0.05245935762055673
ALH,ALLIANCE LAUNDRY HOLDINGS INC.,ALG,"Alamo Group, Inc. Common Stock",1,True,10/09/2025,2025-10-09,yfinance,188.89030486257775,188.89030486257775,185.18638610839844,56600,71840.0,0.7878619153674833,-0.0013723625553452759,0.0,-0.01960883464545204,-0.02095428677037594
ALH,ALLIANCE LAUNDRY HOLDINGS INC.,APH,Amphenol Corporation Common Stock,1,True,10/09/2025,2025-10-09,yfinance,125.8672890963752,126.2465550064561,126.00701904296875,3322800,6533900.0,0.5085477280031834,0.002543922403119538,0.003013220613582164,-0.0018973663358584805,0.0036568836001133944
POM,POMDOCTOR LTD,PIM,Putnam Master Intermediate Income Trust Common Stock,1,True,10/08/2025,2025-10-08,yfinance,3.362836050899502,3.362836050899502,3.353031873703003,27700,45560.0,0.6079894644424935,0.00586511844431774,0.0,-0.0029154490579095353,0.00293256993236519
CBK,"COMMERCIAL BANCGROUP, INC.",CBL,"CBL & Associates Properties, Inc. Common Stock",1,True,10/02/2025,2025-10-02,yfinance,30.179670647361302,30.209257355456604,29.71612548828125,144100,112980.0,1.2754469817666845,-0.002282347925724209,0.000980352252382465,-0.016323865938607088,-0.017606808989323753
CBK,"COMMERCIAL BANCGROUP, INC.",CNK,"Cinemark Holdings Inc Cinemark Holdings, Inc. Common Stock",1,True,10/02/2025,2025-10-02,yfinance,27.718984906982357,27.918331121860675,27.728952407836914,2374200,2614600.0,0.908054769371988,-0.007494693593269921,0.007191685249199119,-0.006783310692789687,-0.00713779749758101
CBK,"COMMERCIAL BANCGROUP, INC.",FBK,FB Financial Corporation Common Stock,1,True,10/02/2025,2025-10-02,yfinance,55.717068238052505,56.70365366508635,56.61396408081055,319400,466680.0,0.6844090168852318,-0.0016071645148681766,0.01770705922319234,-0.0015817249591277493,0.014464290999628352
CBK,"COMMERCIAL BANCGROUP, INC.",VBK,Vanguard Small-Cap Growth ETF,1,True,10/02/2025,2025-10-02,yfinance,299.37429266442285,301.40174703860686,301.0721740722656,211200,163120.0,1.2947523295733203,0.003515186180909202,0.006772306186144829,-0.001093467339122677,0.009206555877152082
NP,NEPTUNE INSURANCE HOLDINGS INC.,BP,BP p.l.c. Common Stock,1,True,10/01/2025,2025-10-01,yfinance,34.18602383670546,34.30438178142132,33.9887580871582,5595000,5548400.0,1.008398817677168,0.0058038528222008785,0.003462173468351123,-0.009200681600216252,0.0
NP,NEPTUNE INSURANCE HOLDINGS INC.,HP,"Helmerich & Payne, Inc. Common Stock",1,True,10/01/2025,2025-10-01,yfinance,21.87016324344341,23.2178495040167,22.900747299194336,1915000,1807160.0,1.0596737422253701,-0.0009053904139787187,0.06162213997087203,-0.013657690595656012,0.046174778278165546
NP,NEPTUNE INSURANCE HOLDINGS INC.,MP,MP Materials Corp. Common Stock,1,True,10/01/2025,2025-10-01,yfinance,66.04000091552734,67.98999786376953,67.62999725341797,8046800,15777960.0,0.5100025605338079,-0.015357071477314467,0.029527512435023356,-0.0052949054517237954,0.00834944924916952
NP,NEPTUNE INSURANCE HOLDINGS INC.,NL,"NL Industries, Inc. Common Stock",1,True,10/01/2025,2025-10-01,yfinance,6.0463485258546426,6.183988846703199,6.066011428833008,18200,21380.0,0.8512628624883068,-7.59511309216487e-09,0.02276420557961494,-0.019077883352439668,0.0032520217487037968
CBC,"CENTRAL BANCOMPANY, INC.",CGC,Canopy Growth Corporation - Common Shares,1,True,11/20/2025,2025-11-20,yfinance,1.0800000429153442,1.1100000143051147,1.0099999904632568,29640200,22018300.0,1.346162056107874,0.02857151615376773,0.027777750183035924,-0.0900901104082059,-0.038095203494807814
CBC,"CENTRAL BANCOMPANY, INC.",CNC,Centene Corporation Common Stock,1,True,11/20/2025,2025-11-20,yfinance,36.0099983215332,36.279998779296875,34.83000183105469,8321300,7738740.0,1.0752784044947885,0.0016689167543940907,0.0074979303068230755,-0.03996684115297231,-0.03115435071254193
